taxid,date,name
950097,4/28/2017,EQUAL EMPLOYMENT OPPORTUNITY TRANSGENDER DIVERSITY AND INCLUSION:EXECUTIVE ORDER 16
950097,1/27/2017,BTK (BELT TRAUMA KIT DISTRIBUTION AND FAMILIARIZATION)
950097,1/19/2017,HATE CRIMES AND BIAS-RELATED INCIDENTS
950097,12/1/2016,FORCE POLICY REVISION-VIDEO-PG 221-UNIT TRAINING MAY 2016
950097,11/16/2016,PUBLIC CONTACT AND CONSENT TO SEARCH (RIGHT TO KNOW) - UNIT TRAINING AUGUST 2016
950097,11/15/2016,PUBLIC CONTACT AND CONSENT TO SEARCH (RIGHT TO KNOW) - UNIT TRAINING AUGUST 2016
950097,9/1/2016,INVESTIGATIVE ENCOUNTERS-VIDEO #2 COMMON LAW RIGHT OF INQUIRY-UNIT TRAINING MAY 2016
950097,9/1/2016,INVESTIGATIVE ENCOUNTERS-VIDEO #3 TERRY STOPS AND REASONABLE SUSPICION-UNIT TRAINING JUNE 2016
950097,9/1/2016,INVESTIGATIVE ENCOUNTERS-VIDEO #4 DOCUMENTATION AND SUPERVISION-UNIT TRAINING JULY 2016
950097,5/23/2016,TACTICAL REVIEW - INTENTIONAL - ADVERSARIAL
950097,2/10/2016,INVESTIGATIVE ENCOUNTERS-VIDEO #1 REQUEST FOR INFO-UNIT TRAINING FEB 2016
950097,1/14/2016,WINDOWS PHONE TRAINING AND DISTRIBUTION
950097,1/6/2016,PSB MARIJUANA FIELD TESTING
950097,12/1/2015,FORCE POLICY REVISION-PAMPHLET - PG 221 - UNIT TRAINING DECEMBER 2015
950097,11/25/2015,FORCE POLICY REVISION-PAMPHLET - PG 221 - UNIT TRAINING DECEMBER 2015
950097,11/24/2015,FORCE POLICY REVISION-PAMPHLET - PG 221 - UNIT TRAINING DECEMBER 2015
950097,11/9/2015,EMERGENCY VEHICLE OPERATION JULY 07 - PRESENT
950097,11/9/2015,FIELD TRAINING PROGRAM JULY 07 - PRESENT
950097,11/9/2015,PHYSICAL EDUCATION PART 1: FOUNDATIONS OF PHYSICAL FITNESS
950097,11/9/2015,PHYSICAL EDUCATION PART 2: DEFENSIVE TACTICS JULY 07 - PRESENT
950097,11/9/2015,PHYSICAL EDUCATION PART 3: AMERICAN HEART ASSOCIATION BASIC LIFE SUPPORT
950097,11/9/2015,POLICE CRISIS INTERVENTION JULY 07 - PRESENT
950097,11/9/2015,POLICE FIELD PROBLEMS JULY 07 - PRESENT
950097,11/9/2015,POLICE INVESTIGATION AND REPORTING JULY 07 - PRESENT
950097,11/9/2015,POLICING A DEMOCRACY JULY 07 - PRESENT
950097,11/9/2015,POLICING SPECIAL POPULATIONS JULY 07 - PRESENT
950097,11/9/2015,PROCEDURAL LAW JULY 07 - PRESENT
950097,11/9/2015,SUBSTANTIVE LAW JULY 07 - PRESENT
950097,11/9/2015,TERRORISM AWARENESS AND RESPONSE JULY 07 - PRESENT
950097,10/21/2015,PLAIN CLOTHES TRAINING CERTIFIED BASIC PLAIN-CLOTHES COURSE
950097,10/14/2015,STREET NARCOTICS ENFORCEMENT UNIT SNEU
950097,10/13/2015,STREET NARCOTICS ENFORCEMENT UNIT SNEU
950097,10/12/2015,STREET NARCOTICS ENFORCEMENT UNIT SNEU
950097,6/15/2015,20K TRAINING INITIATIVE - PHYSICAL TACTICS
950097,6/5/2015,20K TRAINING INITIATIVE - SMART POLICING
950097,5/28/2015,20K TRAINING INITIATIVE - FOUNDATIONS OF POLICING
950097,10/24/2013,IN-TAC TRAINING PROGRAM
950097,6/7/2013,THREE WHEEL SCOOTER CERTIFIED
950097,6/7/2013,TWO WHEEL SCOOTER (WITH TACTICS) CERTIFIED
950097,11/29/2012,COBRA - COHORT TRAINING
950097,7/12/2012,PSB OPERATION LOSING PROPOSITION
950097,6/5/2012,UF 250 - OPERATION IMPACT REFRESHER CERTIFIED
950097,4/11/2012,DISORDER CONTROL TRAINING
950097,11/29/2011,COBRA - COHORT TRAINING
950097,11/16/2011,PROPERTY EVIDENCE TRACKING SYSTEM
950097,7/6/2011,12 PASSENGER VAN / UTILITY VEHICLE QUALIFICATION
950097,7/6/2011,FOUR WHEEL DRIVE TRAINING
950097,,FOUR WHEEL DRIVE TRAINING
950097,,RECRUIT 12 PASSENGER VAN / UTILITY VEHICLE QUALIFICATION
950097,,RECRUIT RMP QUALIFICATION / RMP OPERATOR QUALIFIED
950098,3/23/2025,RIGHT TO KNOW ACT SQF MODULE 9
950098,3/1/2025,2025 IDENTIFYING THE IMPAIRED DRIVER REFRESHER
950098,2/20/2025,FTS - COLT M4 RE-QUALIFICATION
950098,2/19/2025,FTS - TASER 7 ANNUAL RECERTIFICATION
950098,2/18/2025,FTS - TASER 7 ANNUAL RECERTIFICATION
950098,2/13/2025,ACTIVE SHOOTER - SCHOOL RESPONSE PROTOCOL
950098,1/31/2025,VEHICLE PURSUITS
950098,12/24/2024,INFORMATION SECURITY AWARENESS TRAINING 2024
950098,12/24/2024,NOTIFICATION OF ALLEGATIONS AND EMPLOYEE RIGHTS
950098,12/13/2024,BEHAVIORAL HEALTH EMERGENCY ASSISTANCE RESPONSE DIVISION B-HEARD
950098,12/8/2024,DRIVING WHILE INTOXICATED AWARENESS VIDEO MODULE 1
950098,12/8/2024,LEAVING THE SCENE COLLISIONS INVESTIGATIVE BEST PRACTICES
950098,12/5/2024,FTS - CEW TASER 7 TRANSITION COURSE
950098,12/5/2024,FTS - TASER 7 HOLSTER DISTRIBUTION
950098,11/3/2024,FAMILY BUILDING
950098,10/29/2024,NORTHWELL DIRECT FINEST CARE PROGRAM FOR UMOS
950098,10/9/2024,RACIAL PROFILING AND BIASED BASED POLICING: SQF MODULE 8
950098,9/1/2024,APX NEXT PORTABLE AND RADIO DISCIPLINE TRAINING VIDEO
950098,9/1/2024,MENTAL HEALTH INVOLUNTARY REMOVALS MHL 9.41 AND MHL 9.58
950098,9/1/2024,RAPE IS RAPE
950098,9/1/2024,UNMANNED AIRCRAFT SYSTEMS VISUAL OBSERVER
950098,6/27/2024,LEVEL 1 AND LEVEL 2 INVESTIGATIVE ENCOUNTERS
950098,6/11/2024,ACCURATE COMPLAINT REPORT CLASSIFICATION
950098,6/11/2024,TACTICS WHEN ENGAGING INDIVIDUALS IN A MENTAL HEALTH CRISIS
950098,6/5/2024,ASSISTING SURVIVORS OF SEXUAL BASED VIOLENCE WITH ACCESS TO RESOURCES
950098,6/5/2024,DRIVE SMART 2024
950098,5/9/2024,2024 EQUAL EMPLOYMENT OPPORTUNITY TRAINING - SEXUAL HARASSMENT AWARENESS AND PREVENTION
950098,4/27/2024,HOUSING BUREAU INTERIOR PATROL TACTICS
950098,4/27/2024,POLICING THE SUBWAY 2024
950098,3/14/2024,2024 VEHICLE SEIZURE FORM REFRESHER
950098,3/14/2024,NYCHA INTERIOR PATROL: SQF MODULE 7
950098,3/5/2024,EMPLOYEE ASSISTANCE UNIT (E.A.U.) IS HERE FOR YOU- 2024
950098,2/16/2024,FIELD FORCE OPERATIONS (FFO) - 5 DAY
950098,1/23/2024,CITYTIME USER TRAINING FOR MANAGERIAL CIVIL SERVICE TITLES
950098,1/23/2024,CITYTIME USER TRAINING FOR NON-MANAGERIAL CMOS
950098,1/23/2024,CRITICAL INCIDENT TACTICS - RESPONDING TO COMMERCIAL ROBBERIES (EXTENDED VERSION)
950098,1/23/2024,DISCUSSION - BASED LEARNING MODULE # 1-3
950098,1/23/2024,"EXECUTIVE CONFERENCE VIDEO 10-17-18: INTELLIGENT LEADERSHIP: GEORGE TENET, FORMER (DIRECTOR OF CENTR"
950098,1/23/2024,EXECUTIVE CONFERENCE VIDEO 10-17-18: LEADERSHIP ON AND OFF THE BATTLEFIELD: GENERAL JOHN R. ALLEN (P
950098,1/23/2024,EXECUTIVE CONFERENCE VIDEO 10-17-18: MAKING IT REAL-GETTING FROM HERE TO THERE TOGETHER - DR SCOTT L
950098,1/22/2024,AIM COMPONENTS
950098,1/22/2024,AIM COMPONENTS 2.0
950098,1/22/2024,AIM REGISTRATION AND SYNCHRONIZATION 2.0
950098,1/22/2024,AXON CASES 2.0
950098,1/22/2024,COBALT
950098,1/22/2024,COLLABORATIVE POLICING- HUMAN TRAFFICKING
950098,1/22/2024,COUNTERTERRORISM BUREAU ACTIVE SHOOTER SCHOOL INCIDENTS AWARENESS
950098,1/22/2024,"COUNTERTERRORISM BUREAU FACILITY AWARENESS- THE INTREPID SEA, AIR AND SPACE MUSEUM"
950098,1/22/2024,COUNTERTERRORISM BUREAU NH15 TRAINING
950098,1/22/2024,DETECTIVE BUREAU RETRIEVING BODY WORN CAMERA DATA
950098,1/22/2024,DOMAIN AWARNESS SYSTEM (DAS)
950098,1/22/2024,"EXECUTIVE CONFERENCE VIDEO 10-17-18: DISCUSSION WITH INDRA NOOYI, CHAIRMAN OF PEPSI CO"
950098,1/22/2024,EXECUTIVE HEALTH AND WELLNESS CONFERENCE - MODULE 1
950098,1/22/2024,EXECUTIVE HEALTH AND WELLNESS TRAINING - MODULE 10
950098,1/22/2024,EXECUTIVE HEALTH AND WELLNESS TRAINING - MODULE 2
950098,1/22/2024,EXECUTIVE HEALTH AND WELLNESS TRAINING - MODULE 3
950098,1/22/2024,EXECUTIVE HEALTH AND WELLNESS TRAINING - MODULE 4
950098,1/22/2024,EXECUTIVE HEALTH AND WELLNESS TRAINING - MODULE 5
950098,1/22/2024,EXECUTIVE HEALTH AND WELLNESS TRAINING - MODULE 6
950098,1/22/2024,EXECUTIVE HEALTH AND WELLNESS TRAINING - MODULE 8
950098,1/22/2024,EXECUTIVE HEALTH AND WELLNESS TRAINING - MODULE 9
950098,1/22/2024,HEALTH AND WELLNESS SECTION - MODULE 13 - MINDFULNESS
950098,1/22/2024,HEALTH AND WELLNESS SECTION - MODULE 14 - FINANCIAL WELLNESS PART 1
950098,1/22/2024,HEALTH AND WELLNESS SECTION - MODULE 16 - GRIEF AND COPING
950098,1/22/2024,IPHONE AND DAS MOBILE OPERATION
950098,1/22/2024,LOCATING APPLE DEVICES USING YOUR DEPARTMENT SMARTPHONE
950098,1/22/2024,MOBILE IDENTIFICATION DEVICE (MORPHO)
950098,1/22/2024,NEW YEAR'S EVE TACTICAL AWARENESS
950098,1/22/2024,REGISTRATION OF AIM
950098,1/22/2024,VERTEX 949 RADIO OPERATIONAL INSTRUCTIONS
950098,1/21/2024,2021 EXECUTIVE CONFERENCE - VIDEOS
950098,1/21/2024,COVID-19 SELF-COLLECTION KIT INSTRUCTIONS
950098,1/21/2024,HEALTH AND WELLNESS SECTION - CHILD MIND INSTITUTE VIDEO SERIES - MODULE 1 - BEHAVIOR MANAGEMENT STR
950098,1/21/2024,HEALTH AND WELLNESS SECTION - CHILD MIND INSTITUTE VIDEO SERIES - MODULE 2 - WHEN TO WORRY ABOUT YOU
950098,1/21/2024,HEALTH AND WELLNESS SECTION - FINANCIAL LITERACY SERIES - MODULE 1 - YOUR MONEY VALUES AND INFLUENCE
950098,1/21/2024,HEALTH AND WELLNESS SECTION - FINANCIAL LITERACY SERIES - MODULE 4 - MANAGING DEBT
950098,1/21/2024,HEALTH AND WELLNESS SECTION - MODULE 15 - FINANCIAL WELLNESS PART 2
950098,1/21/2024,HEALTH AND WELLNESS SECTION - MODULE 17 - FINANCIAL WILLS AND TRUSTS
950098,1/21/2024,HEALTH AND WELLNESS SECTION - MODULE 18 - YOGA MYTH BUSTING
950098,1/21/2024,HEALTH AND WELLNESS SECTION - MODULE 19 - STOP SMOKING - NYC ESCAPE PROGRAM
950098,1/21/2024,HEALTH AND WELLNESS SECTION - MODULE 20 - POPPA TESTIMONIAL VIDEO
950098,1/21/2024,HEALTH AND WELLNESS SECTION - MYPLATE APP TUTORIAL
950098,1/21/2024,HEALTH AND WELLNESS SECTION - NUTRITIONAL SERIES: DIETING FOR WEIGHT LOSS - MODULE 1 - INTRODUCTION
950098,1/21/2024,NEIGHBORHOOD POLICING APPLICATION TRAINING VIDEO
950098,1/20/2024,AUTISM SPECTRUM DISORDER
950098,1/13/2024,"POSSESSION OR INGESTION OF ANABOLIC STEROIDS, HUMAN GROWTH HORMONE, AND NUTRITIONAL SUPPLEMENTS"
950098,12/26/2023,HEALTH AND WELLNESS SECTION - CHILD MIND INSTITUTE VIDEO SERIES - MODULE 3 - CHILDREN'S MENTAL HEALT
950098,12/26/2023,HEALTH AND WELLNESS SECTION - CHILD MIND INSTITUTE VIDEO SERIES - MODULE 4 - RAISING SELF SUFFICIENT
950098,12/26/2023,NEW NYPD PORTAL
950098,12/26/2023,TACTICAL AWARENESS OF EXCITED DELIRIUM SYNDROME
950098,12/26/2023,TACTICAL AWARENESS- BALLISTIC VEST
950098,12/25/2023,COLLABORATIVE POLICING- POLICING IN TODAY’S MULTI-FAITH NY
950098,12/25/2023,DAS PATTERN MODE
950098,12/25/2023,DEATH BY POWERPOINT
950098,12/25/2023,EXECUTIVE HEALTH AND WELLNESS TRAINING - MODULE 7
950098,12/25/2023,HEALTH AND WELLNESS SECTION - FINANCIAL LITERACY SERIES - MODULE 2 - YOUR INCOME AND EXPENSES
950098,12/25/2023,HEALTH AND WELLNESS SECTION - FINANCIAL LITERACY SERIES - MODULE 3 - YOUR SPENDING AND SAVINGS PLAN
950098,12/25/2023,INTRODUCTION TO COGNOS 11
950098,12/25/2023,VIPER CCTV TRAINING COURSE
950098,12/24/2023,CONVICTED OFFENDER DNA DATABANK SPECIMEN COLLECTION KIT
950098,12/24/2023,DOMAIN AWARENESS SYSTEM - SEARCH ACCURINT RESULTS
950098,12/24/2023,ELDER ABUSE -2023 REFRESHER
950098,12/24/2023,EMPLOYEE ASSISTANCE UNIT-2021
950098,12/24/2023,FORCE POLICY REVISION-VIDEO-PG 221-UNIT TRAINING MAY 2016
950098,12/24/2023,"FORMS - THREAT,RESISTANCE,INJURY (TRI)"
950098,12/24/2023,ILLEGAL EVICTIONS
950098,12/24/2023,LGBTQIA PLUS - DIVERSITY AND INCLUSION
950098,12/24/2023,NYPD MOBILITY INITIATIVE - DEPARTMENT SMARTPHONE TRAINING
950098,12/24/2023,PATROL GUIDE 215-17 POLICE ACTIONS RELATED QUESTIONING ARRESTS AND INVESTIGATIONS AT A NYC DEPARTMEN
950098,12/24/2023,PROCESSING CIVILIAN COMPLAINTS
950098,12/24/2023,PROHIBITED METHODS OF RESTRAINT
950098,12/24/2023,STOP REPORT
950098,12/24/2023,TRAINING MATERIALS- CLOSING THE GAP ON VEHICLE INTELLIGENCE
950098,12/24/2023,TRAINING MATERIALS- PAWNSHOP AND 2ND HAND DEALER DATABASE
950098,12/24/2023,TRAINING MATERIALS- THE RECIDIVIST TRACKING AND REPORTING DATABASE (RTRD)
950098,12/24/2023,TRAINING MATERIALS- VIRTUAL CRIME INFORMATION CENTER
950098,12/24/2023,VEHICLE SEIZURE FORM
950098,12/24/2023,VIDEO 2 -TACTICAL CONSIDERATIONS FOR TRANSIT PATROL 2022 (PART 1)
950098,12/24/2023,VIDEO 3 - TACTICAL CONSIDERATIONS FOR TRANSIT PATROL 2022 (PART 2)
950098,12/24/2023,WARRANT CHECK IN DOMAIN AWARENESS SYSTEM (DAS LITE)
950098,12/24/2023,X26P TRANSITION COURSE FOR CURRENT X26 END-USERS
950098,12/22/2023,INVESTIGATIVE ENCOUNTERS SUMMARY: SQF MODULE 6
950098,12/22/2023,OPIOID DANGERS- FENTANYL AND CARFENTANIL
950098,12/18/2023,SRG - RAPID MOBILIZATION (PATROL) LEVEL 4
950098,12/17/2023,SRG - RAPID MOBILIZATION (PATROL) LEVEL 4
950098,12/16/2023,SRG - RAPID MOBILIZATION (PATROL) LEVEL 4
950098,12/15/2023,SRG - RAPID MOBILIZATION (PATROL) LEVEL 4
950098,12/11/2023,SRG - RAPID MOBILIZATION (PATROL) LEVEL 4
950098,12/9/2023,SRG - RAPID MOBILIZATION (PATROL) LEVEL 4
950098,12/8/2023,SRG - RAPID MOBILIZATION (PATROL) LEVEL 4
950098,12/7/2023,SRG - RAPID MOBILIZATION (PATROL) LEVEL 4
950098,11/30/2023,AUGMENTED REALITY FEATURE
950098,11/2/2023,BELT-WORN TRAUMA KIT REFRESHER TRAINING VIDEO-2022
950098,11/2/2023,COVID-19: PREPAREDNESS YOUR FAMILY AND HOME
950098,11/2/2023,VICTIM BLAMING AND RELEASE OF INFORMATION TO THE MEDIA
950098,11/2/2023,VIDEO 4 - PLATFORM SAFETY 2022
950098,10/31/2023,INVESTIGATIVE ENCOUNTERS 2023: MODULE 5 SQF LEVELS 3 AND 4
950098,10/31/2023,NYPD RECRUITMENT TRAINING VIDEO
950098,10/11/2023,EFFECTIVE COMMUNICATION SKILLS - DEAF OR HARD OF HEARING
950098,10/11/2023,INFORMATION SECURITY AWARENESS TRAINING - 2023
950098,10/11/2023,VEHICLE MOUNTED VIDEO SYSTEM
950098,8/27/2023,NYPD JOUVERT AND WEST INDIAN DAY-2023
950098,8/13/2023,TRAFFIC COURT TESTIMONY VIDEO
950098,8/13/2023,UNMANNED AIRCRAFT PERMIT: DRONES FOR PUBLIC USE
950098,8/11/2023,2023 SUMMER ALL-OUT BODY WORN CAMERA TRAINING
950098,6/2/2023,2023 EQUAL EMPLOYMENT OPPORTUNITY TRAINING-SEXUAL HARASSMENT AWARENESS AND PREVENTION
950098,6/2/2023,2023 LANGUAGE MATTERS - FOSTERING A POSITIVE WORK ENVIRONMENT
950098,6/2/2023,"INVESTIGATIVE ENCOUNTERS 2023: MODULE 4 SQF LEVELS 2, 3 AND 4"
950098,3/28/2023,ESPER POLICY LIBRARY
950098,3/28/2023,INVESTIGATIVE ENCOUNTERS 2023: MODULE 3 SQF LEVEL 2
950098,2/22/2023,INFORMATION SECURITY CRIMINAL JUSTICE TRAINING 2023
950098,2/22/2023,NYPD-U VOLUNTARY - INVOLUNTARY TRANSPORTS
950098,2/22/2023,RAISING THE LOWER AGE OF JUVENILE DELINQUENCY
950098,2/22/2023,VIDEO 1 - PATROLLING THE NYC SUBWAY SYSTEM 2022
950098,1/31/2023,INVESTIGATIVE ENCOUNTERS 2023 - MODULE 1 INTRODUCTION TO SQF
950098,1/31/2023,INVESTIGATIVE ENCOUNTERS 2023: MODULE 2 SQF LEVEL 1
950098,11/30/2022,LGBTQIA PLUS AWARENESS
950098,9/28/2022,THE EMPLOYEE ASSISTANCE UNIT (EAU) IS HERE FOR YOU
950098,8/6/2022,2022 EQUAL EMPLOYMENT OPPORTUNITY TRAINING-SEXUAL HARASSMENT AWARENESS AND PREVENTION
950098,6/25/2022,CAR STOP TACTICS FOR PATROL OFFICERS - MODULE 1: CONTROLLING THE STOP
950098,6/25/2022,CAR STOP TACTICS FOR PATROL OFFICERS - MODULE 2: PROHIBITED MANEUVERS
950098,6/25/2022,CAR STOP TACTICS FOR PATROL OFFICERS - MODULE 3: THE UNKNOWN RISK STOP
950098,6/25/2022,CAR STOP TACTICS FOR PATROL OFFICERS - MODULE 4: THE HIGH-RISK STOP
950098,6/23/2022,BEST PRACTICES IN STRUCTURED INTERVIEWING
950098,6/23/2022,NATIONAL INCIDENT-BASED REPORTING SYSTEM (NIBRS) UPDATES TO THE OMNIFORM COMPLAINT SYSTEMV
950098,4/19/2022,ACTIVE BYSTANDERSHIP FOR LAW ENFORCEMENT (ABLE): ONE DAY COURSE
950098,2/3/2022,ARRESTS - RELIGIOUS HEAD COVERING GUIDELINES (PG 208-83)
950098,2/3/2022,IDENTIFYING THE IMPAIRED DRIVER
950098,2/3/2022,LOCAL LAW 45 OF 2021-TRAFFIC ENCOUNTERS
950098,10/19/2021,BODY-WORN CAMERA REVIEW PART TWO
950098,10/2/2021,BODY-WORN CAMERA REVIEW PART ONE
950098,9/21/2021,MAYOR EXECUTIVE ORDER 78 VACCINATION - TESTING COMPLIANCE POLICY
950098,9/21/2021,OPIOID OVERDOSE RECOGNITION AND NARCAN ADMINISTRATION -2021
950098,9/15/2021,INFORMATION SECURITY AWARENESS TRAINING 2021
950098,7/19/2021,CONTERTERRORISM BUREAU SITE PROTECTION THROUGH OBSERVATIONAL TECHNIQUES
950098,7/17/2021,EQUAL EMPLOYMENT OPPORTUNITY TRAINING - SEXUAL HARASSMENT AWARENESS AND PREVENTION 2021
950098,7/17/2021,OVERVIEW OF THE NEW DISCOVERY LAWS 2021 REFRESHER
950098,4/27/2021,EQUAL EMPLOYMENT OPPORTUNITY TRAINING - LGBTQIA+ DIVERSITY AND INCLUSION / EXECUTIVE ORDER 16 OF 201
950098,4/1/2021,DESK APPEARANCE TICKETS: THE NEW LAW AND THE NEW GUIDELINES FOR PROCESSING DAT'S - 2021 REFRESHER
950098,1/27/2021,COVID VACCINE DISTRIBUTION AND EDUCATION
950098,12/10/2020,CLT-EQUAL EMPLOYMENT OPPORTUNITY
950098,12/10/2020,EQUAL EMPLOYMENT OPPORTUNITY TRAINING - LEAVE TO EXPRESS BREAST MILK
950098,11/25/2020,COUNTER TERRORISM - CRC - M4 ADVANCED TEAM TACTICS
950098,10/12/2020,HEALTH AND WELLNESS SECTION - MODULE 7 - LEADING WITH COMPASSION
950098,10/12/2020,"HEALTH AND WELLNESS SECTION - MODULE 8 - WARNING SIGNS, SUPPORT AND OUTREACH"
950098,10/12/2020,HEALTH AND WELLNESS SECTION - MODULE 9 - MANAGING STRESS ON THE JOB
950098,10/11/2020,HEALTH AND WELLNESS SECTION - MODULE 1 - PSYCHOLOGICAL HEALTH AND WELLNESS
950098,10/11/2020,HEALTH AND WELLNESS SECTION - MODULE 10 - SEEKING AND RECEIVING MENTAL HEALTH SUPPORT
950098,10/11/2020,HEALTH AND WELLNESS SECTION - MODULE 11 - HEALTH AND RESILIENCY
950098,10/11/2020,HEALTH AND WELLNESS SECTION - MODULE 12 - IN THAT DARK PLACE - AN OFFICER'S JOURNEY
950098,10/11/2020,HEALTH AND WELLNESS SECTION - MODULE 2 - JOB COUNSELING AND STRESS
950098,10/11/2020,HEALTH AND WELLNESS SECTION - MODULE 3 - WARNING SIGNS
950098,10/11/2020,HEALTH AND WELLNESS SECTION - MODULE 4 - CUMULATIVE TRAUMA
950098,10/11/2020,HEALTH AND WELLNESS SECTION - MODULE 5 - GAINING PERSPECTIVE
950098,10/11/2020,HEALTH AND WELLNESS SECTION - MODULE 6 - COPING WITH SIGNS OF ANXIETY DEPRESSION
950098,9/16/2020,"EQUAL EMPLOYMENT OPPORTUNITY TRAINING - SEXUAL HARASSMENT, AWARENESS AND PREVENTION"
950098,8/11/2020,CONSTITUTIONAL POLICING AT COMMUNITY EVENTS (CPACE)
950098,7/2/2020,NEW LAWS AFFECTING POLICE OFFICERS’ CRIMINAL AND CIVIL LIABILITY
950098,5/18/2020,COVID-19: PREPAREDENESS
950098,5/18/2020,COVID-19: PROTECTIVE MASKS
950098,5/18/2020,CRIMINAL JUSTICE BUREAU - GIGLIO MATERIAL DISCLOSURES UNDER THE NEW DISCOVERY LAWS
950098,5/18/2020,CROSSFIRE MITIGATION DURING CLOSE COMBAT INCIDENTS - PART 2
950098,5/18/2020,INCREASE OFFICER SAFETY DURING VEHICLE STOPS
950098,5/18/2020,POLICE COMMISSIONER MESSAGE- NYC GIVES
950098,5/18/2020,PRISONER ESCAPE WARNING SIGNS
950098,5/18/2020,PROCESSING DISCOVERY MATERIAL IN THE FORMS ARREST FOLDER
950098,5/18/2020,SAFEGUARDING HOSPITALIZED PRISONERS
950098,5/18/2020,SUCCESSFULLY DISARMING AN EMOTIONALLY DISTURBED PERSON
950098,5/18/2020,UTILIZING BALLISTIC PROTECTION IN DEPARTMENT VEHICLES (4:09)
950098,5/3/2020,INVESTIGATIVE ENCOUNTERS-VIDEO #2 COMMON LAW RIGHT OF INQUIRY-UNIT TRAINING MAY 2016
950098,5/3/2020,SAFETY CONSIDERATIONS FOR PATROLLING THE NYC SUBWAY SYSTEM -DANGERS OF THE PLATFORM EDGE
950098,2/26/2020,2017-2019 IN-SERVICE CYCLE-INVESTIGATIVE ENCOUNTERS- BASIC TRAINING WITH SCENARIOS
950098,12/24/2019,CJB - DESK APPEARANCE TICKETS: THE NEW LAWS AND GUIDELINES FOR PROCESSING DATS
950098,12/24/2019,CJB - OVERVIEW OF THE NEW DISCOVERY LAWS
950098,12/24/2019,CROSSFIRE MITIGATION DURING CLOSE COMBAT INCIDENTS
950098,12/24/2019,DISCHARGING YOUR FIREARM AT A MOVING THREAT
950098,12/24/2019,FORCE POLICY UPDATE VIDEO
950098,12/24/2019,RESPONDING TO COMMERCIAL ROBBERIES PART LL - MODULE 1 AND MODULE 2
950098,12/21/2019,ACTIVITY LOG FOR IPHONE
950098,11/20/2019,CRIMINAL JUSTICE BUREAU - DNA TRAINING VIDEO
950098,10/2/2019,CRITICAL DECISION MAKING MODEL
950098,10/2/2019,DOMESTIC VIOLENCE EDUCATION AND COUNSELING
950098,10/2/2019,MARIJUANA POLICY UPDATE
950098,9/21/2019,SHIELD OF RESILIENCE TRAINING COURSE
950098,8/16/2019,RESPONDING TO COMMERCIAL ROBBERIES
950098,8/1/2019,COLLABORATIVE POLICING- ACCESSING TELEPHONIC INTERPRETERS VIA LANGUAGE LINE
950098,8/1/2019,"CPS INTERIOR PATROL OF HOUSING AUTHORITY BUILDINGS, PG 212-60 ROLL CALL VIDEO 1"
950098,8/1/2019,"CPS INTERIOR PATROL OF HOUSING AUTHORITY BUILDINGS, PG 212-60 ROLL CALL VIDEO 2"
950098,8/1/2019,CPS INTERIOR PATROL TRESPASS AFFIDAVIT PROGRAM (TAP) VIDEO 1
950098,8/1/2019,CPS INTERIOR PATROL TRESPASS AFFIDAVIT PROGRAM (TAP) VIDEO 2
950098,8/1/2019,DAS OVERLAPPING LAYERS TUTORIAL
950098,8/1/2019,INVESTIGATIVE ENCOUNTERS-VIDEO #3 TERRY STOPS AND REASONABLE SUSPICION-UNIT TRAINING JUNE 2016
950098,7/23/2019,CPS FAIR AND IMPARTIAL POLICING - ALL POS AND DETS
950098,7/8/2019,RESPONDING TO PEOPLE IN CRISIS – MODULE 4: USING DEPARTMENT MOBILE DIGITAL DEVICES
950098,7/8/2019,TRANSIT BUREAU - SAFETY CONSIDERATIONS FOR PATROLLING THE NYC SUBWAY SYSTEM
950098,7/8/2019,TRANSIT BUREAU - SAFETY CONSIDERATIONS FOR PATROLLING THE NYC SUBWAY SYSTEM - PART 2
950098,7/8/2019,TRANSIT BUREAU - TIMELY RESUMPTION OF SERVICE IN NYC TRANSIT
950098,6/10/2019,WORLDPRIDE NYC 2019
950098,6/4/2019,SRG - RESCUE TASK FORCE - LEVEL II
950098,6/2/2019,COLLABORATIVE POLICING - MEDIATION REFERRAL PROGRAM FOR NON-CRIMINAL COMPLAINTS
950098,6/2/2019,COLLABORATIVE POLICING - THE DEAF AND HARD OF HEARING COMMUNITY
950098,6/2/2019,RESPONDING TO PEOPLE IN CRISIS - MODULES 2 AND 3: ACTIVE LISTENING PARTS 1 AND 2
950098,5/22/2019,CPS BODY-WORN CAMERA TRAINING WITH SCENARIOS
950098,5/2/2019,PROFESSIONAL DEVELOPMENT - INCIDENT RESPONSE TO TERRORIST BOMBINGS NEW MEXICO TECH EMRTC
950098,4/18/2019,INVESTIGATIVE ENCOUNTERS-VIDEO #4 DOCUMENTATION AND SUPERVISION-UNIT TRAINING JULY 2016
950098,4/18/2019,LEGAL BUREAU - PERJURY TRAINING MODULE
950098,4/18/2019,NARCAN NASAL SPRAY TRAINING
950098,4/18/2019,NEW PERFORMANCE EVALUATION PROCESS
950098,4/18/2019,PUBLIC CONTACT AND CONSENT TO SEARCH (RIGHT TO KNOW) - UNIT TRAINING AUGUST 2016
950098,4/18/2019,TACTICAL AWARENESS-SMARTPHONE SAFETY
950098,4/2/2019,SAFEGUARDING PRISONERS - OFFICER SAFETY GUIDELINES
950098,3/22/2019,FACILITIES MANAGEMENT DIVISION - MUNICIPAL SEPERATE STORM SEWER SYSTEM (MS4)
950098,3/7/2019,AWARENESS AND RESPONSE TO BIOLOGICAL INCIDENTS
950098,3/7/2019,COLLABORATIVE POLICING - ELDER ABUSE
950098,3/7/2019,INVESTIGATIVE ENCOUNTERS-VIDEO #1 REQUEST FOR INFO-UNIT TRAINING FEB 2016
950098,3/7/2019,RESPONDING TO PEOPLE IN CRISIS - MODULE 1: SENDING THE RIGHT SIGNALS
950098,3/7/2019,"SUPPORT SERVICES DIVISION - CLASS ""C"" OPERATOR"
950098,2/14/2019,ADVANCED EXPLOSIVE TRACE DETECTION COURSE
950098,1/20/2019,EQUAL EMPLOYMENT OPPORTUNITYTRAINING - SEXUAL HARASSMENT AWARENESS AND PREVENTION
950098,1/20/2019,MARIJUANA BURNING ENFORCEMENT POLICY
950098,12/5/2018,AMERICANS WITH DISABILITIES ACT (ADA)
950098,10/26/2018,SRG - RESCUE TASK FORCE
950098,10/22/2018,CLT-COMMUNITY ENGAGEMENT
950098,10/19/2018,RESPONDING TO PEOPLE IN CRISIS-INTRODUCTION TO CIT VIDEO SERIES
950098,10/3/2018,CLT-HUMAN RESOURCES AND PERSONNEL MATTERS
950098,9/28/2018,NYC RIGHT TO KNOW ACT LEGISLATION - PART 2
950098,9/28/2018,NYC RIGHT TO KNOW ACT LEGISLATION – PART 1
950098,9/22/2018,RAISE THE AGE
950098,8/20/2018,COUNTERTERRORISM CRITICAL RESPONSE COMMAND INITIAL RESPONSE TO ACTIVE SHOOTER
950098,8/8/2018,CLT-INFORMATION TECHNOLOGY
950098,7/31/2018,COUNTERTERRORISM BUREAU CRC STRYKER TEAM GUIDELINES AT DEPLOYMENT
950098,5/22/2018,COMMUNICATIONS- THE PROPER USAGE OF THE IDA RADIO CODES
950098,5/2/2018,CLT-COMMUNITY ENGAGEMENT
950098,4/16/2018,CLT-COUNTERTERRORISM AND INTELLIGENCE
950098,4/12/2018,CLT-COMMUNITY ENGAGEMENT
950098,3/15/2018,"CLT-UNIFORMS, PERSONAL APPEARANCE AND EQUIPMENT"
950098,3/1/2018,LEGAL BUREAU PERFORMANCE METRICS - PROHIBITED CONDUCT
950098,2/27/2018,CLT-PROCEDURAL OPERATIONS
950098,1/30/2018,CRIME CONTROL STRATEGIES- COMMUNITY SUPERVISION
950098,1/29/2018,COLLABORATIVE POLICING- FOREIGN LANGUAGE CERTIFICATION VIDEO
950098,12/10/2017,BELT TRAUMA KIT VIDEO
950098,12/10/2017,COUNTERTERRORISM BUREAU FACILITY AWARENESS VIDEO- NAVY OPERATIONAL SUPPORT CENTER
950098,12/10/2017,COUNTERTERRORISM BUREAU FACILITY AWARENESS VIDEO- TIME WARNER BUILDING
950098,12/10/2017,COUNTERTERRORISM BUREAU INITIAL PATROL RESPONSE FOR ACTIVE SHOOTER
950098,12/10/2017,COUNTERTERRORISM U.A.S. (UNMANNED AIRCRAFT SYSTEMS) DRONE AWARENESS
950098,12/9/2017,COUNTERTERRORISM BUREAU FACILITY AWARENESS VIDEO-EMPIRE STATE BUILDING
950098,12/7/2017,NARCAN NASAL SPRAY TRAINING
950098,10/10/2017,COLLABORATIVE POLICING- ACCESSING TELEPHONIC INTERPRETERS VIA LANGUAGE LINE
950098,10/5/2017,CPS INTERIOR PATROL TRESPASS AFFIDAVIT PROGRAM (TAP) VIDEO 1
950098,10/5/2017,CPS INTERIOR PATROL TRESPASS AFFIDAVIT PROGRAM (TAP) VIDEO 2
950098,9/3/2017,COUNTERTERRORISM ACTIVE SHOOTER TRAINING
950098,9/3/2017,PATROL- POLYCARBONATE SHIELD
950098,9/3/2017,PERSONNEL BUREAU NYPD EMPLOYEE ASSISTANCE UNIT (EAU)
950098,9/3/2017,POLICE COMMISSIONERS MESSAGE - VICTIMS OF SEXUAL ASSAULT VIDEO
950098,6/5/2017,EQUAL EMPLOYMENT OPPORTUNITY TRANSGENDER DIVERSITY AND INCLUSION:EXECUTIVE ORDER 16
950098,6/4/2017,CRIMINAL JUSTICE REFORM ACT ROLL CALL TRAINING PART 1
950098,6/4/2017,CRIMINAL JUSTICE REFORM ACT ROLL CALL TRAINING PART 2
950098,4/10/2017,COUNTERTERRORISM PERSONAL RADIATION DETECTION COURSE
950098,12/15/2016,FORCE POLICY REVISION-VIDEO-PG 221-UNIT TRAINING MAY 2016
950098,12/15/2016,PUBLIC CONTACT AND CONSENT TO SEARCH (RIGHT TO KNOW) - UNIT TRAINING AUGUST 2016
950098,12/8/2016,FORCE POLICY REVISION-VIDEO-PG 221-UNIT TRAINING MAY 2016
950098,12/7/2016,COUNTERTERRORISM BELT TRAUMA KIT
950098,11/21/2016,INVESTIGATIVE ENCOUNTERS-VIDEO #1 REQUEST FOR INFO-UNIT TRAINING FEB 2016
950098,10/7/2016,INVESTIGATIVE ENCOUNTERS-VIDEO #4 DOCUMENTATION AND SUPERVISION-UNIT TRAINING JULY 2016
950098,10/5/2016,ILERSBA - INITIAL LAW ENFORCMENT RESPONSE TO SUICIDE BOMBING ATTACKS
950098,8/30/2016,ESU COLLABORATIVE RESPONSE TACTICS
950098,8/29/2016,INVESTIGATIVE ENCOUNTERS-VIDEO #4 DOCUMENTATION AND SUPERVISION-UNIT TRAINING JULY 2016
950098,8/24/2016,INVESTIGATIVE ENCOUNTERS-VIDEO #3 TERRY STOPS AND REASONABLE SUSPICION-UNIT TRAINING JUNE 2016
950098,7/7/2016,"HME - HOMEMADE EXPLOSIVES: AWARENESS, RECOGNITION, AND RESPONSE"
950098,7/7/2016,INVESTIGATIVE ENCOUNTERS-VIDEO #3 TERRY STOPS AND REASONABLE SUSPICION-UNIT TRAINING JUNE 2016
950098,5/12/2016,INVESTIGATIVE ENCOUNTERS-VIDEO #2 COMMON LAW RIGHT OF INQUIRY-UNIT TRAINING MAY 2016
950098,1/21/2016,FORCE POLICY REVISION-PAMPHLET - PG 221 - UNIT TRAINING DECEMBER 2015
950098,11/27/2015,COUNTERTERRORISM BELT TRAUMA KIT
950098,11/27/2015,WINDOWS PHONE TRAINING AND DISTRIBUTION
950098,11/25/2015,RADIOLOGICAL/NUCLEAR AWARENESS TSGP
