taxid,date,name
965948,1/3/2019,TEXT TO 911 - INTRODUCTION
965948,1/2/2019,EQUAL EMPLOYMENT OPPORTUNITYTRAINING - SEXUAL HARASSMENT AWARENESS AND PREVENTION
965948,1/1/2019,CLT-EQUAL EMPLOYMENT OPPORTUNITY
965948,12/28/2018,BTK (BELT TRAUMA KIT DISTRIBUTION AND FAMILIARIZATION)
965948,12/28/2018,CPS BODY-WORN CAMERA TRAINING WITH SCENARIOS
965948,12/21/2018,RECRUIT RAPID DEPLOYMENT-ACTIVE SHOOTER
965948,12/20/2018,MARIJUANA BURNING ENFORCEMENT POLICY
965948,12/18/2018,AMERICANS WITH DISABILITIES ACT (ADA)
965948,12/17/2018,POLICE ACADEMY RECRUIT 3RD TRIMESTER EXAM
965948,12/13/2018,HIGHWAY DRUG IMPAIRED DRIVING COURSE
965948,12/13/2018,HIGHWAY PRELIMINARY BREATH TEST INSTRUMENT TRAINING - PBT
965948,12/10/2018,PTTD WATER SAFETY
965948,11/28/2018,CLT-HUMAN RESOURCES AND PERSONNEL MATTERS
965948,11/26/2018,CLT-ENFORCEMENT ACTIONS
965948,11/26/2018,CLT-HUMAN RESOURCES AND PERSONNEL MATTERS
965948,11/26/2018,CLT-PROCEDURAL OPERATIONS
965948,11/26/2018,"CLT-UNIFORMS, PERSONAL APPEARANCE AND EQUIPMENT"
965948,11/22/2018,CLT-HUMAN RESOURCES AND PERSONNEL MATTERS
965948,11/20/2018,CLT-ENFORCEMENT ACTIONS
965948,11/20/2018,CLT-HUMAN RESOURCES AND PERSONNEL MATTERS
965948,11/20/2018,"CLT-UNIFORMS, PERSONAL APPEARANCE AND EQUIPMENT"
965948,11/19/2018,CLT-HUMAN RESOURCES AND PERSONNEL MATTERS
965948,11/13/2018,PTTD C.P.R. / A.E.D. WRITTEN EXAM
965948,11/9/2018,PTTD DEFENSIVE TACTICS PRACTICAL EXAM
965948,11/8/2018,GROUND TACTICS
965948,10/29/2018,POLICE ACADEMY RECRUIT 2ND TRIMESTER EXAM
965948,10/26/2018,POLICE ACADEMY RECRUIT JUSTIFICATION WRITTEN EXAM
965948,10/19/2018,P.A. RECRUIT NCIC/III EXAM
965948,10/19/2018,P.A. RECRUIT NYPD COMPUTER USE POLICY AND MONITORING NOTICE
965948,10/19/2018,RECRUIT TRAINING COMPUTER COURSE
965948,10/17/2018,PTTD WEAPONS DEFENSE
965948,10/16/2018,PTTD C.P.R. / A.E.D. WRITTEN EXAM
965948,10/15/2018,FIREARMS 5 DAY TACTICAL APPLICATION V2
965948,10/5/2018,VEHICLE STOP SOLUTIONS MODULE
965948,10/4/2018,RECRUIT 12 PASSENGER VAN / UTILITY VEHICLE QUALIFICATION
965948,10/4/2018,WHEELCHAIR LIFT OPERATION ENDORSEMENT
965948,10/3/2018,RECRUIT RMP QUALIFICATION / RMP OPERATOR QUALIFIED
965948,10/2/2018,CPS FAIR AND IMPARTIAL POLICING - ALL POS AND DETS
965948,9/27/2018,PTTD EXPANDABLE BATON
965948,9/25/2018,NYC RIGHT TO KNOW ACT LEGISLATION - PART 2
965948,9/25/2018,NYC RIGHT TO KNOW ACT LEGISLATION – PART 1
965948,9/25/2018,RAISE THE AGE
965948,9/24/2018,OFF DUTY PISTOL CERTIFIED
965948,9/24/2018,RECRUIT TACTICAL FIREARMS QUALIFICATION AND TRAINING OFF DUTY PISTOL CERTIFIED
965948,9/19/2018,FTS - ANNUAL CEW RECERTIFICATION
965948,9/6/2018,FRISKING AND HANDCUFFING
965948,9/3/2018,"PTTD CARDIO ENDURANCE TEST, 1ST ATTEMPT"
965948,8/31/2018,RECRUIT BASIC FIREARMS QUALIFICATION AND TRAINING
965948,8/20/2018,FIRST AID WRITEN EXAM
965948,8/17/2018,POLICE ACADEMY RECRUIT 1ST TRIMESTER EXAM
965948,8/16/2018,POLICE ACADEMY RECRUIT STOP QUESTION & FRISK WRITTEN EXAM
965948,8/15/2018,BATON
965948,8/15/2018,PTTD DEFENSIVE TACTICS PRACTICAL EXAM
965948,8/7/2018,JOB STANDARDS TEST ATTEMPT #1
965948,8/7/2018,PTTD CPR PRACTICAL EXAM
965948,7/6/2018,EQUAL EMPLOYMENT OPPORTUNITY FOR NEW HIRES
965948,7/6/2018,POLICE ACADEMY RECRUIT PREREADING EXAM
965948,11/9/2015,EMERGENCY VEHICLE OPERATION JULY 07 - PRESENT
965948,11/9/2015,FIELD TRAINING PROGRAM JULY 07 - PRESENT
965948,11/9/2015,PHYSICAL EDUCATION PART 1: FOUNDATIONS OF PHYSICAL FITNESS
965948,11/9/2015,PHYSICAL EDUCATION PART 2: DEFENSIVE TACTICS JULY 07 - PRESENT
965948,11/9/2015,PHYSICAL EDUCATION PART 3: AMERICAN HEART ASSOCIATION BASIC LIFE SUPPORT
965948,11/9/2015,POLICE CRISIS INTERVENTION JULY 07 - PRESENT
965948,11/9/2015,POLICE FIELD PROBLEMS JULY 07 - PRESENT
965948,11/9/2015,POLICE INVESTIGATION AND REPORTING JULY 07 - PRESENT
965948,11/9/2015,POLICING A DEMOCRACY JULY 07 - PRESENT
965948,11/9/2015,POLICING SPECIAL POPULATIONS JULY 07 - PRESENT
965948,11/9/2015,PROCEDURAL LAW JULY 07 - PRESENT
965948,11/9/2015,SUBSTANTIVE LAW JULY 07 - PRESENT
965948,11/9/2015,TERRORISM AWARENESS AND RESPONSE JULY 07 - PRESENT
936190,7/17/2025,PATROL TACTICS
936190,7/8/2025,2025 BWC PROFICIENCY TRAINING
936190,7/8/2025,SPECIAL VICTIMS UNIT - BEST PRACTICES GUIDE TRAINING
936190,6/23/2025,EAU 2025 POLICE COMMISSIONER JESSICA S. TISCH
936190,6/23/2025,SQF REVIEW AND DOCUMENTATION: SQF MODULE 10
936190,5/20/2025,2025 EQUAL EMPLOYMENT OPPORTUNITY TRAINING - SEXUAL HARASSMENT AWARENESS AND PREVENTION
936190,2/21/2025,RIGHT TO KNOW ACT SQF MODULE 9
936190,2/21/2025,VEHICLE PURSUITS
936190,1/14/2025,2025 IDENTIFYING THE IMPAIRED DRIVER REFRESHER
936190,1/14/2025,ACTIVE SHOOTER - SCHOOL RESPONSE PROTOCOL
936190,1/14/2025,CELL BLOCK FIRESHIELD EV BLANKETS
936190,1/14/2025,KEVIN AND AVONTE SAFE HOME PROGRAM
936190,1/14/2025,MULTI-FACTOR AUTHENTICATION MFA TRAINING
936190,12/16/2024,INFORMATION SECURITY AWARENESS TRAINING 2024
936190,12/11/2024,NOTIFICATION OF ALLEGATIONS AND EMPLOYEE RIGHTS
936190,12/3/2024,BEHAVIORAL HEALTH EMERGENCY ASSISTANCE RESPONSE DIVISION B-HEARD
936190,12/3/2024,LEAVING THE SCENE COLLISIONS INVESTIGATIVE BEST PRACTICES
936190,11/18/2024,DRIVING WHILE INTOXICATED AWARENESS VIDEO MODULE 1
936190,10/7/2024,APX NEXT PORTABLE AND RADIO DISCIPLINE TRAINING VIDEO
936190,10/7/2024,FAMILY BUILDING
936190,10/7/2024,MENTAL HEALTH INVOLUNTARY REMOVALS MHL 9.41 AND MHL 9.58
936190,10/7/2024,NORTHWELL DIRECT FINEST CARE PROGRAM FOR UMOS
936190,10/7/2024,RACIAL PROFILING AND BIASED BASED POLICING: SQF MODULE 8
936190,10/7/2024,UNMANNED AIRCRAFT SYSTEMS VISUAL OBSERVER
936190,8/30/2024,RAPE IS RAPE
936190,6/28/2024,LEVEL 1 AND LEVEL 2 INVESTIGATIVE ENCOUNTERS
936190,6/4/2024,TACTICS WHEN ENGAGING INDIVIDUALS IN A MENTAL HEALTH CRISIS
936190,5/14/2024,2024 EQUAL EMPLOYMENT OPPORTUNITY TRAINING - SEXUAL HARASSMENT AWARENESS AND PREVENTION
936190,5/14/2024,ACCURATE COMPLAINT REPORT CLASSIFICATION
936190,5/14/2024,ASSISTING SURVIVORS OF SEXUAL BASED VIOLENCE WITH ACCESS TO RESOURCES
936190,5/14/2024,DRIVE SMART 2024
936190,5/14/2024,HOUSING BUREAU INTERIOR PATROL TACTICS
936190,5/14/2024,NYCHA INTERIOR PATROL: SQF MODULE 7
936190,4/9/2024,POLICING THE SUBWAY 2024
936190,3/23/2024,2024 VEHICLE SEIZURE FORM REFRESHER
936190,3/5/2024,EMPLOYEE ASSISTANCE UNIT (E.A.U.) IS HERE FOR YOU- 2024
936190,1/24/2024,AUTISM SPECTRUM DISORDER
936190,1/2/2024,INVESTIGATIVE ENCOUNTERS SUMMARY: SQF MODULE 6
936190,1/2/2024,LGBTQIA PLUS - DIVERSITY AND INCLUSION
936190,1/2/2024,"POSSESSION OR INGESTION OF ANABOLIC STEROIDS, HUMAN GROWTH HORMONE, AND NUTRITIONAL SUPPLEMENTS"
936190,12/22/2023,OPIOID DANGERS- FENTANYL AND CARFENTANIL
936190,12/6/2023,INVESTIGATIVE ENCOUNTERS 2023: MODULE 5 SQF LEVELS 3 AND 4
936190,12/4/2023,AUGMENTED REALITY FEATURE
936190,12/4/2023,ELDER ABUSE -2023 REFRESHER
936190,12/4/2023,NYPD RECRUITMENT TRAINING VIDEO
936190,10/5/2023,EFFECTIVE COMMUNICATION SKILLS - DEAF OR HARD OF HEARING
936190,10/5/2023,INFORMATION SECURITY AWARENESS TRAINING - 2023
936190,10/5/2023,NYPD JOUVERT AND WEST INDIAN DAY-2023
936190,10/5/2023,VEHICLE MOUNTED VIDEO SYSTEM
936190,8/11/2023,2023 SUMMER ALL-OUT BODY WORN CAMERA TRAINING
936190,8/11/2023,UNMANNED AIRCRAFT PERMIT: DRONES FOR PUBLIC USE
936190,7/24/2023,TRAFFIC COURT TESTIMONY VIDEO
936190,5/23/2023,"INVESTIGATIVE ENCOUNTERS 2023: MODULE 4 SQF LEVELS 2, 3 AND 4"
936190,5/3/2023,2023 EQUAL EMPLOYMENT OPPORTUNITY TRAINING-SEXUAL HARASSMENT AWARENESS AND PREVENTION
936190,5/3/2023,2023 LANGUAGE MATTERS - FOSTERING A POSITIVE WORK ENVIRONMENT
936190,4/3/2023,INVESTIGATIVE ENCOUNTERS 2023: MODULE 3 SQF LEVEL 2
936190,3/20/2023,ESPER POLICY LIBRARY
936190,2/22/2023,INFORMATION SECURITY CRIMINAL JUSTICE TRAINING 2023
936190,2/1/2023,CLT-VOLUNTARY - INVOLUNTARY TRANSPORTS
936190,2/1/2023,INVESTIGATIVE ENCOUNTERS 2023 - MODULE 1 INTRODUCTION TO SQF
936190,2/1/2023,INVESTIGATIVE ENCOUNTERS 2023: MODULE 2 SQF LEVEL 1
936190,2/1/2023,NYPD-U VOLUNTARY - INVOLUNTARY TRANSPORTS
936190,2/1/2023,RAISING THE LOWER AGE OF JUVENILE DELINQUENCY
936190,11/23/2022,VIDEO 1 - PATROLLING THE NYC SUBWAY SYSTEM 2022
936190,11/23/2022,VIDEO 2 -TACTICAL CONSIDERATIONS FOR TRANSIT PATROL 2022 (PART 1)
936190,11/23/2022,VIDEO 3 - TACTICAL CONSIDERATIONS FOR TRANSIT PATROL 2022 (PART 2)
936190,11/23/2022,VIDEO 4 - PLATFORM SAFETY 2022
936190,11/1/2022,LGBTQIA PLUS AWARENESS
936190,10/17/2022,BELT-WORN TRAUMA KIT REFRESHER TRAINING VIDEO-2022
936190,10/17/2022,PROCESSING CIVILIAN COMPLAINTS
936190,9/8/2022,THE EMPLOYEE ASSISTANCE UNIT (EAU) IS HERE FOR YOU
936190,9/5/2022,NYPD JOUVERT  WEST INDIAN DAY
936190,8/19/2022,2022 EQUAL EMPLOYMENT OPPORTUNITY TRAINING-SEXUAL HARASSMENT AWARENESS AND PREVENTION
936190,8/19/2022,CAR STOP TACTICS FOR PATROL OFFICERS - MODULE 1: CONTROLLING THE STOP
936190,8/19/2022,CAR STOP TACTICS FOR PATROL OFFICERS - MODULE 2: PROHIBITED MANEUVERS
936190,8/19/2022,CAR STOP TACTICS FOR PATROL OFFICERS - MODULE 3: THE UNKNOWN RISK STOP
936190,8/19/2022,CAR STOP TACTICS FOR PATROL OFFICERS - MODULE 4: THE HIGH-RISK STOP
936190,8/19/2022,CONVICTED OFFENDER DNA DATABANK SPECIMEN COLLECTION KIT
936190,8/19/2022,VEHICLE SEIZURE FORM
936190,6/2/2022,BEST PRACTICES IN STRUCTURED INTERVIEWING
936190,6/2/2022,ILLEGAL EVICTIONS
936190,6/2/2022,LOCAL LAW 45 OF 2021-TRAFFIC ENCOUNTERS
936190,6/2/2022,NATIONAL INCIDENT-BASED REPORTING SYSTEM (NIBRS) UPDATES TO THE OMNIFORM COMPLAINT SYSTEMV
936190,6/2/2022,PROHIBITED METHODS OF RESTRAINT
936190,4/29/2022,CONSTITUTIONAL POLICING AT COMMUNITY EVENTS (CPACE)
936190,4/15/2022,AWARENESS AND RESPONSE TO BIOLOGICAL INCIDENTS
936190,3/4/2022,ILERSBA - INITIAL LAW ENFORCMENT RESPONSE TO SUICIDE BOMBING ATTACKS
936190,12/29/2021,ARRESTS - RELIGIOUS HEAD COVERING GUIDELINES (PG 208-83)
936190,12/29/2021,IDENTIFYING THE IMPAIRED DRIVER
936190,12/29/2021,OVERVIEW OF THE NEW DISCOVERY LAWS 2021 REFRESHER
936190,12/29/2021,PATROL GUIDE 215-17 POLICE ACTIONS RELATED QUESTIONING ARRESTS AND INVESTIGATIONS AT A NYC DEPARTMEN
936190,11/12/2021,CONTERTERRORISM BUREAU SITE PROTECTION THROUGH OBSERVATIONAL TECHNIQUES
936190,10/27/2021,BODY-WORN CAMERA REVIEW PART ONE
936190,10/27/2021,BODY-WORN CAMERA REVIEW PART TWO
936190,9/18/2021,INFORMATION SECURITY AWARENESS TRAINING 2021
936190,9/16/2021,MAYOR EXECUTIVE ORDER 78 VACCINATION - TESTING COMPLIANCE POLICY
936190,9/16/2021,OPIOID OVERDOSE RECOGNITION AND NARCAN ADMINISTRATION -2021
936190,8/25/2021,ACTIVE BYSTANDERSHIP FOR LAW ENFORCEMENT (ABLE): ONE DAY COURSE
936190,8/20/2021,EQUAL EMPLOYMENT OPPORTUNITY TRAINING - SEXUAL HARASSMENT AWARENESS AND PREVENTION 2021
936190,4/23/2021,EMPLOYEE ASSISTANCE UNIT-2021
936190,4/23/2021,EQUAL EMPLOYMENT OPPORTUNITY TRAINING - LGBTQIA+ DIVERSITY AND INCLUSION / EXECUTIVE ORDER 16 OF 201
936190,3/8/2021,AXON AB2 TO AB3 REFRESH FOR ESU
936190,3/8/2021,DESK APPEARANCE TICKETS: THE NEW LAW AND THE NEW GUIDELINES FOR PROCESSING DAT'S - 2021 REFRESHER
936190,1/23/2021,COVID VACCINE DISTRIBUTION AND EDUCATION
936190,1/14/2021,EQUAL EMPLOYMENT OPPORTUNITY TRAINING - LEAVE TO EXPRESS BREAST MILK
936190,9/23/2020,"EQUAL EMPLOYMENT OPPORTUNITY TRAINING - SEXUAL HARASSMENT, AWARENESS AND PREVENTION"
936190,9/23/2020,NEW LAWS AFFECTING POLICE OFFICERS’ CRIMINAL AND CIVIL LIABILITY
936190,9/23/2020,VICTIM BLAMING AND RELEASE OF INFORMATION TO THE MEDIA
936190,8/17/2020,2017-2019 IN-SERVICE CYCLE-INVESTIGATIVE ENCOUNTERS- BASIC TRAINING WITH SCENARIOS
936190,6/23/2020,HEALTH AND WELLNESS SECTION - MODULE 12 - IN THAT DARK PLACE - AN OFFICER'S JOURNEY
936190,6/10/2020,FTS - BALLISTIC VEST REPLACEMENT - DISTRIBUTION - PRE AUGUST 2020
936190,5/27/2020,COVID-19: PREPAREDNESS YOUR FAMILY AND HOME
936190,5/27/2020,HEALTH AND WELLNESS SECTION - MODULE 1 - PSYCHOLOGICAL HEALTH AND WELLNESS
936190,5/27/2020,HEALTH AND WELLNESS SECTION - MODULE 10 - SEEKING AND RECEIVING MENTAL HEALTH SUPPORT
936190,5/27/2020,HEALTH AND WELLNESS SECTION - MODULE 11 - HEALTH AND RESILIENCY
936190,5/27/2020,HEALTH AND WELLNESS SECTION - MODULE 2 - JOB COUNSELING AND STRESS
936190,5/27/2020,HEALTH AND WELLNESS SECTION - MODULE 3 - WARNING SIGNS
936190,5/27/2020,HEALTH AND WELLNESS SECTION - MODULE 4 - CUMULATIVE TRAUMA
936190,5/27/2020,HEALTH AND WELLNESS SECTION - MODULE 5 - GAINING PERSPECTIVE
936190,5/27/2020,HEALTH AND WELLNESS SECTION - MODULE 6 - COPING WITH SIGNS OF ANXIETY DEPRESSION
936190,5/27/2020,HEALTH AND WELLNESS SECTION - MODULE 7 - LEADING WITH COMPASSION
936190,5/27/2020,"HEALTH AND WELLNESS SECTION - MODULE 8 - WARNING SIGNS, SUPPORT AND OUTREACH"
936190,5/27/2020,HEALTH AND WELLNESS SECTION - MODULE 9 - MANAGING STRESS ON THE JOB
936190,5/12/2020,COVID-19: PREPAREDENESS
936190,5/12/2020,COVID-19: PROTECTIVE MASKS
936190,4/30/2020,SAFETY CONSIDERATIONS FOR PATROLLING THE NYC SUBWAY SYSTEM -DANGERS OF THE PLATFORM EDGE
936190,2/18/2020,FTS - BALLISTIC VEST REPLACEMENT - MEASUREMENT - PRE AUG 2020
936190,2/18/2020,UTILIZING BALLISTIC PROTECTION IN DEPARTMENT VEHICLES (4:09)
936190,2/11/2020,CRIMINAL JUSTICE BUREAU - GIGLIO MATERIAL DISCLOSURES UNDER THE NEW DISCOVERY LAWS
936190,1/13/2020,PROCESSING DISCOVERY MATERIAL IN THE FORMS ARREST FOLDER
936190,1/3/2020,CROSSFIRE MITIGATION DURING CLOSE COMBAT INCIDENTS - PART 2
936190,12/12/2019,ACTIVITY LOG FOR IPHONE
936190,12/9/2019,CJB - DESK APPEARANCE TICKETS: THE NEW LAWS AND GUIDELINES FOR PROCESSING DATS
936190,12/9/2019,CJB - OVERVIEW OF THE NEW DISCOVERY LAWS
936190,12/9/2019,CROSSFIRE MITIGATION DURING CLOSE COMBAT INCIDENTS
936190,12/9/2019,DISCHARGING YOUR FIREARM AT A MOVING THREAT
936190,12/8/2019,RESPONDING TO COMMERCIAL ROBBERIES PART LL - MODULE 1 AND MODULE 2
936190,10/14/2019,CRIMINAL JUSTICE BUREAU - DNA TRAINING VIDEO
936190,10/14/2019,FORCE POLICY UPDATE VIDEO
936190,10/7/2019,CRITICAL DECISION MAKING MODEL
936190,10/7/2019,MARIJUANA POLICY UPDATE
936190,9/5/2019,DOMESTIC VIOLENCE EDUCATION AND COUNSELING
936190,9/3/2019,SHIELD OF RESILIENCE TRAINING COURSE
936190,8/14/2019,RESPONDING TO COMMERCIAL ROBBERIES
936190,7/30/2019,CPS FAIR AND IMPARTIAL POLICING - ALL POS AND DETS
936190,7/4/2019,TRANSIT BUREAU - SAFETY CONSIDERATIONS FOR PATROLLING THE NYC SUBWAY SYSTEM
936190,7/4/2019,TRANSIT BUREAU - SAFETY CONSIDERATIONS FOR PATROLLING THE NYC SUBWAY SYSTEM - PART 2
936190,7/4/2019,TRANSIT BUREAU - TIMELY RESUMPTION OF SERVICE IN NYC TRANSIT
936190,6/27/2019,RESPONDING TO PEOPLE IN CRISIS – MODULE 4: USING DEPARTMENT MOBILE DIGITAL DEVICES
936190,6/17/2019,COUNTER TERRORISM INITIAL PATROL RESPONSE TO AN ACTIVE SHOOTER
936190,6/10/2019,WORLDPRIDE NYC 2019
936190,5/26/2019,COLLABORATIVE POLICING - MEDIATION REFERRAL PROGRAM FOR NON-CRIMINAL COMPLAINTS
936190,5/16/2019,COLLABORATIVE POLICING - THE DEAF AND HARD OF HEARING COMMUNITY
936190,4/21/2019,RESPONDING TO PEOPLE IN CRISIS - MODULES 2 AND 3: ACTIVE LISTENING PARTS 1 AND 2
936190,4/7/2019,LEGAL BUREAU - PERJURY TRAINING MODULE
936190,3/21/2019,SAFEGUARDING PRISONERS - OFFICER SAFETY GUIDELINES
936190,3/10/2019,VERTEX 949 RADIO OPERATIONAL INSTRUCTIONS
936190,2/26/2019,COLLABORATIVE POLICING - ELDER ABUSE
936190,2/18/2019,"SUPPORT SERVICES DIVISION - CLASS ""C"" OPERATOR"
936190,1/15/2019,RESPONDING TO PEOPLE IN CRISIS - MODULE 1: SENDING THE RIGHT SIGNALS
936190,12/21/2018,EQUAL EMPLOYMENT OPPORTUNITYTRAINING - SEXUAL HARASSMENT AWARENESS AND PREVENTION
936190,12/10/2018,MARIJUANA BURNING ENFORCEMENT POLICY
936190,10/31/2018,AMERICANS WITH DISABILITIES ACT (ADA)
936190,10/14/2018,NEW DEPARTMENT POLICY - BURNING MARIJUANA IN PUBLIC
936190,10/14/2018,NEW PERFORMANCE EVALUATION PROCESS
936190,10/14/2018,NYC RIGHT TO KNOW ACT LEGISLATION - PART 2
936190,10/14/2018,NYC RIGHT TO KNOW ACT LEGISLATION – PART 1
936190,10/14/2018,PUBLIC CONTACT AND CONSENT TO SEARCH (RIGHT TO KNOW) - UNIT TRAINING AUGUST 2016
936190,10/14/2018,RESPONDING TO PEOPLE IN CRISIS-INTRODUCTION TO CIT VIDEO SERIES
936190,9/4/2018,RAISE THE AGE
936190,5/16/2018,COMMUNICATIONS- THE PROPER USAGE OF THE IDA RADIO CODES
936190,2/19/2018,IPHONE AND DAS MOBILE OPERATION
936190,2/19/2018,LEGAL BUREAU PERFORMANCE METRICS - PROHIBITED CONDUCT
936190,12/26/2017,COLLABORATIVE POLICING- FOREIGN LANGUAGE CERTIFICATION VIDEO
936190,11/30/2017,TACTICAL AWARENESS-SMARTPHONE SAFETY
936190,11/2/2017,COLLABORATIVE POLICING- ACCESSING TELEPHONIC INTERPRETERS VIA LANGUAGE LINE
936190,10/27/2017,BELT TRAUMA KIT VIDEO
936190,10/25/2017,COUNTERTERRORISM ACTIVE SHOOTER TRAINING
936190,10/25/2017,NARCAN NASAL SPRAY TRAINING
936190,10/25/2017,TACTICAL AWARENESS OF EXCITED DELIRIUM SYNDROME
936190,10/25/2017,TACTICAL AWARENESS- BALLISTIC VEST
936190,9/19/2017,INFORMATION SECURITY AWARENESS TRAINING
936190,9/19/2017,PATROL- POLYCARBONATE SHIELD
936190,7/25/2017,POLICE COMMISSIONERS MESSAGE - VICTIMS OF SEXUAL ASSAULT VIDEO
936190,7/14/2017,"CPS INTERIOR PATROL OF HOUSING AUTHORITY BUILDINGS, PG 212-60 ROLL CALL VIDEO 1"
936190,7/14/2017,"CPS INTERIOR PATROL OF HOUSING AUTHORITY BUILDINGS, PG 212-60 ROLL CALL VIDEO 2"
936190,7/14/2017,CPS INTERIOR PATROL TRESPASS AFFIDAVIT PROGRAM (TAP) VIDEO 1
936190,7/14/2017,CPS INTERIOR PATROL TRESPASS AFFIDAVIT PROGRAM (TAP) VIDEO 2
936190,7/14/2017,EQUAL EMPLOYMENT OPPORTUNITY TRANSGENDER DIVERSITY AND INCLUSION:EXECUTIVE ORDER 16
936190,7/14/2017,PERSONNEL BUREAU NYPD EMPLOYEE ASSISTANCE UNIT (EAU)
936190,6/27/2017,CRIMINAL JUSTICE REFORM ACT ROLL CALL TRAINING PART 1
936190,6/27/2017,CRIMINAL JUSTICE REFORM ACT ROLL CALL TRAINING PART 2
936190,5/2/2017,FORCE POLICY REVISION-VIDEO-PG 221-UNIT TRAINING MAY 2016
936190,2/15/2017,FUNDAMENTALS OF AUTO THEFT INVESTIGATION
936190,9/7/2016,INVESTIGATIVE ENCOUNTERS-VIDEO #1 REQUEST FOR INFO-UNIT TRAINING FEB 2016
936190,9/6/2016,INVESTIGATIVE ENCOUNTERS-VIDEO #2 COMMON LAW RIGHT OF INQUIRY-UNIT TRAINING MAY 2016
936190,9/6/2016,INVESTIGATIVE ENCOUNTERS-VIDEO #3 TERRY STOPS AND REASONABLE SUSPICION-UNIT TRAINING JUNE 2016
936190,9/6/2016,INVESTIGATIVE ENCOUNTERS-VIDEO #4 DOCUMENTATION AND SUPERVISION-UNIT TRAINING JULY 2016
936190,8/5/2016,FAQ: HOW TO SYNC YOUR DEPARTMENT SMARTPHONE
936190,12/14/2015,WINDOWS PHONE TRAINING AND DISTRIBUTION
936190,11/9/2015,EMERGENCY VEHICLE OPERATION JULY 03 - JUNE 07
936190,11/9/2015,FIELD TRAINING PROGRAM JULY 03 - JUNE 07
936190,11/9/2015,PHYSICAL EDUCATION PART 1: FOUNDATIONS OF PHYSICAL FITNESS
936190,11/9/2015,PHYSICAL EDUCATION PART 2: DEFENSIVE TACTICS
936190,11/9/2015,PHYSICAL EDUCATION PART 3: AMERICAN HEART ASSOCIATION BASIC LIFE SUPPORT
936190,11/9/2015,POLICE CRISIS INTERVENTION JULY 03 - JUNE 07
936190,11/9/2015,POLICE FIELD PROBLEMS JULY 03 - JUNE 07
936190,11/9/2015,POLICE INVESTIGATION AND REPORTING JULY 03 - JUNE 07
936190,11/9/2015,POLICING A DEMOCRACY JULY 03 - JUNE 07
936190,11/9/2015,POLICING SPECIAL POPULATIONS JULY 03 - JUNE 07
936190,11/9/2015,PROCEDURAL LAW JULY 03 - JUNE 07
936190,11/9/2015,SUBSTANTIVE LAW JULY 03 - JUNE 07
936190,11/9/2015,TERRORISM AWARENESS AND RESPONSE JULY 03 - JUNE 07
936190,1/17/2014,RADIO EMERGENCY PATROL (REP) QUALIFICATION
936190,10/10/2013,CONDUCTING FENCING OPERATIONS ON A PRECINCT LEVEL
936190,4/10/2013,I/NETDISPATCHER
936190,4/1/2013,IN-TAC TRAINING PROGRAM
936190,12/4/2012,FUNDAMENTALS OF AUTO THEFT INVESTIGATION
936190,8/1/2012,BICYCLE TRAINING (3-DAY)
936190,7/17/2012,UF 250 - OPERATION IMPACT REFRESHER CERTIFIED
936190,8/2/2011,PROPERTY EVIDENCE TRACKING SYSTEM
936190,2/3/2009,PLAIN CLOTHES TRAINING CERTIFIED BASIC PLAIN-CLOTHES COURSE
936190,5/21/2008,PSB MARIJUANA FIELD TESTING
936190,5/20/2008,MARIJUANA FIELD TESTING QUALIFIED
936190,6/23/2006,SOUND LEVEL METER TRAINING
936190,3/8/2006,STREET NARCOTICS ENFORCEMENT UNIT SNEU
936190,8/4/2005,COBRA - COHORT TRAINING
936190,1/10/2005,12 PASSENGER VAN / UTILITY VEHICLE QUALIFICATION
936190,1/10/2005,FOUR WHEEL DRIVE TRAINING
936190,,COLLISION REFRESHER (2 DAY)
936190,,COLLISION RETRAINING
936190,,FOUR WHEEL DRIVE TRAINING
936190,,RECRUIT 12 PASSENGER VAN / UTILITY VEHICLE QUALIFICATION
936190,,RECRUIT RMP QUALIFICATION / RMP OPERATOR QUALIFIED
957374,8/18/2025,CLT-DOMESTIC VIOLENCE TRAINING
957374,8/1/2025,CLT-DOMESTIC VIOLENCE TRAINING
957374,8/1/2025,CLT-PROCEDURAL OPERATIONS
957374,7/29/2025,CLT-DOMESTIC VIOLENCE TRAINING
957374,7/29/2025,CLT-PROCEDURAL OPERATIONS
957374,7/18/2025,PATROL TACTICS
957374,7/18/2025,SPECIAL VICTIMS UNIT - BEST PRACTICES GUIDE TRAINING
957374,6/19/2025,2025 BWC PROFICIENCY TRAINING
957374,6/19/2025,2025 EQUAL EMPLOYMENT OPPORTUNITY TRAINING - SEXUAL HARASSMENT AWARENESS AND PREVENTION
957374,6/19/2025,EAU 2025 POLICE COMMISSIONER JESSICA S. TISCH
957374,6/19/2025,SQF REVIEW AND DOCUMENTATION: SQF MODULE 10
957374,4/11/2025,FTS - TASER 7 ANNUAL RECERTIFICATION
957374,4/7/2025,CRISIS INTERVENTION TEAM TRAINING
957374,1/23/2025,2025 IDENTIFYING THE IMPAIRED DRIVER REFRESHER
957374,1/23/2025,ACTIVE SHOOTER - SCHOOL RESPONSE PROTOCOL
957374,1/23/2025,CELL BLOCK FIRESHIELD EV BLANKETS
957374,1/23/2025,INFORMATION SECURITY AWARENESS TRAINING 2024
957374,1/23/2025,KEVIN AND AVONTE SAFE HOME PROGRAM
957374,1/23/2025,MULTI-FACTOR AUTHENTICATION MFA TRAINING
957374,1/23/2025,NOTIFICATION OF ALLEGATIONS AND EMPLOYEE RIGHTS
957374,1/23/2025,RIGHT TO KNOW ACT SQF MODULE 9
957374,1/23/2025,VEHICLE PURSUITS
957374,1/16/2025,PSB AUXILIARY POLICE COORDINATOR TRAINING
957374,12/5/2024,CLT-DOMESTIC VIOLENCE TRAINING
957374,11/26/2024,BEHAVIORAL HEALTH EMERGENCY ASSISTANCE RESPONSE DIVISION B-HEARD
957374,11/15/2024,DRIVING WHILE INTOXICATED AWARENESS VIDEO MODULE 1
957374,11/15/2024,LEAVING THE SCENE COLLISIONS INVESTIGATIVE BEST PRACTICES
957374,10/15/2024,FAMILY BUILDING
957374,10/2/2024,NORTHWELL DIRECT FINEST CARE PROGRAM FOR UMOS
957374,8/21/2024,APX NEXT PORTABLE AND RADIO DISCIPLINE TRAINING VIDEO
957374,8/21/2024,RACIAL PROFILING AND BIASED BASED POLICING: SQF MODULE 8
957374,8/21/2024,RAPE IS RAPE
957374,8/21/2024,UNMANNED AIRCRAFT SYSTEMS VISUAL OBSERVER
957374,8/9/2024,FTS - CEW TASER 7 TRANSITION COURSE
957374,8/9/2024,FTS - TASER 7 HOLSTER DISTRIBUTION
957374,7/23/2024,CLT-DOMESTIC VIOLENCE TRAINING
957374,7/13/2024,CLT-DOMESTIC VIOLENCE TRAINING
957374,7/9/2024,MENTAL HEALTH INVOLUNTARY REMOVALS MHL 9.41 AND MHL 9.58
957374,6/25/2024,TACTICS WHEN ENGAGING INDIVIDUALS IN A MENTAL HEALTH CRISIS
957374,6/20/2024,CLT-DOCUMENTATION AND FORMS
957374,6/20/2024,CLT-DOMESTIC VIOLENCE TRAINING
957374,6/20/2024,CLT-LEGAL ISSUES
957374,6/20/2024,LEVEL 1 AND LEVEL 2 INVESTIGATIVE ENCOUNTERS
957374,6/13/2024,CLT-DOMESTIC VIOLENCE TRAINING
957374,6/13/2024,CLT-PROCEDURAL OPERATIONS
957374,6/12/2024,CLT-DOMESTIC VIOLENCE TRAINING
957374,6/12/2024,CLT-PROCEDURAL OPERATIONS
957374,6/5/2024,CLT-DOMESTIC VIOLENCE TRAINING
957374,6/5/2024,CLT-PROCEDURAL OPERATIONS
957374,5/25/2024,CLT-DOMESTIC VIOLENCE TRAINING
957374,5/25/2024,CLT-PROCEDURAL OPERATIONS
957374,5/24/2024,ACCURATE COMPLAINT REPORT CLASSIFICATION
957374,5/24/2024,CLT-DOMESTIC VIOLENCE TRAINING
957374,5/24/2024,CLT-PROCEDURAL OPERATIONS
957374,5/11/2024,CLT-DOMESTIC VIOLENCE TRAINING
957374,5/11/2024,CLT-PROCEDURAL OPERATIONS
957374,5/10/2024,2024 EQUAL EMPLOYMENT OPPORTUNITY TRAINING - SEXUAL HARASSMENT AWARENESS AND PREVENTION
957374,5/10/2024,ASSISTING SURVIVORS OF SEXUAL BASED VIOLENCE WITH ACCESS TO RESOURCES
957374,5/10/2024,DRIVE SMART 2024
957374,5/10/2024,HOUSING BUREAU INTERIOR PATROL TACTICS
957374,5/8/2024,FTS - ANNUAL CEW RECERTIFICATION
957374,4/23/2024,POLICING THE SUBWAY 2024
957374,4/6/2024,CLT - OATH VS. CRIMINAL COURT SUMMONS ROLL CALL TRAINING
957374,3/27/2024,CLT-PROCEDURAL OPERATIONS
957374,3/20/2024,2024 VEHICLE SEIZURE FORM REFRESHER
957374,3/20/2024,EMPLOYEE ASSISTANCE UNIT (E.A.U.) IS HERE FOR YOU- 2024
957374,3/20/2024,NYCHA INTERIOR PATROL: SQF MODULE 7
957374,2/29/2024,1-DAY LAW ENFORCEMENT ACTIVE SHOOTER EMERGENCY RESPONSE (PER-375-C)
957374,2/22/2024,AUTISM SPECTRUM DISORDER
957374,1/17/2024,INVESTIGATIVE ENCOUNTERS SUMMARY: SQF MODULE 6
957374,1/16/2024,CLT-PROCEDURAL OPERATIONS
957374,1/6/2024,CLT-DOCUMENTATION AND FORMS
957374,1/4/2024,CONTERTERRORISM BUREAU SITE PROTECTION THROUGH OBSERVATIONAL TECHNIQUES
957374,1/4/2024,LGBTQIA PLUS - DIVERSITY AND INCLUSION
957374,1/4/2024,OPIOID DANGERS- FENTANYL AND CARFENTANIL
957374,1/4/2024,"POSSESSION OR INGESTION OF ANABOLIC STEROIDS, HUMAN GROWTH HORMONE, AND NUTRITIONAL SUPPLEMENTS"
957374,12/6/2023,AUGMENTED REALITY FEATURE
957374,12/6/2023,ELDER ABUSE -2023 REFRESHER
957374,11/11/2023,2023 TASER X26P RE-QUALIFICATION
957374,11/5/2023,SRG - RAPID MOBILIZATION (PATROL) LEVEL 4
957374,11/4/2023,CLT-TACTICAL AWARENESS AND OFFICER SAFETY
957374,11/1/2023,CLT-EQUAL EMPLOYMENT OPPORTUNITY
957374,11/1/2023,CLT-PROCEDURAL OPERATIONS
957374,10/21/2023,EFFECTIVE COMMUNICATION SKILLS - DEAF OR HARD OF HEARING
957374,10/21/2023,INFORMATION SECURITY AWARENESS TRAINING - 2023
957374,10/21/2023,INVESTIGATIVE ENCOUNTERS 2023: MODULE 5 SQF LEVELS 3 AND 4
957374,10/21/2023,NYPD JOUVERT AND WEST INDIAN DAY-2023
957374,10/21/2023,NYPD RECRUITMENT TRAINING VIDEO
957374,10/21/2023,VEHICLE MOUNTED VIDEO SYSTEM
957374,9/28/2023,CLT-PATROL TACTICS ROLLCALL TRAINING VIDEO SERIES
957374,8/26/2023,CLT-PATROL TACTICS ROLLCALL TRAINING VIDEO SERIES
957374,8/22/2023,CLT-PROFESSIONAL DEVELOPMENT
957374,8/9/2023,2023 SUMMER ALL-OUT BODY WORN CAMERA TRAINING
957374,8/9/2023,TRAFFIC COURT TESTIMONY VIDEO
957374,8/9/2023,UNMANNED AIRCRAFT PERMIT: DRONES FOR PUBLIC USE
957374,8/4/2023,CLT-DOCUMENTATION AND FORMS
957374,7/14/2023,CLT-DOCUMENTATION AND FORMS
957374,7/11/2023,DOCUMENT INSPECTION FOR LAW ENFORCEMENT (PER-383)
957374,5/30/2023,CLT-PARK SMART ROLLCALL PRESENTATION
957374,5/26/2023,"INVESTIGATIVE ENCOUNTERS 2023: MODULE 4 SQF LEVELS 2, 3 AND 4"
957374,5/25/2023,CLT-PARK SMART ROLLCALL PRESENTATION
