taxid,date,name
942156,ASSISTING SURVIVORS OF SEXUAL BASED VIOLENCE WITH ACCESS TO RESOURCES,5/1/2024
942156,HOUSING BUREAU INTERIOR PATROL TACTICS,5/1/2024
942156,2024 VEHICLE SEIZURE FORM REFRESHER,4/9/2024
942156,POLICING THE SUBWAY 2024,4/8/2024
942156,NYCHA INTERIOR PATROL: SQF MODULE 7,3/13/2024
942156,EMPLOYEE ASSISTANCE UNIT (E.A.U.) IS HERE FOR YOU- 2024,3/11/2024
942156,AUTISM SPECTRUM DISORDER,1/18/2024
942156,LGBTQIA PLUS - DIVERSITY AND INCLUSION,1/2/2024
942156,"POSSESSION OR INGESTION OF ANABOLIC STEROIDS, HUMAN GROWTH HORMONE, AND NUTRITIONAL SUPPLEMENTS",1/2/2024
942156,INVESTIGATIVE ENCOUNTERS SUMMARY: SQF MODULE 6,12/19/2023
942156,OPIOID DANGERS- FENTANYL AND CARFENTANIL,12/19/2023
942156,SRG - RAPID MOBILIZATION (PATROL) LEVEL 4,12/18/2023
942156,SRG - RAPID MOBILIZATION (PATROL) LEVEL 4,12/14/2023
942156,AUGMENTED REALITY FEATURE,12/4/2023
942156,FTS - ANNUAL CEW RECERTIFICATION,11/22/2023
942156,SRG - RAPID MOBILIZATION (PATROL) LEVEL 4,11/20/2023
942156,ELDER ABUSE -2023 REFRESHER,11/3/2023
942156,INVESTIGATIVE ENCOUNTERS 2023: MODULE 5 SQF LEVELS 3 AND 4,10/20/2023
942156,NYPD RECRUITMENT TRAINING VIDEO,10/18/2023
942156,VEHICLE MOUNTED VIDEO SYSTEM,10/18/2023
942156,INFORMATION SECURITY AWARENESS TRAINING - 2023,10/3/2023
942156,EFFECTIVE COMMUNICATION SKILLS - DEAF OR HARD OF HEARING,9/26/2023
942156,NYPD JOUVERT AND WEST INDIAN DAY-2023,8/30/2023
942156,2023 SUMMER ALL-OUT BODY WORN CAMERA TRAINING,8/15/2023
942156,UNMANNED AIRCRAFT PERMIT: DRONES FOR PUBLIC USE,8/3/2023
942156,TRAFFIC COURT TESTIMONY VIDEO,7/18/2023
942156,2023 EQUAL EMPLOYMENT OPPORTUNITY TRAINING-SEXUAL HARASSMENT AWARENESS AND PREVENTION,5/22/2023
942156,"INVESTIGATIVE ENCOUNTERS 2023: MODULE 4 SQF LEVELS 2, 3 AND 4",5/19/2023
942156,2023 LANGUAGE MATTERS - FOSTERING A POSITIVE WORK ENVIRONMENT,4/10/2023
942156,INVESTIGATIVE ENCOUNTERS 2023: MODULE 3 SQF LEVEL 2,3/24/2023
942156,ESPER POLICY LIBRARY,3/21/2023
942156,INFORMATION SECURITY CRIMINAL JUSTICE TRAINING 2023,2/22/2023
942156,NYPD-U VOLUNTARY - INVOLUNTARY TRANSPORTS,1/25/2023
942156,RAISING THE LOWER AGE OF JUVENILE DELINQUENCY,1/19/2023
942156,INVESTIGATIVE ENCOUNTERS 2023: MODULE 2 SQF LEVEL 1,1/6/2023
942156,INVESTIGATIVE ENCOUNTERS 2023 - MODULE 1 INTRODUCTION TO SQF,12/14/2022
942156,FTS - ANNUAL CEW RECERTIFICATION,11/25/2022
942156,VIDEO 1 - PATROLLING THE NYC SUBWAY SYSTEM 2022,11/22/2022
942156,VIDEO 2 -TACTICAL CONSIDERATIONS FOR TRANSIT PATROL 2022 (PART 1),11/22/2022
942156,VIDEO 3 - TACTICAL CONSIDERATIONS FOR TRANSIT PATROL 2022 (PART 2),11/22/2022
942156,VIDEO 4 - PLATFORM SAFETY 2022,11/22/2022
942156,LGBTQIA PLUS AWARENESS,11/2/2022
942156,PROCESSING CIVILIAN COMPLAINTS,10/10/2022
942156,BELT-WORN TRAUMA KIT REFRESHER TRAINING VIDEO-2022,10/4/2022
942156,REGISTRATION OF AIM,9/27/2022
942156,THE EMPLOYEE ASSISTANCE UNIT (EAU) IS HERE FOR YOU,9/9/2022
942156,AIM COMPONENTS,9/2/2022
942156,VIPER CCTV TRAINING COURSE,9/2/2022
942156,2021 EXECUTIVE CONFERENCE - VIDEOS,9/1/2022
942156,INTRODUCTION TO COGNOS 11,9/1/2022
942156,NYPD JOUVERT  WEST INDIAN DAY,8/29/2022
942156,COVID-19 SELF-COLLECTION KIT INSTRUCTIONS,8/4/2022
942156,VEHICLE SEIZURE FORM,7/8/2022
942156,CONVICTED OFFENDER DNA DATABANK SPECIMEN COLLECTION KIT,7/6/2022
942156,"INTEGRATING COMMUNICATION, ASSESSMENT, AND TACTICS (ICAT) MODULE 7",7/6/2022
942156,2022 EQUAL EMPLOYMENT OPPORTUNITY TRAINING-SEXUAL HARASSMENT AWARENESS AND PREVENTION,7/5/2022
942156,"INTEGRATING COMMUNICATION, ASSESSMENT AND TACTICS (ICAT) MODULE 6",7/5/2022
942156,CAR STOP TACTICS FOR PATROL OFFICERS - MODULE 1: CONTROLLING THE STOP,6/24/2022
942156,CAR STOP TACTICS FOR PATROL OFFICERS - MODULE 2: PROHIBITED MANEUVERS,6/24/2022
942156,CAR STOP TACTICS FOR PATROL OFFICERS - MODULE 3: THE UNKNOWN RISK STOP,6/24/2022
942156,CAR STOP TACTICS FOR PATROL OFFICERS - MODULE 4: THE HIGH-RISK STOP,6/24/2022
942156,BEST PRACTICES IN STRUCTURED INTERVIEWING,6/6/2022
942156,NATIONAL INCIDENT-BASED REPORTING SYSTEM (NIBRS) UPDATES TO THE OMNIFORM COMPLAINT SYSTEMV,6/6/2022
942156,PROHIBITED METHODS OF RESTRAINT,5/27/2022
942156,"INTEGRATING COMMUNICATION, ASSESSMENT AND TACTICS (ICAT) MODULE 5",4/15/2022
942156,"INTEGRATING COMMUNICATION, ASSESSMENT AND TACTICS (ICAT) MODULE 4",2/24/2022
942156,SRG - LONG RANGE ACOUSTIC DEVICE (LRAD)”,2/4/2022
942156,ILLEGAL EVICTIONS,1/26/2022
942156,"INTEGRATING COMMUNICATION, ASSESSMENT AND TACTICS (ICAT) MODULE 3",1/5/2022
942156,LOCAL LAW 45 OF 2021-TRAFFIC ENCOUNTERS,1/1/2022
942156,IDENTIFYING THE IMPAIRED DRIVER,11/29/2021
942156,"INTEGRATING COMMUNICATION, ASSESSMENT AND TACTICS (ICAT) MODULE 2",11/15/2021
942156,ARRESTS - RELIGIOUS HEAD COVERING GUIDELINES (PG 208-83),11/12/2021
942156,"INTEGRATING COMMUNICATION, ASSESSMENT AND TACTICS (ICAT) MODULE 1",11/10/2021
942156,BODY-WORN CAMERA REVIEW PART TWO,10/12/2021
942156,NEIGHBORHOOD POLICING APPLICATION TRAINING VIDEO,9/21/2021
942156,BODY-WORN CAMERA REVIEW PART ONE,9/17/2021
942156,INFORMATION SECURITY AWARENESS TRAINING 2021,9/17/2021
942156,OPIOID OVERDOSE RECOGNITION AND NARCAN ADMINISTRATION -2021,9/17/2021
942156,MAYOR EXECUTIVE ORDER 78 VACCINATION - TESTING COMPLIANCE POLICY,9/10/2021
942156,IPHONE AND DAS MOBILE OPERATION,7/27/2021
942156,EQUAL EMPLOYMENT OPPORTUNITY TRAINING - SEXUAL HARASSMENT AWARENESS AND PREVENTION 2021,7/1/2021
942156,HEALTH AND WELLNESS SECTION - CHILD MIND INSTITUTE VIDEO SERIES - MODULE 2 - WHEN TO WORRY ABOUT YOU,5/20/2021
942156,HEALTH AND WELLNESS SECTION - CHILD MIND INSTITUTE VIDEO SERIES - MODULE 3 - CHILDREN'S MENTAL HEALT,5/20/2021
942156,HEALTH AND WELLNESS SECTION - CHILD MIND INSTITUTE VIDEO SERIES - MODULE 4 - RAISING SELF SUFFICIENT,5/20/2021
942156,HEALTH AND WELLNESS SECTION - MODULE 17 - FINANCIAL WILLS AND TRUSTS,5/20/2021
942156,HEALTH AND WELLNESS SECTION - MODULE 18 - YOGA MYTH BUSTING,5/20/2021
942156,HEALTH AND WELLNESS SECTION - MODULE 19 - STOP SMOKING - NYC ESCAPE PROGRAM,5/20/2021
942156,HEALTH AND WELLNESS SECTION - MODULE 20 - POPPA TESTIMONIAL VIDEO,5/20/2021
942156,HEALTH AND WELLNESS SECTION - MYPLATE APP TUTORIAL,5/20/2021
942156,HEALTH AND WELLNESS SECTION - NUTRITIONAL SERIES: DIETING FOR WEIGHT LOSS - MODULE 1 - INTRODUCTION,5/20/2021
942156,OVERVIEW OF THE NEW DISCOVERY LAWS 2021 REFRESHER,5/19/2021
942156,HEALTH AND WELLNESS SECTION - CHILD MIND INSTITUTE VIDEO SERIES - MODULE 1 - BEHAVIOR MANAGEMENT STR,5/14/2021
942156,PATROL GUIDE 215-17 POLICE ACTIONS RELATED QUESTIONING ARRESTS AND INVESTIGATIONS AT A NYC DEPARTMEN,5/14/2021
942156,EMPLOYEE ASSISTANCE UNIT-2021,4/19/2021
942156,EQUAL EMPLOYMENT OPPORTUNITY TRAINING - LGBTQIA+ DIVERSITY AND INCLUSION / EXECUTIVE ORDER 16 OF 201,3/31/2021
942156,DESK APPEARANCE TICKETS: THE NEW LAW AND THE NEW GUIDELINES FOR PROCESSING DAT'S - 2021 REFRESHER,3/8/2021
942156,COVID VACCINE DISTRIBUTION AND EDUCATION,1/22/2021
942156,FTS - ANNUAL CEW RECERTIFICATION,12/21/2020
942156,EQUAL EMPLOYMENT OPPORTUNITY TRAINING - LEAVE TO EXPRESS BREAST MILK,11/30/2020
942156,HEALTH AND WELLNESS SECTION - FINANCIAL LITERACY SERIES - MODULE 2 - YOUR INCOME AND EXPENSES,10/29/2020
942156,HEALTH AND WELLNESS SECTION - FINANCIAL LITERACY SERIES - MODULE 3 - YOUR SPENDING AND SAVINGS PLAN,10/29/2020
942156,HEALTH AND WELLNESS SECTION - FINANCIAL LITERACY SERIES - MODULE 4 - MANAGING DEBT,10/29/2020
942156,HEALTH AND WELLNESS SECTION - FINANCIAL LITERACY SERIES - MODULE 1 - YOUR MONEY VALUES AND INFLUENCE,9/2/2020
942156,HEALTH AND WELLNESS SECTION - MODULE 16 - GRIEF AND COPING,9/2/2020
942156,HEALTH AND WELLNESS SECTION - MODULE 15 - FINANCIAL WELLNESS PART 2,7/31/2020
942156,"EQUAL EMPLOYMENT OPPORTUNITY TRAINING - SEXUAL HARASSMENT, AWARENESS AND PREVENTION",7/9/2020
942156,VICTIM BLAMING AND RELEASE OF INFORMATION TO THE MEDIA,7/8/2020
942156,NEW LAWS AFFECTING POLICE OFFICERS’ CRIMINAL AND CIVIL LIABILITY,7/3/2020
942156,HEALTH AND WELLNESS SECTION - MODULE 12 - IN THAT DARK PLACE - AN OFFICER'S JOURNEY,6/23/2020
942156,HEALTH AND WELLNESS SECTION - MODULE 14 - FINANCIAL WELLNESS PART 1,6/23/2020
942156,HEALTH AND WELLNESS SECTION - MODULE 13 - MINDFULNESS,6/22/2020
942156,TRAINING BUREAU - ACCREDITATION FAMILIARIZATION TRAINING,5/28/2020
942156,COVID-19: PREPAREDNESS YOUR FAMILY AND HOME,5/25/2020
942156,HEALTH AND WELLNESS SECTION - MODULE 1 - PSYCHOLOGICAL HEALTH AND WELLNESS,5/25/2020
942156,HEALTH AND WELLNESS SECTION - MODULE 10 - SEEKING AND RECEIVING MENTAL HEALTH SUPPORT,5/25/2020
942156,HEALTH AND WELLNESS SECTION - MODULE 11 - HEALTH AND RESILIENCY,5/25/2020
942156,HEALTH AND WELLNESS SECTION - MODULE 2 - JOB COUNSELING AND STRESS,5/25/2020
942156,HEALTH AND WELLNESS SECTION - MODULE 3 - WARNING SIGNS,5/25/2020
942156,HEALTH AND WELLNESS SECTION - MODULE 4 - CUMULATIVE TRAUMA,5/25/2020
942156,HEALTH AND WELLNESS SECTION - MODULE 5 - GAINING PERSPECTIVE,5/25/2020
942156,HEALTH AND WELLNESS SECTION - MODULE 6 - COPING WITH SIGNS OF ANXIETY DEPRESSION,5/25/2020
942156,HEALTH AND WELLNESS SECTION - MODULE 7 - LEADING WITH COMPASSION,5/25/2020
942156,"HEALTH AND WELLNESS SECTION - MODULE 8 - WARNING SIGNS, SUPPORT AND OUTREACH",5/25/2020
942156,HEALTH AND WELLNESS SECTION - MODULE 9 - MANAGING STRESS ON THE JOB,5/25/2020
942156,COVID-19: PREPAREDENESS,5/12/2020
942156,COVID-19: PROTECTIVE MASKS,5/12/2020
942156,SAFETY CONSIDERATIONS FOR PATROLLING THE NYC SUBWAY SYSTEM -DANGERS OF THE PLATFORM EDGE,4/29/2020
942156,AXON CASES 2.0,4/22/2020
942156,AXON TRAINING - MODULE 1 AXON BODY 2 BASIC OPERATION,4/22/2020
942156,CRIMINAL JUSTICE BUREAU - GIGLIO MATERIAL DISCLOSURES UNDER THE NEW DISCOVERY LAWS,2/17/2020
942156,UTILIZING BALLISTIC PROTECTION IN DEPARTMENT VEHICLES (4:09),2/17/2020
942156,CROSSFIRE MITIGATION DURING CLOSE COMBAT INCIDENTS - PART 2,2/4/2020
942156,SAFEGUARDING HOSPITALIZED PRISONERS,2/4/2020
942156,PROCESSING DISCOVERY MATERIAL IN THE FORMS ARREST FOLDER,1/23/2020
942156,CROSSFIRE MITIGATION DURING CLOSE COMBAT INCIDENTS,12/13/2019
942156,ACTIVITY LOG FOR IPHONE,12/4/2019
942156,INCREASE OFFICER SAFETY DURING VEHICLE STOPS,12/2/2019
942156,CJB - DESK APPEARANCE TICKETS: THE NEW LAWS AND GUIDELINES FOR PROCESSING DATS,11/28/2019
942156,CJB - OVERVIEW OF THE NEW DISCOVERY LAWS,11/28/2019
942156,RESPONDING TO COMMERCIAL ROBBERIES PART LL - MODULE 1 AND MODULE 2,11/28/2019
942156,DISCHARGING YOUR FIREARM AT A MOVING THREAT,11/19/2019
942156,SUCCESSFULLY DISARMING AN EMOTIONALLY DISTURBED PERSON,10/28/2019
942156,EXECUTIVE HEALTH AND WELLNESS TRAINING - MODULE 8,10/22/2019
942156,EXECUTIVE HEALTH AND WELLNESS TRAINING - MODULE 9,10/22/2019
942156,EXECUTIVE HEALTH AND WELLNESS TRAINING - MODULE 4,10/15/2019
942156,EXECUTIVE HEALTH AND WELLNESS TRAINING - MODULE 5,10/15/2019
942156,EXECUTIVE HEALTH AND WELLNESS TRAINING - MODULE 6,10/15/2019
942156,EXECUTIVE HEALTH AND WELLNESS TRAINING - MODULE 7,10/15/2019
942156,CRIMINAL JUSTICE BUREAU - DNA TRAINING VIDEO,10/11/2019
942156,EXECUTIVE HEALTH AND WELLNESS CONFERENCE - MODULE 1,10/11/2019
942156,EXECUTIVE HEALTH AND WELLNESS TRAINING - MODULE 10,10/11/2019
942156,EXECUTIVE HEALTH AND WELLNESS TRAINING - MODULE 2,10/11/2019
942156,EXECUTIVE HEALTH AND WELLNESS TRAINING - MODULE 3,10/11/2019
942156,FORCE POLICY UPDATE VIDEO,10/11/2019
942156,PRISONER ESCAPE WARNING SIGNS,10/11/2019
942156,CRITICAL DECISION MAKING MODEL,10/1/2019
942156,MARIJUANA POLICY UPDATE,9/17/2019
942156,DOMESTIC VIOLENCE EDUCATION AND COUNSELING,9/3/2019
942156,INFORMATION SECURITY AWERENESS TRAINING 2019,8/28/2019
942156,SHIELD OF RESILIENCE TRAINING COURSE,8/20/2019
942156,COBALT,8/9/2019
942156,COLLABORATIVE POLICING- POLICING IN TODAY’S MULTI-FAITH NY,8/7/2019
942156,CRITICAL INCIDENT TACTICS - RESPONDING TO COMMERCIAL ROBBERIES (EXTENDED VERSION),8/7/2019
942156,DAS PATTERN MODE,8/7/2019
942156,DEATH BY POWERPOINT,8/7/2019
942156,DOMAIN AWARENESS SYSTEM - SEARCH ACCURINT RESULTS,8/7/2019
942156,DOMAIN AWARNESS SYSTEM (DAS),8/7/2019
942156,FACILITIES MANAGEMENT DIVISION - MUNICIPAL SEPERATE STORM SEWER SYSTEM (MS4),8/7/2019
942156,FORCE POLICY REVISION-VIDEO-PG 221-UNIT TRAINING MAY 2016,8/7/2019
942156,"FORMS - THREAT,RESISTANCE,INJURY (TRI)",8/7/2019
942156,MOBILE IDENTIFICATION DEVICE (MORPHO),8/7/2019
942156,NEW NYPD PORTAL,8/7/2019
942156,NYPD MOBILITY INITIATIVE - DEPARTMENT SMARTPHONE TRAINING,8/7/2019
942156,STOP REPORT,8/7/2019
942156,VERTEX 949 RADIO OPERATIONAL INSTRUCTIONS,8/7/2019
942156,WARRANT CHECK IN DOMAIN AWARENESS SYSTEM (DAS LITE),8/7/2019
942156,FTS - ANNUAL CEW RECERTIFICATION,8/6/2019
942156,EXECUTIVE CONFERENCE VIDEO 10-17-18: LEADERSHIP ON AND OFF THE BATTLEFIELD: GENERAL JOHN R. ALLEN (P,8/5/2019
942156,EXECUTIVE CONFERENCE VIDEO 10-17-18: MAKING IT REAL-GETTING FROM HERE TO THERE TOGETHER - DR SCOTT L,8/5/2019
942156,RESPONDING TO COMMERCIAL ROBBERIES,8/5/2019
942156,AIM REGISTRATION AND SYNCHRONIZATION 2.0,8/2/2019
942156,COUNTERTERRORISM BUREAU ACTIVE SHOOTER SCHOOL INCIDENTS AWARENESS,8/2/2019
942156,COUNTERTERRORISM BUREAU NH15 TRAINING,8/1/2019
942156,TRANSIT BUREAU - SAFETY CONSIDERATIONS FOR PATROLLING THE NYC SUBWAY SYSTEM,7/4/2019
942156,TRANSIT BUREAU - SAFETY CONSIDERATIONS FOR PATROLLING THE NYC SUBWAY SYSTEM - PART 2,7/4/2019
942156,DISCUSSION - BASED LEARNING MODULE # 1-3,6/24/2019
942156,RESPONDING TO PEOPLE IN CRISIS – MODULE 4: USING DEPARTMENT MOBILE DIGITAL DEVICES,6/24/2019
942156,WORLDPRIDE NYC 2019,6/7/2019
942156,COLLABORATIVE POLICING - MEDIATION REFERRAL PROGRAM FOR NON-CRIMINAL COMPLAINTS,5/27/2019
942156,DETECTIVE BUREAU RETRIEVING BODY WORN CAMERA DATA,5/15/2019
942156,CLT-PROCEDURAL OPERATIONS,5/3/2019
942156,RESPONDING TO PEOPLE IN CRISIS - MODULES 2 AND 3: ACTIVE LISTENING PARTS 1 AND 2,4/22/2019
942156,COLLABORATIVE POLICING - THE DEAF AND HARD OF HEARING COMMUNITY,4/15/2019
942156,LEGAL BUREAU - PERJURY TRAINING MODULE,4/15/2019
942156,"EXECUTIVE CONFERENCE VIDEO 10-17-18: DISCUSSION WITH INDRA NOOYI, CHAIRMAN OF PEPSI CO",3/31/2019
942156,"EXECUTIVE CONFERENCE VIDEO 10-17-18: INTELLIGENT LEADERSHIP: GEORGE TENET, FORMER (DIRECTOR OF CENTR",3/31/2019
942156,SAFEGUARDING PRISONERS - OFFICER SAFETY GUIDELINES,3/24/2019
942156,COLLABORATIVE POLICING - ELDER ABUSE,2/21/2019
942156,DYNAMICS 311 - THE NEW 311,2/11/2019
942156,"SUPPORT SERVICES DIVISION - CLASS ""C"" OPERATOR",2/7/2019
942156,TEXT TO 911 - INTRODUCTION,2/1/2019
942156,CLT-PROCEDURAL OPERATIONS,1/16/2019
942156,EQUAL EMPLOYMENT OPPORTUNITYTRAINING - SEXUAL HARASSMENT AWARENESS AND PREVENTION,1/13/2019
942156,RESPONDING TO PEOPLE IN CRISIS - MODULE 1: SENDING THE RIGHT SIGNALS,1/13/2019
942156,PATROL DOOR BAG - ROPE AND WEDGE INTRODUCTION,1/10/2019
942156,FTS - ANNUAL CEW RECERTIFICATION,12/5/2018
942156,MARIJUANA BURNING ENFORCEMENT POLICY,12/3/2018
942156,TRANSIT BUREAU - TIMELY RESUMPTION OF SERVICE IN NYC TRANSIT,11/21/2018
942156,AMERICANS WITH DISABILITIES ACT (ADA),11/4/2018
942156,AIM COMPONENTS 2.0,10/30/2018
942156,COLLABORATIVE POLICING- HUMAN TRAFFICKING,10/30/2018
942156,"CPS INTERIOR PATROL OF HOUSING AUTHORITY BUILDINGS, PG 212-60 ROLL CALL VIDEO 2",10/22/2018
942156,RESPONDING TO PEOPLE IN CRISIS-INTRODUCTION TO CIT VIDEO SERIES,10/22/2018
942156,CPS BODY-WORN CAMERA TRAINING WITH SCENARIOS,10/10/2018
942156,NEW PERFORMANCE EVALUATION PROCESS,10/10/2018
942156,PUBLIC CONTACT AND CONSENT TO SEARCH (RIGHT TO KNOW) - UNIT TRAINING AUGUST 2016,10/10/2018
942156,"CPS INTERIOR PATROL OF HOUSING AUTHORITY BUILDINGS, PG 212-60 ROLL CALL VIDEO 1",10/8/2018
942156,NYC RIGHT TO KNOW ACT LEGISLATION - PART 2,9/24/2018
942156,NYC RIGHT TO KNOW ACT LEGISLATION – PART 1,9/24/2018
942156,RAISE THE AGE,9/14/2018
942156,CLT-PROCEDURAL OPERATIONS,9/6/2018
942156,CLT-CRIME CONTROL STRATEGIES AND PROBLEM SOLVING,8/3/2018
942156,TACTICAL LEADERSHIP,7/23/2018
942156,FTS - CEW END USER CERTIFICATION,7/20/2018
942156,EQUAL EMPLOYMENT OPPORTUNITY TRAINING FOR UNIFORM SUPERVISORS,7/19/2018
942156,LIEUTENANT ADVANCED LEADERSHIP COMPUTER COURSE,7/13/2018
942156,CRISIS INTERVENTION TEAM TRAINING,7/12/2018
942156,2017-2019 IN-SERVICE CYCLE-INTEGRATED TACTICS,5/30/2018
942156,INVESTIGATIVE ENCOUNTERS-VIDEO #1 REQUEST FOR INFO-UNIT TRAINING FEB 2016,5/23/2018
942156,INVESTIGATIVE ENCOUNTERS-VIDEO #2 COMMON LAW RIGHT OF INQUIRY-UNIT TRAINING MAY 2016,5/23/2018
942156,INVESTIGATIVE ENCOUNTERS-VIDEO #3 TERRY STOPS AND REASONABLE SUSPICION-UNIT TRAINING JUNE 2016,5/23/2018
942156,INVESTIGATIVE ENCOUNTERS-VIDEO #4 DOCUMENTATION AND SUPERVISION-UNIT TRAINING JULY 2016,5/23/2018
942156,TACTICAL AWARENESS OF EXCITED DELIRIUM SYNDROME,5/23/2018
942156,TACTICAL AWARENESS- BALLISTIC VEST,5/23/2018
942156,COMMUNICATIONS- THE PROPER USAGE OF THE IDA RADIO CODES,5/16/2018
942156,CPS FAIR AND IMPARTIAL POLICING - ALL POS AND DETS,3/16/2018
942156,BELT TRAUMA KIT VIDEO,2/17/2018
942156,COUNTERTERRORISM U.A.S. (UNMANNED AIRCRAFT SYSTEMS) DRONE AWARENESS,2/17/2018
942156,"FOX TALKS: TRANSITIONAL ANXIETY WITH CHIEF JOSEPH FOX, TRANSIT BUREAU",2/17/2018
942156,POLICE COMMISSIONER MESSAGE- NYC GIVES,2/17/2018
942156,COUNTERTERRORISM BUREAU FACILITY AWARENESS VIDEO- TIME WARNER BUILDING,2/16/2018
942156,"COUNTERTERRORISM BUREAU FACILITY AWARENESS- THE INTREPID SEA, AIR AND SPACE MUSEUM",2/16/2018
942156,COUNTERTERRORISM BUREAU INITIAL PATROL RESPONSE FOR ACTIVE SHOOTER,2/16/2018
942156,LEGAL BUREAU PERFORMANCE METRICS - PROHIBITED CONDUCT,2/16/2018
942156,AWARENESS AND RESPONSE TO BIOLOGICAL INCIDENTS,1/29/2018
942156,CLT-EQUAL EMPLOYMENT OPPORTUNITY,1/25/2018
942156,COUNTER TERRORISM INITIAL PATROL RESPONSE TO AN ACTIVE SHOOTER,1/22/2018
942156,NEW YEAR'S EVE TACTICAL AWARENESS,12/30/2017
942156,COLLABORATIVE POLICING- FOREIGN LANGUAGE CERTIFICATION VIDEO,12/28/2017
942156,COUNTERTERRORISM ACTIVE SHOOTER TRAINING,11/30/2017
942156,COUNTERTERRORISM BUREAU FACILITY AWARENESS VIDEO-EMPIRE STATE BUILDING,11/30/2017
942156,DAS OVERLAPPING LAYERS TUTORIAL,11/30/2017
942156,LOCATING APPLE DEVICES USING YOUR DEPARTMENT SMARTPHONE,11/30/2017
942156,TRAINING MATERIALS- CLOSING THE GAP ON VEHICLE INTELLIGENCE,11/30/2017
942156,TRAINING MATERIALS- PAWNSHOP AND 2ND HAND DEALER DATABASE,11/30/2017
942156,TRAINING MATERIALS- THE RECIDIVIST TRACKING AND REPORTING DATABASE (RTRD),11/30/2017
942156,TRAINING MATERIALS- VIRTUAL CRIME INFORMATION CENTER,11/30/2017
942156,CRIME CONTROL STRATEGIES- COMMUNITY SUPERVISION,11/28/2017
942156,FTS - ANNUAL CEW RECERTIFICATION,11/16/2017
942156,2017-2019 IN-SERVICE CYCLE-INVESTIGATIVE ENCOUNTERS-SUPERVISOR TRAINING WITHOUT SCENARIOS,11/15/2017
942156,"HME - HOMEMADE EXPLOSIVES: AWARENESS, RECOGNITION, AND RESPONSE",11/14/2017
942156,NARCAN NASAL SPRAY TRAINING,10/13/2017
942156,COLLABORATIVE POLICING- ACCESSING TELEPHONIC INTERPRETERS VIA LANGUAGE LINE,9/23/2017
942156,BTK (BELT TRAUMA KIT DISTRIBUTION AND FAMILIARIZATION),9/20/2017
942156,INFORMATION SECURITY AWARENESS TRAINING,9/5/2017
942156,PATROL- POLYCARBONATE SHIELD,9/5/2017
942156,TACTICAL AWARENESS-SMARTPHONE SAFETY,9/5/2017
942156,PERSONNEL BUREAU NYPD EMPLOYEE ASSISTANCE UNIT (EAU),8/2/2017
942156,POLICE COMMISSIONERS MESSAGE - VICTIMS OF SEXUAL ASSAULT VIDEO,8/2/2017
942156,CPS INTERIOR PATROL TRESPASS AFFIDAVIT PROGRAM (TAP) VIDEO 1,7/20/2017
942156,CPS INTERIOR PATROL TRESPASS AFFIDAVIT PROGRAM (TAP) VIDEO 2,7/20/2017
942156,"CPS INTERIOR PATROL OF HOUSING AUTHORITY BUILDINGS, PG 212-60 ROLL CALL VIDEO 2",6/23/2017
942156,"CPS INTERIOR PATROL OF HOUSING AUTHORITY BUILDINGS, PG 212-60 ROLL CALL VIDEO 1",6/22/2017
942156,CPS INTERIOR PATROL TRESPASS AFFIDAVIT PROGRAM (TAP) VIDEO 2,6/6/2017
942156,CPS INTERIOR PATROL TRESPASS AFFIDAVIT PROGRAM (TAP) VIDEO 1,6/3/2017
942156,CRIMINAL JUSTICE REFORM ACT ROLL CALL TRAINING PART 2,5/24/2017
942156,CRISIS INTERVENTION TEAM TRAINING,5/18/2017
942156,CRIMINAL JUSTICE REFORM ACT ROLL CALL TRAINING PART 1,5/15/2017
942156,CRIMINAL JUSTICE REFORM ACT ROLL CALL TRAINING PART 1,5/5/2017
942156,CRIMINAL JUSTICE REFORM ACT ROLL CALL TRAINING PART 2,5/5/2017
942156,ILERSBA - INITIAL LAW ENFORCMENT RESPONSE TO SUICIDE BOMBING ATTACKS,5/2/2017
942156,EQUAL EMPLOYMENT OPPORTUNITY TRANSGENDER DIVERSITY AND INCLUSION:EXECUTIVE ORDER 16,2/18/2017
942156,FUNDAMENTALS OF AUTO THEFT INVESTIGATION,2/15/2017
942156,HATE CRIMES AND BIAS-RELATED INCIDENTS,1/4/2017
942156,HATE CRIMES AND BIAS-RELATED INCIDENTS,12/8/2016
942156,2016-17 INSERVICE CYCLE-PHYSICAL TACTICS,12/5/2016
942156,ALERRT-ACTIVE SHOOTER LEVEL I (CTD),11/16/2016
942156,X26P TRANSITION COURSE FOR CURRENT X26 END-USER TRAINING,11/2/2016
942156,FORCE POLICY REVISION-PAMPHLET - PG 221 - UNIT TRAINING DECEMBER 2015,10/18/2016
942156,FORCE POLICY REVISION-VIDEO-PG 221-UNIT TRAINING MAY 2016,10/18/2016
942156,PUBLIC CONTACT AND CONSENT TO SEARCH (RIGHT TO KNOW) - UNIT TRAINING AUGUST 2016,9/12/2016
942156,FTS - ANNUAL CEW RECERTIFICATION,8/23/2016
942156,INVESTIGATIVE ENCOUNTERS-VIDEO #4 DOCUMENTATION AND SUPERVISION-UNIT TRAINING JULY 2016,7/18/2016
942156,INVESTIGATIVE ENCOUNTERS-VIDEO #3 TERRY STOPS AND REASONABLE SUSPICION-UNIT TRAINING JUNE 2016,7/8/2016
942156,EQUAL EMPLOYMENT OPPORTUNITY IN-SERVICE TRAINING,5/25/2016
942156,INVESTIGATIVE ENCOUNTERS-VIDEO #2 COMMON LAW RIGHT OF INQUIRY-UNIT TRAINING MAY 2016,5/2/2016
942156,SERGEANTS LEADERSHIP COURSE: NEWLY PROMOTED SERGEANTS,3/25/2016
942156,INVESTIGATIVE ENCOUNTERS-VIDEO #1 REQUEST FOR INFO-UNIT TRAINING FEB 2016,2/10/2016
942156,WINDOWS PHONE TRAINING AND DISTRIBUTION,12/28/2015
942156,FORCE POLICY REVISION-PAMPHLET - PG 221 - UNIT TRAINING DECEMBER 2015,12/10/2015
942156,EMERGENCY VEHICLE OPERATION JULY 03 - JUNE 07,11/9/2015
942156,FIELD TRAINING PROGRAM JULY 03 - JUNE 07,11/9/2015
942156,PHYSICAL EDUCATION PART 1: FOUNDATIONS OF PHYSICAL FITNESS,11/9/2015
942156,PHYSICAL EDUCATION PART 2: DEFENSIVE TACTICS,11/9/2015
942156,PHYSICAL EDUCATION PART 3: AMERICAN HEART ASSOCIATION BASIC LIFE SUPPORT,11/9/2015
942156,POLICE CRISIS INTERVENTION JULY 03 - JUNE 07,11/9/2015
942156,POLICE FIELD PROBLEMS JULY 03 - JUNE 07,11/9/2015
942156,POLICE INVESTIGATION AND REPORTING JULY 03 - JUNE 07,11/9/2015
942156,POLICING A DEMOCRACY JULY 03 - JUNE 07,11/9/2015
942156,POLICING SPECIAL POPULATIONS JULY 03 - JUNE 07,11/9/2015
942156,PROCEDURAL LAW JULY 03 - JUNE 07,11/9/2015
942156,SUBSTANTIVE LAW JULY 03 - JUNE 07,11/9/2015
942156,TERRORISM AWARENESS AND RESPONSE JULY 03 - JUNE 07,11/9/2015
942156,20K TRAINING INITIATIVE - FOUNDATIONS OF POLICING,2/24/2015
942156,20K TRAINING INITIATIVE - PHYSICAL TACTICS,2/12/2015
942156,20K TRAINING INITIATIVE - SMART POLICING,2/4/2015
942156,CIMS ICS 300,11/21/2014
942156,LESS LETHAL TRAINING (X26 TASER),9/19/2014
942156,COMMAND POST OPERATIONS COURSE,9/10/2014
942156,SERGEANT BASIC LEADERSHIP COMPUTER COURSE,9/5/2014
942156,FUNDAMENTALS OF AUTO THEFT INVESTIGATION,12/4/2012
942156,PROPERTY EVIDENCE TRACKING SYSTEM,1/10/2011
942156,HIGHWAY PRELIMINARY BREATH TEST INSTRUMENT TRAINING - PBT,3/3/2010
942156,VEHICLE BORNE IMPROVISED EXPLOSIVE DEVICE SECURITY CHECKPOINT OPERATIONS COURSE,10/21/2009
942156,PLAIN CLOTHES TRAINING CERTIFIED BASIC PLAIN-CLOTHES COURSE,7/7/2009
942156,COBRA - COHORT TRAINING,11/6/2006
942156,12 PASSENGER VAN / UTILITY VEHICLE QUALIFICATION,7/10/2006
942156,RECRUIT 12 PASSENGER VAN / UTILITY VEHICLE QUALIFICATION,
942156,RECRUIT RMP QUALIFICATION / RMP OPERATOR QUALIFIED,
955688,2025 EQUAL EMPLOYMENT OPPORTUNITY TRAINING - SEXUAL HARASSMENT AWARENESS AND PREVENTION,6/2/2025
955688,DRIVING WHILE INTOXICATED AWARENESS VIDEO MODULE 1,12/10/2024
955688,FTS - ANNUAL CEW RECERTIFICATION,10/30/2024
955688,NORTHWELL DIRECT FINEST CARE PROGRAM FOR UMOS,10/15/2024
955688,RAPE IS RAPE,8/30/2024
955688,CPR-AED CARDIOPULMONARY RESUSCITATION-AUTOMATED EXTERNAL DEFIBRILLATOR REFRESHER,7/25/2024
955688,EMPLOYEE ASSISTANCE UNIT (E.A.U.) IS HERE FOR YOU- 2024,7/23/2024
955688,LEVEL 1 AND LEVEL 2 INVESTIGATIVE ENCOUNTERS,6/21/2024
955688,DETECTIVE BUREAU BODY WORN CAMERAS,6/19/2024
955688,2024 EQUAL EMPLOYMENT OPPORTUNITY TRAINING - SEXUAL HARASSMENT AWARENESS AND PREVENTION,6/12/2024
955688,LGBTQIA PLUS - DIVERSITY AND INCLUSION,2/27/2024
955688,DETECTIVE BUREAU PROFESSIONAL DEVELOPMENT SEMINAR,9/27/2023
955688,2023 SUMMER ALL-OUT BODY WORN CAMERA TRAINING,8/8/2023
955688,2023 EQUAL EMPLOYMENT OPPORTUNITY TRAINING-SEXUAL HARASSMENT AWARENESS AND PREVENTION,7/12/2023
955688,2023 LANGUAGE MATTERS - FOSTERING A POSITIVE WORK ENVIRONMENT,7/12/2023
955688,NYPD-U VOLUNTARY - INVOLUNTARY TRANSPORTS,7/12/2023
955688,TRAFFIC COURT TESTIMONY VIDEO,7/12/2023
955688,CAR STOP TACTICS FOR PATROL OFFICERS - MODULE 1: CONTROLLING THE STOP,11/10/2022
955688,CAR STOP TACTICS FOR PATROL OFFICERS - MODULE 2: PROHIBITED MANEUVERS,11/10/2022
955688,CAR STOP TACTICS FOR PATROL OFFICERS - MODULE 3: THE UNKNOWN RISK STOP,11/10/2022
955688,CAR STOP TACTICS FOR PATROL OFFICERS - MODULE 4: THE HIGH-RISK STOP,11/10/2022
955688,CLT-NIBRS ROLL CALL TRAINING,8/2/2022
955688,DETECTIVE BUREAU DNA SAMPLE TRAINNG,8/2/2022
955688,2022 EQUAL EMPLOYMENT OPPORTUNITY TRAINING-SEXUAL HARASSMENT AWARENESS AND PREVENTION,7/6/2022
955688,CONVICTED OFFENDER DNA DATABANK SPECIMEN COLLECTION KIT,7/6/2022
955688,FTS - ANNUAL CEW RECERTIFICATION,5/17/2022
955688,ACTIVE BYSTANDERSHIP FOR LAW ENFORCEMENT (ABLE): ONE DAY COURSE,11/12/2021
955688,CONSTITUTIONAL POLICING AT COMMUNITY EVENTS (CPACE),10/21/2021
955688,MAYOR EXECUTIVE ORDER 78 VACCINATION - TESTING COMPLIANCE POLICY,9/14/2021
955688,EQUAL EMPLOYMENT OPPORTUNITY TRAINING - SEXUAL HARASSMENT AWARENESS AND PREVENTION 2021,8/6/2021
955688,CRIMINAL INVESTIGATORS COURSE,8/2/2021
955688,INTERVIEW ROOM-AXON TRAINING BUREAU,7/19/2021
955688,EQUAL EMPLOYMENT OPPORTUNITY TRAINING - LGBTQIA+ DIVERSITY AND INCLUSION / EXECUTIVE ORDER 16 OF 201,5/6/2021
