taxid,date,name
963603,CLT-PROCEDURAL OPERATIONS,5/22/2019
963603,COLLABORATIVE POLICING - THE DEAF AND HARD OF HEARING COMMUNITY,5/22/2019
963603,CLT-ENFORCEMENT ACTIONS,5/21/2019
963603,CLT-DOCUMENTATION AND FORMS,5/14/2019
963603,CLT-ENFORCEMENT ACTIONS,5/6/2019
963603,CLT-ENFORCEMENT ACTIONS,5/1/2019
963603,COLLABORATIVE POLICING - ELDER ABUSE,4/30/2019
963603,CLT-OCCUPATIONAL-WORKPLACE SAFETY AND HEALTH,4/29/2019
963603,RESPONDING TO PEOPLE IN CRISIS - MODULES 2 AND 3: ACTIVE LISTENING PARTS 1 AND 2,4/29/2019
963603,"CLT-UNIFORMS, PERSONAL APPEARANCE AND EQUIPMENT",4/23/2019
963603,SAFEGUARDING PRISONERS - OFFICER SAFETY GUIDELINES,4/23/2019
963603,2017-2019 IN-SERVICE CYCLE-INTEGRATED TACTICS,4/22/2019
963603,CLT-DOCUMENTATION AND FORMS,4/16/2019
963603,LEGAL BUREAU - PERJURY TRAINING MODULE,4/7/2019
963603,TEXT TO 911 - INTRODUCTION,3/14/2019
963603,RESPONDING TO PEOPLE IN CRISIS - MODULE 1: SENDING THE RIGHT SIGNALS,3/8/2019
963603,CLT-PROCEDURAL OPERATIONS,3/1/2019
963603,PATROL DOOR BAG - ROPE AND WEDGE INTRODUCTION,1/21/2019
963603,EQUAL EMPLOYMENT OPPORTUNITYTRAINING - SEXUAL HARASSMENT AWARENESS AND PREVENTION,1/13/2019
963603,CLT-EQUAL EMPLOYMENT OPPORTUNITY,12/28/2018
963603,FTS - ANNUAL CEW RECERTIFICATION,12/13/2018
963603,AMERICANS WITH DISABILITIES ACT (ADA),12/7/2018
963603,CLT-PROCEDURAL OPERATIONS,12/7/2018
963603,MARIJUANA BURNING ENFORCEMENT POLICY,12/7/2018
963603,CLT-PROCEDURAL OPERATIONS,12/3/2018
963603,CLT-OCCUPATIONAL-WORKPLACE SAFETY AND HEALTH,11/16/2018
963603,"CLT-UNIFORMS, PERSONAL APPEARANCE AND EQUIPMENT",11/16/2018
963603,CLT-COMMUNITY ENGAGEMENT,11/5/2018
963603,CLT-PROCEDURAL OPERATIONS,11/5/2018
963603,CLT-LEGAL ISSUES,10/29/2018
963603,"CLT-UNIFORMS, PERSONAL APPEARANCE AND EQUIPMENT",10/29/2018
963603,RESPONDING TO PEOPLE IN CRISIS-INTRODUCTION TO CIT VIDEO SERIES,10/29/2018
963603,CLT-HUMAN RESOURCES AND PERSONNEL MATTERS,10/23/2018
963603,CLT-TACTICAL AWARENESS AND OFFICER SAFETY,10/23/2018
963603,CLT-ENFORCEMENT ACTIONS,10/22/2018
963603,CLT-LEGAL ISSUES,10/22/2018
963603,CLT-ENFORCEMENT ACTIONS,10/8/2018
963603,CLT-COMMUNITY ENGAGEMENT,10/3/2018
963603,CLT-PROCEDURAL OPERATIONS,10/3/2018
963603,NYC RIGHT TO KNOW ACT LEGISLATION - PART 2,10/3/2018
963603,NYC RIGHT TO KNOW ACT LEGISLATION – PART 1,10/3/2018
963603,CLT-ENFORCEMENT ACTIONS,9/18/2018
963603,RAISE THE AGE,9/18/2018
963603,CLT-ENFORCEMENT ACTIONS,8/31/2018
963603,CLT-LEGAL ISSUES,8/31/2018
963603,CPS BODY-WORN CAMERA TRAINING WITH SCENARIOS,6/13/2018
963603,CLT-PROFESSIONAL DEVELOPMENT,6/11/2018
963603,CLT-PROPERTY,6/5/2018
963603,"CLT-UNIFORMS, PERSONAL APPEARANCE AND EQUIPMENT",6/4/2018
963603,CLT-PROCEDURAL OPERATIONS,5/21/2018
963603,COMMUNICATIONS- THE PROPER USAGE OF THE IDA RADIO CODES,5/17/2018
963603,CLT-PROCEDURAL OPERATIONS,5/9/2018
963603,CLT-PROFESSIONAL DEVELOPMENT,4/20/2018
963603,CLT-PROCEDURAL OPERATIONS,4/18/2018
963603,CLT-TACTICAL AWARENESS AND OFFICER SAFETY,4/13/2018
963603,CLT-INFORMATION TECHNOLOGY,4/6/2018
963603,CLT-DOCUMENTATION AND FORMS,4/5/2018
963603,CLT-OCCUPATIONAL-WORKPLACE SAFETY AND HEALTH,4/4/2018
963603,CLT-OCCUPATIONAL-WORKPLACE SAFETY AND HEALTH,4/2/2018
963603,CRISIS INTERVENTION TEAM TRAINING,3/29/2018
963603,CLT-TACTICAL AWARENESS AND OFFICER SAFETY,3/22/2018
963603,CLT-DOCUMENTATION AND FORMS,3/21/2018
963603,CLT-MEMBER-EMPLOYEE WELLNESS,3/13/2018
963603,CLT-LEGAL ISSUES,3/12/2018
963603,CLT-PROCEDURAL OPERATIONS,3/6/2018
963603,CLT-PROPERTY,2/26/2018
963603,CLT-EQUAL EMPLOYMENT OPPORTUNITY,2/19/2018
963603,LEGAL BUREAU PERFORMANCE METRICS - PROHIBITED CONDUCT,2/19/2018
963603,CRIMINAL JUSTICE REFORM ACT ROLL CALL TRAINING PART 1,2/17/2018
963603,CRIMINAL JUSTICE REFORM ACT ROLL CALL TRAINING PART 2,2/17/2018
963603,INVESTIGATIVE ENCOUNTERS-VIDEO #2 COMMON LAW RIGHT OF INQUIRY-UNIT TRAINING MAY 2016,2/17/2018
963603,INVESTIGATIVE ENCOUNTERS-VIDEO #3 TERRY STOPS AND REASONABLE SUSPICION-UNIT TRAINING JUNE 2016,2/17/2018
963603,INVESTIGATIVE ENCOUNTERS-VIDEO #4 DOCUMENTATION AND SUPERVISION-UNIT TRAINING JULY 2016,2/17/2018
963603,PUBLIC CONTACT AND CONSENT TO SEARCH (RIGHT TO KNOW) - UNIT TRAINING AUGUST 2016,2/17/2018
963603,TACTICAL AWARENESS-SMARTPHONE SAFETY,2/17/2018
963603,COLLABORATIVE POLICING- ACCESSING TELEPHONIC INTERPRETERS VIA LANGUAGE LINE,11/7/2017
963603,BTK (BELT TRAUMA KIT DISTRIBUTION AND FAMILIARIZATION),11/1/2017
963603,"CPS INTERIOR PATROL OF HOUSING AUTHORITY BUILDINGS, PG 212-60 ROLL CALL VIDEO 1",10/26/2017
963603,"CPS INTERIOR PATROL OF HOUSING AUTHORITY BUILDINGS, PG 212-60 ROLL CALL VIDEO 2",10/26/2017
963603,CPS INTERIOR PATROL TRESPASS AFFIDAVIT PROGRAM (TAP) VIDEO 1,10/26/2017
963603,CPS INTERIOR PATROL TRESPASS AFFIDAVIT PROGRAM (TAP) VIDEO 2,10/26/2017
963603,NARCAN NASAL SPRAY TRAINING,10/26/2017
963603,PATROL- POLYCARBONATE SHIELD,10/26/2017
963603,PERSONNEL BUREAU NYPD EMPLOYEE ASSISTANCE UNIT (EAU),10/26/2017
963603,POLICE COMMISSIONERS MESSAGE - VICTIMS OF SEXUAL ASSAULT VIDEO,10/26/2017
963603,PTTD C.P.R. / A.E.D. WRITTEN EXAM,10/23/2017
963603,X26P TRANSITION COURSE FOR CURRENT X26 END-USER TRAINING,10/5/2017
963603,PTTD C.P.R. / A.E.D. WRITTEN EXAM,9/29/2017
963603,POLICE ACADEMY RECRUIT 3RD TRIMESTER EXAM,9/25/2017
963603,12 PASSENGER VAN / UTILITY VEHICLE QUALIFICATION,9/20/2017
963603,RECRUIT RMP QUALIFICATION / RMP OPERATOR QUALIFIED,9/19/2017
963603,PTTD WATER SAFETY,9/13/2017
963603,RECRUIT QUIZ P.S. INTERIOR PATROL,9/13/2017
963603,RECRUIT QUIZ L.W. CIVIL DISORDER OFFENSES,9/12/2017
963603,RECRUIT QUIZ P.S. MAINTAINING PUBLIC ORDER,9/12/2017
963603,PTTD DEFENSIVE TACTICS PRACTICAL EXAM,9/11/2017
963603,RECRUIT QUIZ P.S. POLICE FIELD COMMUNICATIONS,9/7/2017
963603,RECRUIT RAPID DEPLOYMENT-ACTIVE SHOOTER,9/1/2017
963603,POLICE ACADEMY RECRUIT NCIC WRITTEN EXAM,8/23/2017
963603,RECRUIT QUIZ L.W. COURT APPEARANCES,8/11/2017
963603,RECRUIT QUIZ L.W. AUTO-RELATED CRIMES,8/9/2017
963603,RECRUIT QUIZ L.W. INTEGRITY CRIMES AND CIVIL LIABILITIES,8/9/2017
963603,RECRUIT QUIZ P.S. SUMMONSES,8/4/2017
963603,RECRUIT QUIZ P.S.- AUTO-RELATED PROCEDURES,8/4/2017
963603,GROUND TACTICS,8/2/2017
963603,RECRUIT QUIZ L.W. DRUG OFFENSES,8/2/2017
963603,RECRUIT QUIZ L.W. WEAPONS OFFENSES,8/2/2017
963603,FIRST AID WRITEN EXAM,7/28/2017
963603,PTTD DEFENSIVE TACTICS PRACTICAL EXAM,7/26/2017
963603,RECRUIT QUIZ S.S. DOMESTIC VIOLENCE,7/25/2017
963603,POLICE ACADEMY RECRUIT 2ND TRIMESTER EXAM,7/17/2017
963603,POLICE ACADEMY RECRUIT JUSTIFICATION WRITTEN EXAM,7/14/2017
963603,RECRUIT QUIZ- CHILDREN AND ADOLESCENTS,7/13/2017
963603,RECRUIT QUIZ- COLLECTING AND PROCESSING EVIDENCE,7/13/2017
963603,RECRUIT QUIZ- CRISIS MANAGEMENT,7/13/2017
963603,RECRUIT QUIZ- CUSTODIAL OFFENSES,7/12/2017
963603,FIREARMS 5 DAY TACTICAL APPLICATION V2,7/11/2017
963603,VEHICLE STOP SOLUTIONS MODULE,7/10/2017
963603,PTTD WEAPONS DEFENSE,7/7/2017
963603,POLICE SCIENCE- INVESTIGATION AND REPORT WRITING QUIZ,7/4/2017
963603,RECRUIT QUIZ L.W. PROPERTY CRIMES,6/27/2017
963603,RECRUIT QUIZ- SEX OFFENSES,6/22/2017
963603,RECRUIT QUIZ- CRIMES AGAINST PERSONS,6/21/2017
963603,RECRUIT QUIZ- INTRODUCTION TO THE PENAL LAW,6/20/2017
963603,PTTD EXPANDABLE BATON,6/16/2017
963603,FTS - CEW END USER CERT,6/12/2017
963603,OFF DUTY PISTOL CERTIFIED,6/8/2017
963603,RECRUIT TACTICAL FIREARMS QUALIFICATION AND TRAINING OFF DUTY PISTOL CERTIFIED,6/8/2017
963603,RECRUIT TRAINING COMPUTER COURSE,6/7/2017
963603,BATON,6/6/2017
963603,POLICE ACADEMY RECRUIT 1ST TRIMESTER EXAM,6/5/2017
963603,SOCIAL SCIENCE- COMMUNITY INTERACTION QUIZ,5/31/2017
963603,SOCIAL SCIENCE- POLICING A MULTICULTURAL SOCIETY QUIZ,5/31/2017
963603,"PTTD CARDIO ENDURANCE TEST, 1ST ATTEMPT",5/30/2017
963603,POLICE ACADEMY RECRUIT 1ST TRIMESTER PRACTICE WRITTEN EXAM,5/29/2017
963603,FRISKING AND HANDCUFFING,5/26/2017
963603,LAW- USE OF FORCE QUIZ,5/26/2017
963603,SOCIAL SCIENCE- DISCRETION QUIZ,5/26/2017
963603,SOCIAL SCIENCE- POLICING THE EMOTIONALLY DISTRESSED QUIZ,5/26/2017
963603,PTTD CPR PRACTICAL EXAM,5/25/2017
963603,LAW- AUTHORITY TO ARREST QUIZ,5/24/2017
963603,JOB STANDARDS TEST ATTEMPT #1,5/22/2017
963603,LAW- INTRO TO LAW AND JUSTICE QUIZ,5/22/2017
963603,RECRUIT BASIC FIREARMS QUALIFICATION AND TRAINING,5/19/2017
963603,POLICE ACADEMY RECRUIT STOP QUESTION & FRISK WRITTEN EXAM,5/12/2017
963603,LAW- POLICING LEGALLY QUIZ,5/11/2017
963603,POLICE SCIENCE- POLICING WITH INTEGRITY QUIZ,5/9/2017
963603,POLICE SCIENCE- GENERAL REGULATIONS QUIZ,5/8/2017
963603,SOCIAL SCIENCE- POLICING IMPARTIALLY QUIZ,5/8/2017
963603,SOCIAL SCIENCE- POLICING PROFESSIONALLY QUIZ,5/8/2017
963603,POLICE ACADEMY RECRUIT PREREADING EXAM,4/20/2017
963603,EMERGENCY VEHICLE OPERATION JULY 07 - PRESENT,11/9/2015
963603,FIELD TRAINING PROGRAM JULY 07 - PRESENT,11/9/2015
963603,PHYSICAL EDUCATION PART 1: FOUNDATIONS OF PHYSICAL FITNESS,11/9/2015
963603,PHYSICAL EDUCATION PART 2: DEFENSIVE TACTICS JULY 07 - PRESENT,11/9/2015
963603,PHYSICAL EDUCATION PART 3: AMERICAN HEART ASSOCIATION BASIC LIFE SUPPORT,11/9/2015
963603,POLICE CRISIS INTERVENTION JULY 07 - PRESENT,11/9/2015
963603,POLICE FIELD PROBLEMS JULY 07 - PRESENT,11/9/2015
963603,POLICE INVESTIGATION AND REPORTING JULY 07 - PRESENT,11/9/2015
963603,POLICING A DEMOCRACY JULY 07 - PRESENT,11/9/2015
963603,POLICING SPECIAL POPULATIONS JULY 07 - PRESENT,11/9/2015
963603,PROCEDURAL LAW JULY 07 - PRESENT,11/9/2015
963603,SUBSTANTIVE LAW JULY 07 - PRESENT,11/9/2015
963603,TERRORISM AWARENESS AND RESPONSE JULY 07 - PRESENT,11/9/2015
940367,EAU 2025 POLICE COMMISSIONER JESSICA S. TISCH,6/24/2025
940367,2025 EQUAL EMPLOYMENT OPPORTUNITY TRAINING - SEXUAL HARASSMENT AWARENESS AND PREVENTION,6/13/2025
940367,FTS - TASER 7 HOLSTER DISTRIBUTION,6/13/2025
940367,FTS - TASER 7 ANNUAL RECERTIFICATION,5/5/2025
940367,FTS - CEW TASER 7 TRANSITION COURSE,4/18/2025
940367,RIGHT TO KNOW ACT SQF MODULE 9,3/24/2025
940367,CRISIS INTERVENTION TEAM TRAINING,12/12/2024
940367,APX NEXT PORTABLE AND RADIO DISCIPLINE TRAINING VIDEO,12/11/2024
940367,ASSISTING SURVIVORS OF SEXUAL BASED VIOLENCE WITH ACCESS TO RESOURCES,12/11/2024
940367,BEHAVIORAL HEALTH EMERGENCY ASSISTANCE RESPONSE DIVISION B-HEARD,12/11/2024
940367,EMPLOYEE ASSISTANCE UNIT (E.A.U.) IS HERE FOR YOU- 2024,12/11/2024
940367,FAMILY BUILDING,12/11/2024
940367,LEAVING THE SCENE COLLISIONS INVESTIGATIVE BEST PRACTICES,12/11/2024
940367,MENTAL HEALTH INVOLUNTARY REMOVALS MHL 9.41 AND MHL 9.58,12/11/2024
940367,NOTIFICATION OF ALLEGATIONS AND EMPLOYEE RIGHTS,12/11/2024
940367,TACTICS WHEN ENGAGING INDIVIDUALS IN A MENTAL HEALTH CRISIS,12/11/2024
940367,UNMANNED AIRCRAFT SYSTEMS VISUAL OBSERVER,12/11/2024
940367,DRIVING WHILE INTOXICATED AWARENESS VIDEO MODULE 1,11/26/2024
940367,NORTHWELL DIRECT FINEST CARE PROGRAM FOR UMOS,10/22/2024
940367,RAPE IS RAPE,8/29/2024
940367,FTS - ANNUAL CEW RECERTIFICATION,7/15/2024
940367,2024 EQUAL EMPLOYMENT OPPORTUNITY TRAINING - SEXUAL HARASSMENT AWARENESS AND PREVENTION,7/8/2024
940367,LEVEL 1 AND LEVEL 2 INVESTIGATIVE ENCOUNTERS,6/28/2024
940367,DETECTIVE BUREAU INVESTIGATOR - SUPERVISOR FIVE DAY SEARCH WARRANT TACTICAL COURSE,5/21/2024
940367,DETECTIVE BUREAU INVESTIGATOR - SUPERVISOR FIVE DAY SEARCH WARRANT TACTICAL COURSE,5/17/2024
940367,LGBTQIA PLUS - DIVERSITY AND INCLUSION,2/27/2024
940367,NYPD RECRUITMENT TRAINING VIDEO,2/27/2024
940367,2023 SUMMER ALL-OUT BODY WORN CAMERA TRAINING,8/17/2023
940367,DETECTIVE BUREAU BODY WORN CAMERAS,8/2/2023
940367,2023 EQUAL EMPLOYMENT OPPORTUNITY TRAINING-SEXUAL HARASSMENT AWARENESS AND PREVENTION,7/11/2023
940367,NYPD-U VOLUNTARY - INVOLUNTARY TRANSPORTS,7/11/2023
940367,FTS - ANNUAL CEW RECERTIFICATION,11/7/2022
940367,BODY-WORN CAMERA REVIEW PART ONE,8/29/2022
940367,NYPD JOUVERT  WEST INDIAN DAY,8/29/2022
940367,PROHIBITED METHODS OF RESTRAINT,8/29/2022
940367,ARRESTS - RELIGIOUS HEAD COVERING GUIDELINES (PG 208-83),12/7/2021
940367,BODY-WORN CAMERA REVIEW PART TWO,11/30/2021
940367,IDENTIFYING THE IMPAIRED DRIVER,11/30/2021
940367,EQUAL EMPLOYMENT OPPORTUNITY ANNUAL LIAISON TRAINING CONFERENCE,10/19/2021
940367,BALLISTIC VEST DISTRIBUTION PROGRAM,10/14/2021
940367,CONSTITUTIONAL POLICING AT COMMUNITY EVENTS (CPACE),10/7/2021
940367,INFORMATION SECURITY AWARENESS TRAINING 2021,9/18/2021
940367,MAYOR EXECUTIVE ORDER 78 VACCINATION - TESTING COMPLIANCE POLICY,9/16/2021
940367,OPIOID OVERDOSE RECOGNITION AND NARCAN ADMINISTRATION -2021,9/16/2021
940367,EMPLOYEE ASSISTANCE UNIT-2021,7/23/2021
940367,EQUAL EMPLOYMENT OPPORTUNITY TRAINING - SEXUAL HARASSMENT AWARENESS AND PREVENTION 2021,7/23/2021
940367,OVERVIEW OF THE NEW DISCOVERY LAWS 2021 REFRESHER,7/20/2021
940367,FTS - ANNUAL CEW RECERTIFICATION,6/29/2021
940367,ACTIVE BYSTANDERSHIP FOR LAW ENFORCEMENT (ABLE): ONE DAY COURSE,6/14/2021
940367,BALLISTIC VEST MEASUREMENT PROGRAM,4/23/2021
940367,DESK APPEARANCE TICKETS: THE NEW LAW AND THE NEW GUIDELINES FOR PROCESSING DAT'S - 2021 REFRESHER,4/13/2021
940367,EXECUTIVE HEALTH AND WELLNESS CONFERENCE - MODULE 1,4/13/2021
940367,HEALTH AND WELLNESS SECTION - MODULE 1 - PSYCHOLOGICAL HEALTH AND WELLNESS,4/13/2021
940367,HEALTH AND WELLNESS SECTION - MODULE 10 - SEEKING AND RECEIVING MENTAL HEALTH SUPPORT,4/13/2021
940367,HEALTH AND WELLNESS SECTION - MODULE 11 - HEALTH AND RESILIENCY,4/13/2021
940367,HEALTH AND WELLNESS SECTION - MODULE 12 - IN THAT DARK PLACE - AN OFFICER'S JOURNEY,4/13/2021
940367,HEALTH AND WELLNESS SECTION - MODULE 2 - JOB COUNSELING AND STRESS,4/13/2021
940367,HEALTH AND WELLNESS SECTION - MODULE 3 - WARNING SIGNS,4/13/2021
940367,HEALTH AND WELLNESS SECTION - MODULE 4 - CUMULATIVE TRAUMA,4/13/2021
940367,HEALTH AND WELLNESS SECTION - MODULE 5 - GAINING PERSPECTIVE,4/13/2021
940367,HEALTH AND WELLNESS SECTION - MODULE 6 - COPING WITH SIGNS OF ANXIETY DEPRESSION,4/13/2021
940367,HEALTH AND WELLNESS SECTION - MODULE 7 - LEADING WITH COMPASSION,4/13/2021
940367,"HEALTH AND WELLNESS SECTION - MODULE 8 - WARNING SIGNS, SUPPORT AND OUTREACH",4/13/2021
940367,EQUAL EMPLOYMENT OPPORTUNITY TRAINING - LGBTQIA+ DIVERSITY AND INCLUSION / EXECUTIVE ORDER 16 OF 201,4/5/2021
940367,EXECUTIVE HEALTH AND WELLNESS TRAINING - MODULE 7,4/5/2021
940367,HEALTH AND WELLNESS SECTION - MODULE 20 - POPPA TESTIMONIAL VIDEO,4/5/2021
940367,HEALTH AND WELLNESS SECTION - MODULE 9 - MANAGING STRESS ON THE JOB,4/5/2021
940367,NEW LAWS AFFECTING POLICE OFFICERS’ CRIMINAL AND CIVIL LIABILITY,4/5/2021
940367,VICTIM BLAMING AND RELEASE OF INFORMATION TO THE MEDIA,4/5/2021
940367,EQUAL EMPLOYMENT OPPORTUNITY ANNUAL LIAISON TRAINING CONFERENCE,2/23/2021
940367,COVID-19: PREPAREDENESS,2/12/2021
940367,COVID-19: PREPAREDNESS YOUR FAMILY AND HOME,2/12/2021
940367,COVID-19: PROTECTIVE MASKS,2/12/2021
940367,CRIMINAL JUSTICE BUREAU - GIGLIO MATERIAL DISCLOSURES UNDER THE NEW DISCOVERY LAWS,2/12/2021
940367,CROSSFIRE MITIGATION DURING CLOSE COMBAT INCIDENTS - PART 2,2/12/2021
940367,UTILIZING BALLISTIC PROTECTION IN DEPARTMENT VEHICLES (4:09),2/12/2021
940367,EQUAL EMPLOYMENT OPPORTUNITY TRAINING - LEAVE TO EXPRESS BREAST MILK,12/7/2020
940367,"EQUAL EMPLOYMENT OPPORTUNITY TRAINING - SEXUAL HARASSMENT, AWARENESS AND PREVENTION",9/17/2020
940367,2020-2021 DETECTIVE BUREAU - TEAM TACTICS REFRESHER,9/16/2020
940367,2017-2019 IN-SERVICE CYCLE-INVESTIGATIVE ENCOUNTERS- BASIC TRAINING WITH SCENARIOS,9/9/2020
940367,FTS - TACTICAL TRAINING CENTER 122 PCT - SESSION 1,3/3/2020
940367,CJB - OVERVIEW OF THE NEW DISCOVERY LAWS,1/15/2020
940367,CRIMINAL JUSTICE BUREAU - DNA TRAINING VIDEO,1/15/2020
940367,ACTIVITY LOG FOR IPHONE,12/31/2019
940367,COUNTERTERRORISM BUREAU ACTIVE SHOOTER SCHOOL INCIDENTS AWARENESS,12/31/2019
940367,COUNTERTERRORISM BUREAU NH15 TRAINING,12/31/2019
940367,CROSSFIRE MITIGATION DURING CLOSE COMBAT INCIDENTS,12/31/2019
940367,INCREASE OFFICER SAFETY DURING VEHICLE STOPS,12/31/2019
940367,PRISONER ESCAPE WARNING SIGNS,12/31/2019
940367,SAFEGUARDING HOSPITALIZED PRISONERS,12/31/2019
940367,SUCCESSFULLY DISARMING AN EMOTIONALLY DISTURBED PERSON,12/31/2019
940367,CJB - DESK APPEARANCE TICKETS: THE NEW LAWS AND GUIDELINES FOR PROCESSING DATS,12/2/2019
940367,COLLABORATIVE POLICING - MEDIATION REFERRAL PROGRAM FOR NON-CRIMINAL COMPLAINTS,12/2/2019
940367,FORCE POLICY UPDATE VIDEO,12/2/2019
940367,RESPONDING TO COMMERCIAL ROBBERIES PART LL - MODULE 1 AND MODULE 2,12/2/2019
940367,DISCHARGING YOUR FIREARM AT A MOVING THREAT,11/15/2019
940367,DETECTIVE BUREAU PROFESSIONAL DEVELOPMENT SEMINAR,10/21/2019
940367,SHIELD OF RESILIENCE TRAINING COURSE,9/4/2019
940367,COLLABORATIVE POLICING - ELDER ABUSE,8/23/2019
940367,COLLABORATIVE POLICING - THE DEAF AND HARD OF HEARING COMMUNITY,8/23/2019
940367,CRITICAL INCIDENT TACTICS - RESPONDING TO COMMERCIAL ROBBERIES (EXTENDED VERSION),8/23/2019
940367,"EXECUTIVE CONFERENCE VIDEO 10-17-18: DISCUSSION WITH INDRA NOOYI, CHAIRMAN OF PEPSI CO",8/15/2019
940367,EXECUTIVE CONFERENCE VIDEO 10-17-18: MAKING IT REAL-GETTING FROM HERE TO THERE TOGETHER - DR SCOTT L,8/15/2019
940367,FTS - ANNUAL CEW RECERTIFICATION,8/14/2019
940367,RESPONDING TO COMMERCIAL ROBBERIES,8/14/2019
940367,RESPONDING TO PEOPLE IN CRISIS - MODULE 1: SENDING THE RIGHT SIGNALS,8/14/2019
940367,RESPONDING TO PEOPLE IN CRISIS – MODULE 4: USING DEPARTMENT MOBILE DIGITAL DEVICES,8/14/2019
940367,SAFEGUARDING PRISONERS - OFFICER SAFETY GUIDELINES,8/14/2019
940367,WORLDPRIDE NYC 2019,7/11/2019
940367,CPS FAIR AND IMPARTIAL POLICING - ALL POS AND DETS,6/24/2019
940367,EQUAL EMPLOYMENT OPPORTUNITY ANNUAL LIAISON TRAINING CONFERENCE,6/21/2019
940367,LEGAL BUREAU - PERJURY TRAINING MODULE,4/17/2019
940367,2019 DETECTIVE BUREAU INTAC,4/10/2019
940367,EQUAL EMPLOYMENT OPPORTUNITYTRAINING - SEXUAL HARASSMENT AWARENESS AND PREVENTION,12/20/2018
940367,MARIJUANA BURNING ENFORCEMENT POLICY,12/20/2018
940367,AMERICANS WITH DISABILITIES ACT (ADA),11/1/2018
940367,RESPONDING TO PEOPLE IN CRISIS-INTRODUCTION TO CIT VIDEO SERIES,11/1/2018
940367,NYC RIGHT TO KNOW ACT LEGISLATION - PART 2,10/9/2018
940367,NYC RIGHT TO KNOW ACT LEGISLATION – PART 1,10/9/2018
940367,RAISE THE AGE,9/19/2018
940367,FTS - ANNUAL CEW RECERTIFICATION,8/10/2018
940367,AIM COMPONENTS,8/8/2018
940367,DETECTIVE BUREAU RETRIEVING BODY WORN CAMERA DATA,8/8/2018
940367,IPHONE AND DAS MOBILE OPERATION,8/8/2018
940367,MOBILE IDENTIFICATION DEVICE (MORPHO),8/8/2018
940367,COLLABORATIVE POLICING- HUMAN TRAFFICKING,5/16/2018
940367,COMMUNICATIONS- THE PROPER USAGE OF THE IDA RADIO CODES,5/16/2018
940367,DAS PATTERN MODE,5/16/2018
940367,CPS INTERIOR PATROL TRESPASS AFFIDAVIT PROGRAM (TAP) VIDEO 1,3/28/2018
940367,CRIMINAL JUSTICE REFORM ACT ROLL CALL TRAINING PART 2,3/28/2018
940367,EQUAL EMPLOYMENT OPPORTUNITY TRANSGENDER DIVERSITY AND INCLUSION:EXECUTIVE ORDER 16,3/28/2018
940367,LEGAL BUREAU PERFORMANCE METRICS - PROHIBITED CONDUCT,3/28/2018
940367,POLICE COMMISSIONER MESSAGE- NYC GIVES,3/28/2018
940367,"COUNTERTERRORISM BUREAU FACILITY AWARENESS- THE INTREPID SEA, AIR AND SPACE MUSEUM",3/20/2018
940367,"CPS INTERIOR PATROL OF HOUSING AUTHORITY BUILDINGS, PG 212-60 ROLL CALL VIDEO 1",3/20/2018
940367,"CPS INTERIOR PATROL OF HOUSING AUTHORITY BUILDINGS, PG 212-60 ROLL CALL VIDEO 2",3/20/2018
940367,CPS INTERIOR PATROL TRESPASS AFFIDAVIT PROGRAM (TAP) VIDEO 2,3/20/2018
940367,CRIMINAL JUSTICE REFORM ACT ROLL CALL TRAINING PART 1,3/20/2018
940367,NEW YEAR'S EVE TACTICAL AWARENESS,3/20/2018
940367,COBALT,12/17/2017
940367,CRIME CONTROL STRATEGIES- COMMUNITY SUPERVISION,12/17/2017
940367,NEW NYPD PORTAL,12/17/2017
940367,COLLABORATIVE POLICING- ACCESSING TELEPHONIC INTERPRETERS VIA LANGUAGE LINE,12/16/2017
940367,COLLABORATIVE POLICING- FOREIGN LANGUAGE CERTIFICATION VIDEO,12/16/2017
940367,IPHONE TRAINING AND DISTRIBUTION,11/28/2017
940367,DAS OVERLAPPING LAYERS TUTORIAL,11/27/2017
940367,LOCATING APPLE DEVICES USING YOUR DEPARTMENT SMARTPHONE,11/27/2017
940367,NARCAN NASAL SPRAY TRAINING,11/27/2017
940367,PATROL- POLYCARBONATE SHIELD,11/27/2017
940367,STOP REPORT,11/27/2017
940367,TACTICAL AWARENESS OF EXCITED DELIRIUM SYNDROME,11/27/2017
940367,WARRANT CHECK IN DOMAIN AWARENESS SYSTEM (DAS LITE),11/27/2017
940367,COUNTERTERRORISM BUREAU FACILITY AWARENESS VIDEO- TIME WARNER BUILDING,9/19/2017
940367,COUNTERTERRORISM BUREAU FACILITY AWARENESS VIDEO-EMPIRE STATE BUILDING,9/19/2017
940367,COUNTERTERRORISM BUREAU INITIAL PATROL RESPONSE FOR ACTIVE SHOOTER,9/19/2017
940367,FORMS SUMMONS,9/19/2017
940367,NEW PERFORMANCE EVALUATION PROCESS,9/19/2017
940367,PERSONNEL BUREAU NYPD EMPLOYEE ASSISTANCE UNIT (EAU),9/19/2017
940367,POLICE COMMISSIONERS MESSAGE - VICTIMS OF SEXUAL ASSAULT VIDEO,9/19/2017
940367,TACTICAL AWARENESS- BALLISTIC VEST,9/19/2017
940367,TACTICAL AWARENESS-SMARTPHONE SAFETY,9/19/2017
940367,BTK (BELT TRAUMA KIT DISTRIBUTION AND FAMILIARIZATION),7/27/2017
940367,DETECTIVE BUREAU BALLISTIC SHIELD OPERATIONS,3/23/2017
940367,DETECTIVE BUREAU METHODICAL STRUCTURE CLEARING,3/22/2017
940367,FUNDAMENTALS OF AUTO THEFT INVESTIGATION,2/15/2017
940367,FTS - CEW END USER CERT,1/5/2017
940367,DETECTIVE BUREAU PROFESSIONAL DEVELOPMENT SEMINAR,11/21/2016
940367,FLYING WHILE ARMED,11/21/2016
940367,BELT TRAUMA KIT VIDEO,10/18/2016
940367,DOMAIN AWARENESS SYSTEM - SEARCH ACCURINT RESULTS,9/12/2016
940367,FAQ: HOW TO SYNC YOUR DEPARTMENT SMARTPHONE,9/12/2016
940367,FORMS - AIDED AND MV104 (POLICE ACCIDENT REPORT),9/12/2016
940367,"FORMS - THREAT,RESISTANCE,INJURY (TRI)",9/12/2016
940367,NYPD MOBILITY INITIATIVE - DEPARTMENT SMARTPHONE TRAINING,9/12/2016
940367,SEND TO DESKTOP,9/12/2016
940367,COUNTERTERRORISM ACTIVE SHOOTER TRAINING,9/8/2016
940367,DAS MESSAGING,9/8/2016
940367,TRAINING MATERIALS- CLOSING THE GAP ON VEHICLE INTELLIGENCE,9/8/2016
940367,TRAINING MATERIALS- PAWNSHOP AND 2ND HAND DEALER DATABASE,9/8/2016
940367,TRAINING MATERIALS- THE RECIDIVIST TRACKING AND REPORTING DATABASE (RTRD),9/8/2016
940367,TRAINING MATERIALS- VIRTUAL CRIME INFORMATION CENTER,9/8/2016
940367,COUNTERTERRORISM U.A.S. (UNMANNED AIRCRAFT SYSTEMS) DRONE AWARENESS,9/7/2016
940367,FORCE POLICY REVISION-VIDEO-PG 221-UNIT TRAINING MAY 2016,9/7/2016
940367,HOW TO ENTER DOMESTIC INCIDENT REPORTS IN TO FORMS,9/7/2016
940367,INVESTIGATIVE ENCOUNTERS-VIDEO #1 REQUEST FOR INFO-UNIT TRAINING FEB 2016,9/7/2016
940367,INVESTIGATIVE ENCOUNTERS-VIDEO #2 COMMON LAW RIGHT OF INQUIRY-UNIT TRAINING MAY 2016,9/7/2016
940367,INVESTIGATIVE ENCOUNTERS-VIDEO #3 TERRY STOPS AND REASONABLE SUSPICION-UNIT TRAINING JUNE 2016,9/7/2016
940367,INVESTIGATIVE ENCOUNTERS-VIDEO #4 DOCUMENTATION AND SUPERVISION-UNIT TRAINING JULY 2016,9/7/2016
940367,PUBLIC CONTACT AND CONSENT TO SEARCH (RIGHT TO KNOW) - UNIT TRAINING AUGUST 2016,9/7/2016
940367,ALERRT-ACTIVE SHOOTER LEVEL I (CTD),8/18/2016
940367,20K TRAINING INITIATIVE - PHYSICAL TACTICS,4/28/2016
940367,DETECTIVE BUREAU PROFESSIONAL DEVELOPMENT SEMINAR,3/28/2016
940367,FORCE POLICY REVISION-PAMPHLET - PG 221 - UNIT TRAINING DECEMBER 2015,3/28/2016
940367,WINDOWS PHONE TRAINING AND DISTRIBUTION,3/22/2016
940367,EMERGENCY VEHICLE OPERATION JULY 03 - JUNE 07,11/9/2015
940367,FIELD TRAINING PROGRAM JULY 03 - JUNE 07,11/9/2015
940367,PHYSICAL EDUCATION PART 1: FOUNDATIONS OF PHYSICAL FITNESS,11/9/2015
940367,PHYSICAL EDUCATION PART 2: DEFENSIVE TACTICS,11/9/2015
940367,PHYSICAL EDUCATION PART 3: AMERICAN HEART ASSOCIATION BASIC LIFE SUPPORT,11/9/2015
940367,POLICE CRISIS INTERVENTION JULY 03 - JUNE 07,11/9/2015
940367,POLICE FIELD PROBLEMS JULY 03 - JUNE 07,11/9/2015
940367,POLICE INVESTIGATION AND REPORTING JULY 03 - JUNE 07,11/9/2015
940367,POLICING A DEMOCRACY JULY 03 - JUNE 07,11/9/2015
940367,POLICING SPECIAL POPULATIONS JULY 03 - JUNE 07,11/9/2015
940367,PROCEDURAL LAW JULY 03 - JUNE 07,11/9/2015
940367,SUBSTANTIVE LAW JULY 03 - JUNE 07,11/9/2015
940367,TERRORISM AWARENESS AND RESPONSE JULY 03 - JUNE 07,11/9/2015
940367,EQUAL EMPLOYMENT OPPORTUNITY ANNUAL LIAISON TRAINING CONFERENCE,3/13/2013
940367,CRIMINAL INVESTIGATORS COURSE,1/3/2013
940367,FUNDAMENTALS OF AUTO THEFT INVESTIGATION,12/4/2012
940367,PROPERTY EVIDENCE TRACKING SYSTEM,2/3/2012
940367,DISORDER CONTROL TRAINING,11/10/2011
940367,DIGNITARY PROTECTION COURSE,5/19/2010
940367,MARIJUANA FIELD TESTING QUALIFIED,10/16/2008
940367,PSB MARIJUANA FIELD TESTING,10/15/2008
940367,STREET NARCOTICS ENFORCEMENT UNIT SNEU,5/9/2007
940367,COBRA - COHORT TRAINING,4/18/2006
940367,12 PASSENGER VAN / UTILITY VEHICLE QUALIFICATION,1/9/2006
940367,COLLISION REFRESHER (2 DAY),
940367,COLLISION RETRAINING,
940367,RECRUIT 12 PASSENGER VAN / UTILITY VEHICLE QUALIFICATION,
940367,RECRUIT RMP QUALIFICATION / RMP OPERATOR QUALIFIED,
977579,CLT-DOMESTIC VIOLENCE TRAINING,6/21/2025
977579,CLT-DOMESTIC VIOLENCE TRAINING,6/17/2025
977579,2025 BWC PROFICIENCY TRAINING,6/14/2025
977579,2025 EQUAL EMPLOYMENT OPPORTUNITY TRAINING - SEXUAL HARASSMENT AWARENESS AND PREVENTION,6/6/2025
977579,EAU 2025 POLICE COMMISSIONER JESSICA S. TISCH,6/6/2025
977579,SQF REVIEW AND DOCUMENTATION: SQF MODULE 10,6/6/2025
977579,CLT-OCCUPATIONAL-WORKPLACE SAFETY AND HEALTH,5/23/2025
977579,CLT-OCCUPATIONAL-WORKPLACE SAFETY AND HEALTH,5/19/2025
977579,PLAIN CLOTHES TRAINING CERTIFIED BASIC PLAIN-CLOTHES COURSE,5/7/2025
977579,CLT-DOMESTIC VIOLENCE TRAINING,5/1/2025
977579,CLT-ENFORCEMENT ACTIONS,5/1/2025
977579,CLT-ENFORCEMENT ACTIONS,4/25/2025
977579,CLT-DOMESTIC VIOLENCE TRAINING,4/22/2025
977579,CRISIS INTERVENTION TEAM TRAINING,4/10/2025
977579,CLT-DOMESTIC VIOLENCE TRAINING,4/1/2025
977579,"CLT-UNIFORMS, PERSONAL APPEARANCE AND EQUIPMENT",3/25/2025
977579,"CLT-UNIFORMS, PERSONAL APPEARANCE AND EQUIPMENT",3/3/2025
977579,CLT-PROCEDURAL OPERATIONS,2/25/2025
977579,CLT-DOMESTIC VIOLENCE TRAINING,2/15/2025
977579,FTS - TASER 7 ANNUAL RECERTIFICATION,2/6/2025
977579,RIGHT TO KNOW ACT SQF MODULE 9,1/26/2025
