taxid,date,name
965241,8/20/2018,CLT-OCCUPATIONAL-WORKPLACE SAFETY AND HEALTH
965241,8/20/2018,CLT-PROCEDURAL OPERATIONS
965241,8/20/2018,COLLABORATIVE POLICING- ACCESSING TELEPHONIC INTERPRETERS VIA LANGUAGE LINE
965241,8/20/2018,COLLABORATIVE POLICING- FOREIGN LANGUAGE CERTIFICATION VIDEO
965241,8/20/2018,"CPS INTERIOR PATROL OF HOUSING AUTHORITY BUILDINGS, PG 212-60 ROLL CALL VIDEO 1"
965241,8/20/2018,"CPS INTERIOR PATROL OF HOUSING AUTHORITY BUILDINGS, PG 212-60 ROLL CALL VIDEO 2"
965241,8/20/2018,CPS INTERIOR PATROL TRESPASS AFFIDAVIT PROGRAM (TAP) VIDEO 1
965241,8/20/2018,CPS INTERIOR PATROL TRESPASS AFFIDAVIT PROGRAM (TAP) VIDEO 2
965241,8/20/2018,CRIMINAL JUSTICE REFORM ACT ROLL CALL TRAINING PART 1
965241,8/20/2018,CRIMINAL JUSTICE REFORM ACT ROLL CALL TRAINING PART 2
965241,8/20/2018,EQUAL EMPLOYMENT OPPORTUNITY TRANSGENDER DIVERSITY AND INCLUSION:EXECUTIVE ORDER 16
965241,8/20/2018,INVESTIGATIVE ENCOUNTERS-VIDEO #1 REQUEST FOR INFO-UNIT TRAINING FEB 2016
965241,8/20/2018,INVESTIGATIVE ENCOUNTERS-VIDEO #2 COMMON LAW RIGHT OF INQUIRY-UNIT TRAINING MAY 2016
965241,8/20/2018,INVESTIGATIVE ENCOUNTERS-VIDEO #3 TERRY STOPS AND REASONABLE SUSPICION-UNIT TRAINING JUNE 2016
965241,8/20/2018,INVESTIGATIVE ENCOUNTERS-VIDEO #4 DOCUMENTATION AND SUPERVISION-UNIT TRAINING JULY 2016
965241,8/20/2018,NARCAN NASAL SPRAY TRAINING
965241,8/20/2018,NEW PERFORMANCE EVALUATION PROCESS
965241,8/20/2018,PATROL- POLYCARBONATE SHIELD
965241,8/20/2018,PERSONNEL BUREAU NYPD EMPLOYEE ASSISTANCE UNIT (EAU)
965241,8/20/2018,POLICE COMMISSIONERS MESSAGE - VICTIMS OF SEXUAL ASSAULT VIDEO
965241,8/20/2018,PUBLIC CONTACT AND CONSENT TO SEARCH (RIGHT TO KNOW) - UNIT TRAINING AUGUST 2016
965241,8/20/2018,TACTICAL AWARENESS-SMARTPHONE SAFETY
965241,8/16/2018,CLT-DOCUMENTATION AND FORMS
965241,8/16/2018,"CLT-INTEGRITY, ETHICS AND DISCIPLINE"
965241,8/15/2018,CLT-CRIME CONTROL STRATEGIES AND PROBLEM SOLVING
965241,8/15/2018,CLT-PROCEDURAL OPERATIONS
965241,8/14/2018,CLT-ENFORCEMENT ACTIONS
965241,8/13/2018,"CLT-UNIFORMS, PERSONAL APPEARANCE AND EQUIPMENT"
965241,8/12/2018,CLT-TACTICAL AWARENESS AND OFFICER SAFETY
965241,8/8/2018,CLT-COUNTERTERRORISM AND INTELLIGENCE
965241,8/7/2018,CLT-INVESTIGATIONS
965241,8/6/2018,CLT-INVESTIGATIONS
965241,8/5/2018,CLT-PROCEDURAL OPERATIONS
965241,8/3/2018,CLT-LEGAL ISSUES
965241,8/1/2018,"CLT-INTEGRITY, ETHICS AND DISCIPLINE"
965241,7/31/2018,CLT-LEGAL ISSUES
965241,7/29/2018,CLT-PROCEDURAL OPERATIONS
965241,7/29/2018,CLT-PROPERTY
965241,7/26/2018,CLT-OCCUPATIONAL-WORKPLACE SAFETY AND HEALTH
965241,7/24/2018,CLT-INFORMATION TECHNOLOGY
965241,7/23/2018,FTS - CEW X26P HOLSTER TRAINING AND DISTRIBUTION
965241,7/22/2018,CLT-HUMAN RESOURCES AND PERSONNEL MATTERS
965241,7/17/2018,CLT-DOCUMENTATION AND FORMS
965241,7/16/2018,CLT-COUNTERTERRORISM AND INTELLIGENCE
965241,7/10/2018,CLT-OCCUPATIONAL-WORKPLACE SAFETY AND HEALTH
965241,7/9/2018,CLT-CRIME CONTROL STRATEGIES AND PROBLEM SOLVING
965241,7/9/2018,CLT-DOCUMENTATION AND FORMS
965241,7/2/2018,BTK (BELT TRAUMA KIT DISTRIBUTION AND FAMILIARIZATION)
965241,6/29/2018,POLICE ACADEMY RECRUIT 3RD TRIMESTER EXAM MAKE-UP 1
965241,6/1/2018,PTTD C.P.R. / A.E.D. WRITTEN EXAM
965241,6/1/2018,PTTD WATER SAFETY
965241,5/30/2018,COMMUNICATIONS- THE PROPER USAGE OF THE IDA RADIO CODES
965241,5/30/2018,HIGHWAY DRUG IMPAIRED DRIVING COURSE
965241,5/30/2018,HIGHWAY PRELIMINARY BREATH TEST INSTRUMENT TRAINING - PBT
965241,5/14/2018,VEHICLE STOP SOLUTIONS MODULE
965241,5/7/2018,PTTD DEFENSIVE TACTICS PRACTICAL EXAM
965241,5/4/2018,GROUND TACTICS
965241,4/30/2018,POLICE ACADEMY RECRUIT 2ND TRIMESTER EXAM
965241,4/27/2018,POLICE ACADEMY RECRUIT JUSTIFICATION WRITTEN EXAM
965241,4/26/2018,RECRUIT RAPID DEPLOYMENT-ACTIVE SHOOTER
965241,4/6/2018,PTTD EXPANDABLE BATON
965241,4/5/2018,(PQC OFF DUTY PISTOL) RECRUIT TACTICAL FIREARMS REQUALIFICATION
965241,4/5/2018,FIREARMS 5 DAY TACTICAL APPLICATION V2
965241,4/3/2018,PTTD WEAPONS DEFENSE
965241,3/28/2018,BATON
965241,3/23/2018,P.A. RECRUIT NCIC/III EXAM
965241,3/23/2018,P.A. RECRUIT NYPD COMPUTER USE POLICY AND MONITORING NOTICE
965241,3/23/2018,RECRUIT TRAINING COMPUTER COURSE
965241,3/19/2018,LEGAL BUREAU PERFORMANCE METRICS - PROHIBITED CONDUCT
965241,3/19/2018,POLICE SCIENCE- POLICING WITH INTEGRITY QUIZ
965241,3/15/2018,RECRUIT TACTICAL FIREARMS QUALIFICATION AND TRAINING OFF DUTY PISTOL CERTIFIED
965241,3/12/2018,FTS - CEW END USER CERTIFICATION
965241,3/8/2018,FRISKING AND HANDCUFFING
965241,3/5/2018,POLICE ACADEMY RECRUIT 1ST TRIMESTER EXAM
965241,3/2/2018,POLICE ACADEMY RECRUIT STOP QUESTION & FRISK WRITTEN EXAM
965241,3/1/2018,"PTTD CARDIO ENDURANCE TEST, 1ST ATTEMPT"
965241,2/28/2018,FIRST AID WRITEN EXAM
965241,2/27/2018,RECRUIT BASIC FIREARMS QUALIFICATION AND TRAINING
965241,2/19/2018,LAW- SEARCH AND SEIZURE QUIZ
965241,2/16/2018,PTTD DEFENSIVE TACTICS PRACTICAL EXAM
965241,2/13/2018,PTTD CPR PRACTICAL EXAM
965241,2/5/2018,POLICE SCIENCE- GENERAL REGULATIONS QUIZ
965241,1/16/2018,POLICE ACADEMY RECRUIT PREREADING EXAM
965241,11/9/2015,EMERGENCY VEHICLE OPERATION JULY 07 - PRESENT
965241,11/9/2015,FIELD TRAINING PROGRAM JULY 07 - PRESENT
965241,11/9/2015,PHYSICAL EDUCATION PART 1: FOUNDATIONS OF PHYSICAL FITNESS
965241,11/9/2015,PHYSICAL EDUCATION PART 2: DEFENSIVE TACTICS JULY 07 - PRESENT
965241,11/9/2015,PHYSICAL EDUCATION PART 3: AMERICAN HEART ASSOCIATION BASIC LIFE SUPPORT
965241,11/9/2015,POLICE CRISIS INTERVENTION JULY 07 - PRESENT
965241,11/9/2015,POLICE FIELD PROBLEMS JULY 07 - PRESENT
965241,11/9/2015,POLICE INVESTIGATION AND REPORTING JULY 07 - PRESENT
965241,11/9/2015,POLICING A DEMOCRACY JULY 07 - PRESENT
965241,11/9/2015,POLICING SPECIAL POPULATIONS JULY 07 - PRESENT
965241,11/9/2015,PROCEDURAL LAW JULY 07 - PRESENT
965241,11/9/2015,SUBSTANTIVE LAW JULY 07 - PRESENT
965241,11/9/2015,TERRORISM AWARENESS AND RESPONSE JULY 07 - PRESENT
942007,6/17/2025,2025 BWC PROFICIENCY TRAINING
942007,6/13/2025,EAU 2025 POLICE COMMISSIONER JESSICA S. TISCH
942007,5/31/2025,2025 EQUAL EMPLOYMENT OPPORTUNITY TRAINING - SEXUAL HARASSMENT AWARENESS AND PREVENTION
942007,5/31/2025,SQF REVIEW AND DOCUMENTATION: SQF MODULE 10
942007,3/28/2025,FTS - CEW TASER 7 TRANSITION COURSE
942007,3/28/2025,FTS - TASER 7 HOLSTER DISTRIBUTION
942007,1/23/2025,RIGHT TO KNOW ACT SQF MODULE 9
942007,1/23/2025,VEHICLE PURSUITS
942007,1/12/2025,2025 IDENTIFYING THE IMPAIRED DRIVER REFRESHER
942007,1/12/2025,ACTIVE SHOOTER - SCHOOL RESPONSE PROTOCOL
942007,1/12/2025,KEVIN AND AVONTE SAFE HOME PROGRAM
942007,12/27/2024,CELL BLOCK FIRESHIELD EV BLANKETS
942007,12/19/2024,INFORMATION SECURITY AWARENESS TRAINING 2024
942007,12/19/2024,MULTI-FACTOR AUTHENTICATION MFA TRAINING
942007,12/4/2024,BEHAVIORAL HEALTH EMERGENCY ASSISTANCE RESPONSE DIVISION B-HEARD
942007,12/4/2024,NOTIFICATION OF ALLEGATIONS AND EMPLOYEE RIGHTS
942007,11/16/2024,DRIVING WHILE INTOXICATED AWARENESS VIDEO MODULE 1
942007,11/14/2024,LEAVING THE SCENE COLLISIONS INVESTIGATIVE BEST PRACTICES
942007,10/3/2024,FAMILY BUILDING
942007,10/3/2024,NORTHWELL DIRECT FINEST CARE PROGRAM FOR UMOS
942007,9/12/2024,RACIAL PROFILING AND BIASED BASED POLICING: SQF MODULE 8
942007,8/20/2024,APX NEXT PORTABLE AND RADIO DISCIPLINE TRAINING VIDEO
942007,8/20/2024,RAPE IS RAPE
942007,8/13/2024,FTS - COLT M4 RE-QUALIFICATION
942007,8/10/2024,UNMANNED AIRCRAFT SYSTEMS VISUAL OBSERVER
942007,7/8/2024,MENTAL HEALTH INVOLUNTARY REMOVALS MHL 9.41 AND MHL 9.58
942007,6/22/2024,LEVEL 1 AND LEVEL 2 INVESTIGATIVE ENCOUNTERS
942007,5/30/2024,TACTICS WHEN ENGAGING INDIVIDUALS IN A MENTAL HEALTH CRISIS
942007,5/22/2024,ACCURATE COMPLAINT REPORT CLASSIFICATION
942007,5/7/2024,DRIVE SMART 2024
942007,5/4/2024,ASSISTING SURVIVORS OF SEXUAL BASED VIOLENCE WITH ACCESS TO RESOURCES
942007,4/30/2024,2024 EQUAL EMPLOYMENT OPPORTUNITY TRAINING - SEXUAL HARASSMENT AWARENESS AND PREVENTION
942007,4/30/2024,HOUSING BUREAU INTERIOR PATROL TACTICS
942007,4/18/2024,POLICING THE SUBWAY 2024
942007,3/14/2024,2024 VEHICLE SEIZURE FORM REFRESHER
942007,3/13/2024,EMPLOYEE ASSISTANCE UNIT (E.A.U.) IS HERE FOR YOU- 2024
942007,3/13/2024,NYCHA INTERIOR PATROL: SQF MODULE 7
942007,1/20/2024,AUTISM SPECTRUM DISORDER
942007,1/13/2024,SRG - RAPID MOBILIZATION (PATROL) LEVEL 4
942007,1/6/2024,INVESTIGATIVE ENCOUNTERS SUMMARY: SQF MODULE 6
942007,1/6/2024,LGBTQIA PLUS - DIVERSITY AND INCLUSION
942007,1/6/2024,OPIOID DANGERS- FENTANYL AND CARFENTANIL
942007,1/6/2024,"POSSESSION OR INGESTION OF ANABOLIC STEROIDS, HUMAN GROWTH HORMONE, AND NUTRITIONAL SUPPLEMENTS"
942007,12/24/2023,SRG - RAPID MOBILIZATION (PATROL) LEVEL 4
942007,12/8/2023,SRG - RAPID MOBILIZATION (PATROL) LEVEL 4
942007,11/17/2023,AUGMENTED REALITY FEATURE
942007,11/14/2023,SRG - RAPID MOBILIZATION (PATROL) LEVEL 4
942007,11/9/2023,SRG - RAPID MOBILIZATION (PATROL) LEVEL 4
942007,10/26/2023,INVESTIGATIVE ENCOUNTERS 2023: MODULE 5 SQF LEVELS 3 AND 4
942007,10/18/2023,NYPD RECRUITMENT TRAINING VIDEO
942007,10/6/2023,INFORMATION SECURITY AWARENESS TRAINING - 2023
942007,10/6/2023,VEHICLE MOUNTED VIDEO SYSTEM
942007,9/25/2023,EFFECTIVE COMMUNICATION SKILLS - DEAF OR HARD OF HEARING
942007,8/24/2023,NYPD JOUVERT AND WEST INDIAN DAY-2023
942007,8/4/2023,2023 SUMMER ALL-OUT BODY WORN CAMERA TRAINING
942007,8/4/2023,DIGNITARY PROTECTION COURSE
942007,8/4/2023,UNMANNED AIRCRAFT PERMIT: DRONES FOR PUBLIC USE
942007,7/12/2023,TRAFFIC COURT TESTIMONY VIDEO
942007,5/26/2023,"INVESTIGATIVE ENCOUNTERS 2023: MODULE 4 SQF LEVELS 2, 3 AND 4"
942007,5/17/2023,2023 EQUAL EMPLOYMENT OPPORTUNITY TRAINING-SEXUAL HARASSMENT AWARENESS AND PREVENTION
942007,4/15/2023,2023 LANGUAGE MATTERS - FOSTERING A POSITIVE WORK ENVIRONMENT
942007,3/25/2023,ESPER POLICY LIBRARY
942007,3/25/2023,INVESTIGATIVE ENCOUNTERS 2023: MODULE 3 SQF LEVEL 2
942007,3/11/2023,ELDER ABUSE -2023 REFRESHER
942007,2/22/2023,INFORMATION SECURITY CRIMINAL JUSTICE TRAINING 2023
942007,1/28/2023,NYPD-U VOLUNTARY - INVOLUNTARY TRANSPORTS
942007,1/28/2023,RAISING THE LOWER AGE OF JUVENILE DELINQUENCY
942007,1/10/2023,INVESTIGATIVE ENCOUNTERS 2023: MODULE 2 SQF LEVEL 1
942007,12/15/2022,INVESTIGATIVE ENCOUNTERS 2023 - MODULE 1 INTRODUCTION TO SQF
942007,11/30/2022,VIDEO 1 - PATROLLING THE NYC SUBWAY SYSTEM 2022
942007,11/30/2022,VIDEO 2 -TACTICAL CONSIDERATIONS FOR TRANSIT PATROL 2022 (PART 1)
942007,11/30/2022,VIDEO 3 - TACTICAL CONSIDERATIONS FOR TRANSIT PATROL 2022 (PART 2)
942007,11/30/2022,VIDEO 4 - PLATFORM SAFETY 2022
942007,11/10/2022,FTS - ANNUAL CEW RECERTIFICATION
942007,11/3/2022,LGBTQIA PLUS AWARENESS
942007,10/22/2022,BELT-WORN TRAUMA KIT REFRESHER TRAINING VIDEO-2022
942007,10/22/2022,PROCESSING CIVILIAN COMPLAINTS
942007,9/9/2022,THE EMPLOYEE ASSISTANCE UNIT (EAU) IS HERE FOR YOU
942007,8/30/2022,NYPD JOUVERT  WEST INDIAN DAY
942007,7/12/2022,"INTEGRATING COMMUNICATION, ASSESSMENT, AND TACTICS (ICAT) MODULE 7"
942007,7/8/2022,2022 EQUAL EMPLOYMENT OPPORTUNITY TRAINING-SEXUAL HARASSMENT AWARENESS AND PREVENTION
942007,7/8/2022,CAR STOP TACTICS FOR PATROL OFFICERS - MODULE 1: CONTROLLING THE STOP
942007,7/8/2022,CAR STOP TACTICS FOR PATROL OFFICERS - MODULE 2: PROHIBITED MANEUVERS
942007,7/8/2022,CAR STOP TACTICS FOR PATROL OFFICERS - MODULE 3: THE UNKNOWN RISK STOP
942007,7/8/2022,CAR STOP TACTICS FOR PATROL OFFICERS - MODULE 4: THE HIGH-RISK STOP
942007,7/8/2022,CONVICTED OFFENDER DNA DATABANK SPECIMEN COLLECTION KIT
942007,7/8/2022,VEHICLE SEIZURE FORM
942007,6/15/2022,"INTEGRATING COMMUNICATION, ASSESSMENT AND TACTICS (ICAT) MODULE 6"
942007,6/4/2022,NATIONAL INCIDENT-BASED REPORTING SYSTEM (NIBRS) UPDATES TO THE OMNIFORM COMPLAINT SYSTEMV
942007,5/26/2022,PROHIBITED METHODS OF RESTRAINT
942007,5/2/2022,BEST PRACTICES IN STRUCTURED INTERVIEWING
942007,5/2/2022,VIPER CCTV TRAINING COURSE
942007,4/11/2022,"INTEGRATING COMMUNICATION, ASSESSMENT AND TACTICS (ICAT) MODULE 5"
942007,2/23/2022,"INTEGRATING COMMUNICATION, ASSESSMENT AND TACTICS (ICAT) MODULE 4"
942007,1/26/2022,ILLEGAL EVICTIONS
942007,1/3/2022,LOCAL LAW 45 OF 2021-TRAFFIC ENCOUNTERS
942007,12/20/2021,"INTEGRATING COMMUNICATION, ASSESSMENT AND TACTICS (ICAT) MODULE 3"
942007,12/2/2021,IDENTIFYING THE IMPAIRED DRIVER
942007,11/11/2021,"INTEGRATING COMMUNICATION, ASSESSMENT AND TACTICS (ICAT) MODULE 1"
942007,11/11/2021,"INTEGRATING COMMUNICATION, ASSESSMENT AND TACTICS (ICAT) MODULE 2"
942007,11/4/2021,COVID-19 SELF-COLLECTION KIT INSTRUCTIONS
942007,11/4/2021,NEIGHBORHOOD POLICING APPLICATION TRAINING VIDEO
942007,11/3/2021,2021 EXECUTIVE CONFERENCE - VIDEOS
942007,10/29/2021,INTRODUCTION TO COGNOS 11
942007,10/23/2021,ARRESTS - RELIGIOUS HEAD COVERING GUIDELINES (PG 208-83)
942007,10/15/2021,BODY-WORN CAMERA REVIEW PART TWO
942007,9/29/2021,BODY-WORN CAMERA REVIEW PART ONE
942007,9/16/2021,OPIOID OVERDOSE RECOGNITION AND NARCAN ADMINISTRATION -2021
942007,9/15/2021,INFORMATION SECURITY AWARENESS TRAINING 2021
942007,9/11/2021,MAYOR EXECUTIVE ORDER 78 VACCINATION - TESTING COMPLIANCE POLICY
942007,8/22/2021,X26P TRANSITION COURSE FOR CURRENT X26 END-USERS
942007,8/21/2021,HEALTH AND WELLNESS SECTION - MODULE 14 - FINANCIAL WELLNESS PART 1
942007,8/21/2021,HEALTH AND WELLNESS SECTION - MODULE 15 - FINANCIAL WELLNESS PART 2
942007,8/21/2021,HEALTH AND WELLNESS SECTION - MODULE 16 - GRIEF AND COPING
942007,8/21/2021,HEALTH AND WELLNESS SECTION - MODULE 18 - YOGA MYTH BUSTING
942007,8/21/2021,HEALTH AND WELLNESS SECTION - MODULE 19 - STOP SMOKING - NYC ESCAPE PROGRAM
942007,8/21/2021,HEALTH AND WELLNESS SECTION - MODULE 20 - POPPA TESTIMONIAL VIDEO
942007,8/21/2021,HEALTH AND WELLNESS SECTION - NUTRITIONAL SERIES: DIETING FOR WEIGHT LOSS - MODULE 1 - INTRODUCTION
942007,8/20/2021,HEALTH AND WELLNESS SECTION - CHILD MIND INSTITUTE VIDEO SERIES - MODULE 3 - CHILDREN'S MENTAL HEALT
942007,8/20/2021,HEALTH AND WELLNESS SECTION - CHILD MIND INSTITUTE VIDEO SERIES - MODULE 4 - RAISING SELF SUFFICIENT
942007,8/20/2021,HEALTH AND WELLNESS SECTION - FINANCIAL LITERACY SERIES - MODULE 3 - YOUR SPENDING AND SAVINGS PLAN
942007,8/20/2021,HEALTH AND WELLNESS SECTION - FINANCIAL LITERACY SERIES - MODULE 4 - MANAGING DEBT
942007,8/20/2021,HEALTH AND WELLNESS SECTION - MODULE 17 - FINANCIAL WILLS AND TRUSTS
942007,8/11/2021,ACTIVE BYSTANDERSHIP FOR LAW ENFORCEMENT (ABLE): ONE DAY COURSE
942007,8/6/2021,COUNTERTERRORISM BUREAU CRC STRYKER TEAM GUIDELINES AT DEPLOYMENT
942007,8/6/2021,REGISTRATION OF AIM
942007,7/22/2021,AIM COMPONENTS
942007,7/21/2021,COVID VACCINE DISTRIBUTION AND EDUCATION
942007,7/20/2021,EQUAL EMPLOYMENT OPPORTUNITY TRAINING - SEXUAL HARASSMENT AWARENESS AND PREVENTION 2021
942007,5/20/2021,HEALTH AND WELLNESS SECTION - CHILD MIND INSTITUTE VIDEO SERIES - MODULE 2 - WHEN TO WORRY ABOUT YOU
942007,5/19/2021,OVERVIEW OF THE NEW DISCOVERY LAWS 2021 REFRESHER
942007,5/19/2021,PATROL GUIDE 215-17 POLICE ACTIONS RELATED QUESTIONING ARRESTS AND INVESTIGATIONS AT A NYC DEPARTMEN
942007,5/10/2021,EMPLOYEE ASSISTANCE UNIT-2021
942007,4/13/2021,EQUAL EMPLOYMENT OPPORTUNITY TRAINING - LGBTQIA+ DIVERSITY AND INCLUSION / EXECUTIVE ORDER 16 OF 201
942007,4/13/2021,HEALTH AND WELLNESS SECTION - CHILD MIND INSTITUTE VIDEO SERIES - MODULE 1 - BEHAVIOR MANAGEMENT STR
942007,3/5/2021,DESK APPEARANCE TICKETS: THE NEW LAW AND THE NEW GUIDELINES FOR PROCESSING DAT'S - 2021 REFRESHER
942007,12/15/2020,HEALTH AND WELLNESS SECTION - MYPLATE APP TUTORIAL
942007,12/5/2020,HEALTH AND WELLNESS SECTION - FINANCIAL LITERACY SERIES - MODULE 2 - YOUR INCOME AND EXPENSES
942007,12/4/2020,EQUAL EMPLOYMENT OPPORTUNITY TRAINING - LEAVE TO EXPRESS BREAST MILK
942007,12/4/2020,HEALTH AND WELLNESS SECTION - FINANCIAL LITERACY SERIES - MODULE 1 - YOUR MONEY VALUES AND INFLUENCE
942007,7/4/2020,"EQUAL EMPLOYMENT OPPORTUNITY TRAINING - SEXUAL HARASSMENT, AWARENESS AND PREVENTION"
942007,7/4/2020,NEW LAWS AFFECTING POLICE OFFICERS’ CRIMINAL AND CIVIL LIABILITY
942007,6/29/2020,VICTIM BLAMING AND RELEASE OF INFORMATION TO THE MEDIA
942007,6/22/2020,HEALTH AND WELLNESS SECTION - MODULE 12 - IN THAT DARK PLACE - AN OFFICER'S JOURNEY
942007,6/22/2020,HEALTH AND WELLNESS SECTION - MODULE 13 - MINDFULNESS
942007,5/27/2020,AXON CASES 2.0
942007,5/27/2020,AXON TRAINING - MODULE 1 AXON BODY 2 BASIC OPERATION
942007,5/27/2020,COVID-19: PREPAREDNESS YOUR FAMILY AND HOME
942007,5/27/2020,HEALTH AND WELLNESS SECTION - MODULE 1 - PSYCHOLOGICAL HEALTH AND WELLNESS
942007,5/27/2020,HEALTH AND WELLNESS SECTION - MODULE 10 - SEEKING AND RECEIVING MENTAL HEALTH SUPPORT
942007,5/27/2020,HEALTH AND WELLNESS SECTION - MODULE 11 - HEALTH AND RESILIENCY
942007,5/27/2020,HEALTH AND WELLNESS SECTION - MODULE 2 - JOB COUNSELING AND STRESS
942007,5/27/2020,HEALTH AND WELLNESS SECTION - MODULE 3 - WARNING SIGNS
942007,5/27/2020,HEALTH AND WELLNESS SECTION - MODULE 4 - CUMULATIVE TRAUMA
942007,5/27/2020,HEALTH AND WELLNESS SECTION - MODULE 5 - GAINING PERSPECTIVE
942007,5/27/2020,HEALTH AND WELLNESS SECTION - MODULE 6 - COPING WITH SIGNS OF ANXIETY DEPRESSION
942007,5/27/2020,HEALTH AND WELLNESS SECTION - MODULE 7 - LEADING WITH COMPASSION
942007,5/27/2020,"HEALTH AND WELLNESS SECTION - MODULE 8 - WARNING SIGNS, SUPPORT AND OUTREACH"
942007,5/27/2020,HEALTH AND WELLNESS SECTION - MODULE 9 - MANAGING STRESS ON THE JOB
942007,5/10/2020,COVID-19: PREPAREDENESS
942007,5/10/2020,COVID-19: PROTECTIVE MASKS
942007,5/10/2020,SAFETY CONSIDERATIONS FOR PATROLLING THE NYC SUBWAY SYSTEM -DANGERS OF THE PLATFORM EDGE
942007,2/17/2020,UTILIZING BALLISTIC PROTECTION IN DEPARTMENT VEHICLES (4:09)
942007,2/8/2020,CRIMINAL JUSTICE BUREAU - GIGLIO MATERIAL DISCLOSURES UNDER THE NEW DISCOVERY LAWS
942007,1/28/2020,2017-2019 IN-SERVICE CYCLE-INVESTIGATIVE ENCOUNTERS- BASIC TRAINING WITH SCENARIOS
942007,1/22/2020,CPS FAIR AND IMPARTIAL POLICING - ALL POS AND DETS
942007,1/11/2020,PROCESSING DISCOVERY MATERIAL IN THE FORMS ARREST FOLDER
942007,1/3/2020,CROSSFIRE MITIGATION DURING CLOSE COMBAT INCIDENTS - PART 2
942007,12/27/2019,SAFEGUARDING HOSPITALIZED PRISONERS
942007,12/7/2019,CROSSFIRE MITIGATION DURING CLOSE COMBAT INCIDENTS
942007,11/28/2019,ACTIVITY LOG FOR IPHONE
942007,11/28/2019,EXECUTIVE HEALTH AND WELLNESS CONFERENCE - MODULE 1
942007,11/28/2019,EXECUTIVE HEALTH AND WELLNESS TRAINING - MODULE 10
942007,11/28/2019,EXECUTIVE HEALTH AND WELLNESS TRAINING - MODULE 2
942007,11/28/2019,EXECUTIVE HEALTH AND WELLNESS TRAINING - MODULE 3
942007,11/28/2019,EXECUTIVE HEALTH AND WELLNESS TRAINING - MODULE 4
942007,11/28/2019,EXECUTIVE HEALTH AND WELLNESS TRAINING - MODULE 5
942007,11/28/2019,EXECUTIVE HEALTH AND WELLNESS TRAINING - MODULE 6
942007,11/28/2019,EXECUTIVE HEALTH AND WELLNESS TRAINING - MODULE 7
942007,11/28/2019,EXECUTIVE HEALTH AND WELLNESS TRAINING - MODULE 8
942007,11/28/2019,EXECUTIVE HEALTH AND WELLNESS TRAINING - MODULE 9
942007,11/28/2019,FACILITIES MANAGEMENT DIVISION - MUNICIPAL SEPERATE STORM SEWER SYSTEM (MS4)
942007,11/28/2019,INCREASE OFFICER SAFETY DURING VEHICLE STOPS
942007,11/28/2019,INFORMATION SECURITY AWERENESS TRAINING 2019
942007,11/28/2019,RESPONDING TO COMMERCIAL ROBBERIES PART LL - MODULE 1 AND MODULE 2
942007,11/26/2019,CJB - DESK APPEARANCE TICKETS: THE NEW LAWS AND GUIDELINES FOR PROCESSING DATS
942007,11/26/2019,CJB - OVERVIEW OF THE NEW DISCOVERY LAWS
942007,11/13/2019,DISCHARGING YOUR FIREARM AT A MOVING THREAT
942007,10/30/2019,PRISONER ESCAPE WARNING SIGNS
942007,10/30/2019,SUCCESSFULLY DISARMING AN EMOTIONALLY DISTURBED PERSON
942007,10/14/2019,CRIMINAL JUSTICE BUREAU - DNA TRAINING VIDEO
942007,10/14/2019,FORCE POLICY UPDATE VIDEO
942007,9/27/2019,CRITICAL DECISION MAKING MODEL
942007,9/24/2019,SHIELD OF RESILIENCE TRAINING COURSE
942007,9/20/2019,MARIJUANA POLICY UPDATE
942007,9/10/2019,DOMESTIC VIOLENCE EDUCATION AND COUNSELING
942007,8/9/2019,CLT-ENFORCEMENT ACTIONS
942007,8/8/2019,CLT-INVESTIGATIONS
942007,8/7/2019,CRITICAL INCIDENT TACTICS - RESPONDING TO COMMERCIAL ROBBERIES (EXTENDED VERSION)
942007,8/7/2019,RESPONDING TO COMMERCIAL ROBBERIES
942007,7/9/2019,CLT-TACTICAL AWARENESS AND OFFICER SAFETY
942007,7/8/2019,TRANSIT BUREAU - SAFETY CONSIDERATIONS FOR PATROLLING THE NYC SUBWAY SYSTEM
942007,7/8/2019,TRANSIT BUREAU - SAFETY CONSIDERATIONS FOR PATROLLING THE NYC SUBWAY SYSTEM - PART 2
942007,6/26/2019,RESPONDING TO PEOPLE IN CRISIS – MODULE 4: USING DEPARTMENT MOBILE DIGITAL DEVICES
942007,6/20/2019,CLT-MEMBER-EMPLOYEE WELLNESS
942007,6/16/2019,DISCUSSION - BASED LEARNING MODULE # 1-3
942007,6/16/2019,WORLDPRIDE NYC 2019
942007,6/1/2019,CLT-ENFORCEMENT ACTIONS
942007,5/24/2019,2017-2019 IN-SERVICE CYCLE-INVESTIGATIVE ENCOUNTERS- BASIC TRAINING WITH SCENARIOS
942007,5/24/2019,COLLABORATIVE POLICING - MEDIATION REFERRAL PROGRAM FOR NON-CRIMINAL COMPLAINTS
942007,5/11/2019,CLT-ENFORCEMENT ACTIONS
942007,4/25/2019,COUNTERTERRORISM BUREAU ACTIVE SHOOTER SCHOOL INCIDENTS AWARENESS
942007,4/25/2019,COUNTERTERRORISM BUREAU NH15 TRAINING
942007,4/25/2019,RESPONDING TO PEOPLE IN CRISIS - MODULES 2 AND 3: ACTIVE LISTENING PARTS 1 AND 2
942007,4/13/2019,COLLABORATIVE POLICING - THE DEAF AND HARD OF HEARING COMMUNITY
942007,4/2/2019,LEGAL BUREAU - PERJURY TRAINING MODULE
942007,3/20/2019,SAFEGUARDING PRISONERS - OFFICER SAFETY GUIDELINES
942007,3/5/2019,COLLABORATIVE POLICING - ELDER ABUSE
942007,2/10/2019,CITYTIME USER TRAINING FOR MANAGERIAL CIVIL SERVICE TITLES
942007,2/10/2019,CITYTIME USER TRAINING FOR NON-MANAGERIAL CMOS
942007,2/2/2019,"SUPPORT SERVICES DIVISION - CLASS ""C"" OPERATOR"
942007,1/26/2019,CITYTIME APPROVER TRAINING FOR SUPERVISORS APPROVING CMOS TIMESHEETS
942007,1/26/2019,"EXECUTIVE CONFERENCE VIDEO 10-17-18: DISCUSSION WITH INDRA NOOYI, CHAIRMAN OF PEPSI CO"
942007,1/26/2019,"EXECUTIVE CONFERENCE VIDEO 10-17-18: INTELLIGENT LEADERSHIP: GEORGE TENET, FORMER (DIRECTOR OF CENTR"
942007,1/26/2019,EXECUTIVE CONFERENCE VIDEO 10-17-18: LEADERSHIP ON AND OFF THE BATTLEFIELD: GENERAL JOHN R. ALLEN (P
942007,1/26/2019,EXECUTIVE CONFERENCE VIDEO 10-17-18: MAKING IT REAL-GETTING FROM HERE TO THERE TOGETHER - DR SCOTT L
942007,1/26/2019,RESPONDING TO PEOPLE IN CRISIS - MODULE 1: SENDING THE RIGHT SIGNALS
942007,1/12/2019,PATROL DOOR BAG - ROPE AND WEDGE INTRODUCTION
942007,12/28/2018,EQUAL EMPLOYMENT OPPORTUNITYTRAINING - SEXUAL HARASSMENT AWARENESS AND PREVENTION
942007,12/18/2018,2017-2019 IN-SERVICE CYCLE-INTEGRATED TACTICS
942007,12/17/2018,AIM REGISTRATION AND SYNCHRONIZATION 2.0
942007,12/17/2018,VERTEX 949 RADIO OPERATIONAL INSTRUCTIONS
942007,12/5/2018,FTS - CEW X26P HOLSTER TRAINING AND DISTRIBUTION
942007,12/4/2018,FTS - CEW END USER CERTIFICATION
942007,12/3/2018,MARIJUANA BURNING ENFORCEMENT POLICY
942007,12/3/2018,TRANSIT BUREAU - TIMELY RESUMPTION OF SERVICE IN NYC TRANSIT
942007,11/21/2018,CLT-PROCEDURAL OPERATIONS
942007,11/14/2018,CLT-PROCEDURAL OPERATIONS
942007,11/4/2018,AMERICANS WITH DISABILITIES ACT (ADA)
942007,10/17/2018,RESPONDING TO PEOPLE IN CRISIS-INTRODUCTION TO CIT VIDEO SERIES
942007,10/16/2018,CLT-EQUAL EMPLOYMENT OPPORTUNITY
942007,10/12/2018,BTK (BELT TRAUMA KIT DISTRIBUTION AND FAMILIARIZATION)
942007,10/11/2018,FTS - SMITH AND WESSON MODEL 5946 BARREL REMEDIATION
942007,9/23/2018,NYC RIGHT TO KNOW ACT LEGISLATION - PART 2
942007,9/23/2018,NYC RIGHT TO KNOW ACT LEGISLATION – PART 1
942007,9/21/2018,CLT-DOCUMENTATION AND FORMS
942007,9/19/2018,CLT-DOCUMENTATION AND FORMS
942007,9/18/2018,AIM COMPONENTS
942007,9/18/2018,DETECTIVE BUREAU RETRIEVING BODY WORN CAMERA DATA
942007,9/13/2018,CLT-ENFORCEMENT ACTIONS
942007,9/13/2018,CLT-LEGAL ISSUES
942007,9/13/2018,CLT-PROCEDURAL OPERATIONS
942007,9/12/2018,RAISE THE AGE
942007,8/16/2018,CABARET/CLUB ENFORCEMENT TRAINING
942007,8/15/2018,CLT-OCCUPATIONAL-WORKPLACE SAFETY AND HEALTH
942007,8/9/2018,CLT-OCCUPATIONAL-WORKPLACE SAFETY AND HEALTH
942007,8/7/2018,CLT-OCCUPATIONAL-WORKPLACE SAFETY AND HEALTH
942007,8/1/2018,CLT-DOCUMENTATION AND FORMS
942007,7/31/2018,"CLT-UNIFORMS, PERSONAL APPEARANCE AND EQUIPMENT"
942007,7/13/2018,CLT-DOCUMENTATION AND FORMS
942007,7/13/2018,CLT-INFORMATION TECHNOLOGY
942007,6/29/2018,CLT-LEGAL ISSUES
942007,6/15/2018,CLT-ENFORCEMENT ACTIONS
942007,6/13/2018,CLT-ENFORCEMENT ACTIONS
942007,6/2/2018,CLT-COMMUNICATION STRATEGIES AND AIDS
942007,6/2/2018,CLT-ENFORCEMENT ACTIONS
942007,6/2/2018,CLT-SPECIAL POPULATIONS
942007,5/29/2018,COMMUNICATIONS- THE PROPER USAGE OF THE IDA RADIO CODES
942007,5/29/2018,CPS FAIR AND IMPARTIAL POLICING - ALL POS AND DETS
942007,5/24/2018,CLT-EQUAL EMPLOYMENT OPPORTUNITY
942007,4/12/2018,INFORMATION SECURITY AWARENESS TRAINING
942007,4/11/2018,COLLABORATIVE POLICING- HUMAN TRAFFICKING
942007,4/11/2018,FORMS MEDICAL TREATMENT OF PRISONER TRAINING
942007,4/7/2018,CLT-DOCUMENTATION AND FORMS
942007,3/31/2018,CLT-OCCUPATIONAL-WORKPLACE SAFETY AND HEALTH
942007,3/24/2018,CLT-TACTICAL AWARENESS AND OFFICER SAFETY
942007,3/9/2018,CLT-PROCEDURAL OPERATIONS
942007,2/15/2018,LEGAL BUREAU PERFORMANCE METRICS - PROHIBITED CONDUCT
942007,2/9/2018,"COUNTERTERRORISM BUREAU FACILITY AWARENESS- THE INTREPID SEA, AIR AND SPACE MUSEUM"
942007,2/2/2018,IPHONE TRAINING AND DISTRIBUTION
942007,1/14/2018,NEW YEAR'S EVE TACTICAL AWARENESS
942007,1/14/2018,POLICE COMMISSIONER MESSAGE- NYC GIVES
942007,12/10/2017,COLLABORATIVE POLICING- FOREIGN LANGUAGE CERTIFICATION VIDEO
942007,12/10/2017,COUNTERTERRORISM BUREAU INITIAL PATROL RESPONSE FOR ACTIVE SHOOTER
942007,12/10/2017,IPHONE AND DAS MOBILE OPERATION
942007,12/5/2017,CPS BODY-WORN CAMERA TRAINING WITH SCENARIOS
942007,11/13/2017,NARCAN NASAL SPRAY TRAINING
942007,11/13/2017,PATROL- POLYCARBONATE SHIELD
942007,10/25/2017,NARCAN NASAL SPRAY TRAINING
942007,10/11/2017,COLLABORATIVE POLICING- ACCESSING TELEPHONIC INTERPRETERS VIA LANGUAGE LINE
942007,10/10/2017,FORMS SUMMONS
942007,9/13/2017,PATROL- POLYCARBONATE SHIELD
