taxid,date,name
937271,4/9/2024,POLICING THE SUBWAY 2024
937271,12/16/2023,CLT-DOCUMENTATION AND FORMS
937271,11/17/2023,AUGMENTED REALITY FEATURE
937271,10/23/2023,INVESTIGATIVE ENCOUNTERS 2023: MODULE 5 SQF LEVELS 3 AND 4
937271,10/17/2023,NYPD RECRUITMENT TRAINING VIDEO
937271,10/14/2023,HEALTH AND WELLNESS SECTION - MODULE 20 - POPPA TESTIMONIAL VIDEO
937271,10/14/2023,HEALTH AND WELLNESS SECTION - MYPLATE APP TUTORIAL
937271,10/14/2023,HEALTH AND WELLNESS SECTION - NUTRITIONAL SERIES: DIETING FOR WEIGHT LOSS - MODULE 1 - INTRODUCTION
937271,10/14/2023,X26P TRANSITION COURSE FOR CURRENT X26 END-USERS
937271,10/13/2023,COVID-19 SELF-COLLECTION KIT INSTRUCTIONS
937271,10/13/2023,NEIGHBORHOOD POLICING APPLICATION TRAINING VIDEO
937271,10/6/2023,ELDER ABUSE -2023 REFRESHER
937271,10/6/2023,VEHICLE MOUNTED VIDEO SYSTEM
937271,10/2/2023,INFORMATION SECURITY AWARENESS TRAINING - 2023
937271,9/25/2023,EFFECTIVE COMMUNICATION SKILLS - DEAF OR HARD OF HEARING
937271,9/21/2023,CLT-CRIME CONTROL STRATEGIES AND PROBLEM SOLVING
937271,8/30/2023,CLT-LEGAL ISSUES
937271,8/26/2023,NYPD JOUVERT AND WEST INDIAN DAY-2023
937271,8/11/2023,2023 SUMMER ALL-OUT BODY WORN CAMERA TRAINING
937271,8/11/2023,UNMANNED AIRCRAFT PERMIT: DRONES FOR PUBLIC USE
937271,7/27/2023,TRAFFIC COURT TESTIMONY VIDEO
937271,6/12/2023,"INVESTIGATIVE ENCOUNTERS 2023: MODULE 4 SQF LEVELS 2, 3 AND 4"
937271,5/2/2023,CLT-VOLUNTARY - INVOLUNTARY TRANSPORTS
937271,4/28/2023,2023 EQUAL EMPLOYMENT OPPORTUNITY TRAINING-SEXUAL HARASSMENT AWARENESS AND PREVENTION
937271,4/21/2023,CLT-DOCUMENTATION AND FORMS
937271,4/15/2023,BELT-WORN TRAUMA KIT REFRESHER TRAINING VIDEO-2022
937271,4/15/2023,PROCESSING CIVILIAN COMPLAINTS
937271,4/15/2023,TRANSIT BUREAU - TRANSIT KEYS
937271,4/14/2023,VIDEO 2 -TACTICAL CONSIDERATIONS FOR TRANSIT PATROL 2022 (PART 1)
937271,4/14/2023,VIDEO 3 - TACTICAL CONSIDERATIONS FOR TRANSIT PATROL 2022 (PART 2)
937271,4/14/2023,VIDEO 4 - PLATFORM SAFETY 2022
937271,4/13/2023,2023 LANGUAGE MATTERS - FOSTERING A POSITIVE WORK ENVIRONMENT
937271,4/7/2023,CLT-TACTICAL AWARENESS AND OFFICER SAFETY
937271,4/2/2023,VIDEO 1 - PATROLLING THE NYC SUBWAY SYSTEM 2022
937271,3/31/2023,CLT-TACTICAL AWARENESS AND OFFICER SAFETY
937271,3/31/2023,ESPER POLICY LIBRARY
937271,3/31/2023,INVESTIGATIVE ENCOUNTERS 2023 - MODULE 1 INTRODUCTION TO SQF
937271,3/31/2023,INVESTIGATIVE ENCOUNTERS 2023: MODULE 2 SQF LEVEL 1
937271,3/31/2023,INVESTIGATIVE ENCOUNTERS 2023: MODULE 3 SQF LEVEL 2
937271,3/31/2023,LGBTQIA PLUS AWARENESS
937271,3/31/2023,NYPD-U VOLUNTARY - INVOLUNTARY TRANSPORTS
937271,3/31/2023,RAISING THE LOWER AGE OF JUVENILE DELINQUENCY
937271,2/22/2023,INFORMATION SECURITY CRIMINAL JUSTICE TRAINING 2023
937271,9/18/2022,NYPD JOUVERT  WEST INDIAN DAY
937271,9/18/2022,THE EMPLOYEE ASSISTANCE UNIT (EAU) IS HERE FOR YOU
937271,7/8/2022,2022 EQUAL EMPLOYMENT OPPORTUNITY TRAINING-SEXUAL HARASSMENT AWARENESS AND PREVENTION
937271,7/8/2022,CONVICTED OFFENDER DNA DATABANK SPECIMEN COLLECTION KIT
937271,7/8/2022,"INTEGRATING COMMUNICATION, ASSESSMENT, AND TACTICS (ICAT) MODULE 7"
937271,7/8/2022,VEHICLE SEIZURE FORM
937271,6/20/2022,BEST PRACTICES IN STRUCTURED INTERVIEWING
937271,6/20/2022,CAR STOP TACTICS FOR PATROL OFFICERS - MODULE 1: CONTROLLING THE STOP
937271,6/20/2022,CAR STOP TACTICS FOR PATROL OFFICERS - MODULE 2: PROHIBITED MANEUVERS
937271,6/20/2022,CAR STOP TACTICS FOR PATROL OFFICERS - MODULE 3: THE UNKNOWN RISK STOP
937271,6/20/2022,CAR STOP TACTICS FOR PATROL OFFICERS - MODULE 4: THE HIGH-RISK STOP
937271,6/20/2022,"INTEGRATING COMMUNICATION, ASSESSMENT AND TACTICS (ICAT) MODULE 6"
937271,6/20/2022,NATIONAL INCIDENT-BASED REPORTING SYSTEM (NIBRS) UPDATES TO THE OMNIFORM COMPLAINT SYSTEMV
937271,5/26/2022,INTRODUCTION TO COGNOS 11
937271,5/26/2022,PROHIBITED METHODS OF RESTRAINT
937271,5/26/2022,VIPER CCTV TRAINING COURSE
937271,5/11/2022,"INTEGRATING COMMUNICATION, ASSESSMENT AND TACTICS (ICAT) MODULE 5"
937271,3/4/2022,"INTEGRATING COMMUNICATION, ASSESSMENT AND TACTICS (ICAT) MODULE 4"
937271,1/29/2022,ILLEGAL EVICTIONS
937271,1/13/2022,"INTEGRATING COMMUNICATION, ASSESSMENT AND TACTICS (ICAT) MODULE 3"
937271,1/6/2022,LOCAL LAW 45 OF 2021-TRAFFIC ENCOUNTERS
937271,12/16/2021,"INTEGRATING COMMUNICATION, ASSESSMENT AND TACTICS (ICAT) MODULE 2"
937271,12/9/2021,ACTIVE BYSTANDERSHIP FOR LAW ENFORCEMENT (ABLE): ONE DAY COURSE
937271,12/6/2021,"INTEGRATING COMMUNICATION, ASSESSMENT AND TACTICS (ICAT) MODULE 1"
937271,12/3/2021,IDENTIFYING THE IMPAIRED DRIVER
937271,11/22/2021,CLT-EQUAL EMPLOYMENT OPPORTUNITY
937271,11/22/2021,CLT-PROCEDURAL OPERATIONS
937271,10/31/2021,ARRESTS - RELIGIOUS HEAD COVERING GUIDELINES (PG 208-83)
937271,10/31/2021,BODY-WORN CAMERA REVIEW PART TWO
937271,9/20/2021,CLT-PROCEDURAL OPERATIONS
937271,9/19/2021,BODY-WORN CAMERA REVIEW PART ONE
937271,9/19/2021,INFORMATION SECURITY AWARENESS TRAINING 2021
937271,9/19/2021,OPIOID OVERDOSE RECOGNITION AND NARCAN ADMINISTRATION -2021
937271,9/14/2021,MAYOR EXECUTIVE ORDER 78 VACCINATION - TESTING COMPLIANCE POLICY
937271,5/29/2021,HEALTH AND WELLNESS SECTION - MODULE 18 - YOGA MYTH BUSTING
937271,5/29/2021,HEALTH AND WELLNESS SECTION - MODULE 19 - STOP SMOKING - NYC ESCAPE PROGRAM
937271,5/28/2021,OVERVIEW OF THE NEW DISCOVERY LAWS 2021 REFRESHER
937271,5/22/2021,CLT-DOCUMENTATION AND FORMS
937271,5/13/2021,HEALTH AND WELLNESS SECTION - MODULE 17 - FINANCIAL WILLS AND TRUSTS
937271,5/13/2021,PATROL GUIDE 215-17 POLICE ACTIONS RELATED QUESTIONING ARRESTS AND INVESTIGATIONS AT A NYC DEPARTMEN
937271,5/8/2021,CHILD SENSITIVE ARREST POLICY GUIDELINES AND PROCEDURES
937271,4/30/2021,HEALTH AND WELLNESS SECTION - MODULE 16 - GRIEF AND COPING
937271,4/28/2021,HEALTH AND WELLNESS SECTION - CHILD MIND INSTITUTE VIDEO SERIES - MODULE 3 - CHILDREN'S MENTAL HEALT
937271,4/28/2021,HEALTH AND WELLNESS SECTION - CHILD MIND INSTITUTE VIDEO SERIES - MODULE 4 - RAISING SELF SUFFICIENT
937271,4/28/2021,HEALTH AND WELLNESS SECTION - MODULE 15 - FINANCIAL WELLNESS PART 2
937271,4/24/2021,"AXON BODY-WORN CAMERA TRAINING - CAMERA OPERATION, AXON VIEW AND EVIDENCE.COM (REQUIRED FOR LE4 COMM"
937271,4/24/2021,EQUAL EMPLOYMENT OPPORTUNITY TRAINING - LGBTQIA+ DIVERSITY AND INCLUSION / EXECUTIVE ORDER 16 OF 201
937271,4/24/2021,HEALTH AND WELLNESS SECTION - CHILD MIND INSTITUTE VIDEO SERIES - MODULE 2 - WHEN TO WORRY ABOUT YOU
937271,4/23/2021,EMPLOYEE ASSISTANCE UNIT-2021
937271,4/23/2021,HEALTH AND WELLNESS SECTION - CHILD MIND INSTITUTE VIDEO SERIES - MODULE 1 - BEHAVIOR MANAGEMENT STR
937271,4/14/2021,BALLISTIC VEST MEASUREMENT PROGRAM
937271,3/15/2021,DESK APPEARANCE TICKETS: THE NEW LAW AND THE NEW GUIDELINES FOR PROCESSING DAT'S - 2021 REFRESHER
937271,3/4/2021,EEO MANDATORY POSTER DISTRIBUTION
937271,1/24/2021,COVID VACCINE DISTRIBUTION AND EDUCATION
937271,12/15/2020,EQUAL EMPLOYMENT OPPORTUNITY TRAINING - LEAVE TO EXPRESS BREAST MILK
937271,11/11/2020,HEALTH AND WELLNESS SECTION - FINANCIAL LITERACY SERIES - MODULE 1 - YOUR MONEY VALUES AND INFLUENCE
937271,11/11/2020,HEALTH AND WELLNESS SECTION - FINANCIAL LITERACY SERIES - MODULE 2 - YOUR INCOME AND EXPENSES
937271,11/11/2020,HEALTH AND WELLNESS SECTION - FINANCIAL LITERACY SERIES - MODULE 3 - YOUR SPENDING AND SAVINGS PLAN
937271,11/11/2020,HEALTH AND WELLNESS SECTION - FINANCIAL LITERACY SERIES - MODULE 4 - MANAGING DEBT
937271,11/11/2020,HEALTH AND WELLNESS SECTION - MODULE 13 - MINDFULNESS
937271,11/11/2020,HEALTH AND WELLNESS SECTION - MODULE 14 - FINANCIAL WELLNESS PART 1
937271,11/11/2020,VICTIM BLAMING AND RELEASE OF INFORMATION TO THE MEDIA
937271,7/5/2020,"EQUAL EMPLOYMENT OPPORTUNITY TRAINING - SEXUAL HARASSMENT, AWARENESS AND PREVENTION"
937271,7/3/2020,NEW LAWS AFFECTING POLICE OFFICERS’ CRIMINAL AND CIVIL LIABILITY
937271,6/20/2020,HEALTH AND WELLNESS SECTION - MODULE 12 - IN THAT DARK PLACE - AN OFFICER'S JOURNEY
937271,5/22/2020,COVID-19: PREPAREDNESS YOUR FAMILY AND HOME
937271,5/22/2020,HEALTH AND WELLNESS SECTION - MODULE 1 - PSYCHOLOGICAL HEALTH AND WELLNESS
937271,5/22/2020,HEALTH AND WELLNESS SECTION - MODULE 10 - SEEKING AND RECEIVING MENTAL HEALTH SUPPORT
937271,5/22/2020,HEALTH AND WELLNESS SECTION - MODULE 11 - HEALTH AND RESILIENCY
937271,5/22/2020,HEALTH AND WELLNESS SECTION - MODULE 2 - JOB COUNSELING AND STRESS
937271,5/22/2020,HEALTH AND WELLNESS SECTION - MODULE 3 - WARNING SIGNS
937271,5/22/2020,HEALTH AND WELLNESS SECTION - MODULE 4 - CUMULATIVE TRAUMA
937271,5/22/2020,HEALTH AND WELLNESS SECTION - MODULE 5 - GAINING PERSPECTIVE
937271,5/22/2020,HEALTH AND WELLNESS SECTION - MODULE 6 - COPING WITH SIGNS OF ANXIETY DEPRESSION
937271,5/22/2020,HEALTH AND WELLNESS SECTION - MODULE 7 - LEADING WITH COMPASSION
937271,5/22/2020,"HEALTH AND WELLNESS SECTION - MODULE 8 - WARNING SIGNS, SUPPORT AND OUTREACH"
937271,5/22/2020,HEALTH AND WELLNESS SECTION - MODULE 9 - MANAGING STRESS ON THE JOB
937271,5/15/2020,COVID-19: PREPAREDENESS
937271,5/15/2020,COVID-19: PROTECTIVE MASKS
937271,5/1/2020,SAFETY CONSIDERATIONS FOR PATROLLING THE NYC SUBWAY SYSTEM -DANGERS OF THE PLATFORM EDGE
937271,4/18/2020,AXON CASES 2.0
937271,4/18/2020,AXON TRAINING - MODULE 1 AXON BODY 2 BASIC OPERATION
937271,4/17/2020,UTILIZING BALLISTIC PROTECTION IN DEPARTMENT VEHICLES (4:09)
937271,2/14/2020,CRIMINAL JUSTICE BUREAU - GIGLIO MATERIAL DISCLOSURES UNDER THE NEW DISCOVERY LAWS
937271,1/5/2020,CROSSFIRE MITIGATION DURING CLOSE COMBAT INCIDENTS - PART 2
937271,1/3/2020,PROCESSING DISCOVERY MATERIAL IN THE FORMS ARREST FOLDER
937271,12/27/2019,SAFEGUARDING HOSPITALIZED PRISONERS
937271,12/7/2019,CROSSFIRE MITIGATION DURING CLOSE COMBAT INCIDENTS
937271,12/1/2019,CJB - DESK APPEARANCE TICKETS: THE NEW LAWS AND GUIDELINES FOR PROCESSING DATS
937271,12/1/2019,CJB - OVERVIEW OF THE NEW DISCOVERY LAWS
937271,12/1/2019,RESPONDING TO COMMERCIAL ROBBERIES PART LL - MODULE 1 AND MODULE 2
937271,11/22/2019,ACTIVITY LOG FOR IPHONE
937271,11/21/2019,CLT-PROCEDURAL OPERATIONS
937271,11/15/2019,CLT-PROCEDURAL OPERATIONS
937271,11/15/2019,DISCHARGING YOUR FIREARM AT A MOVING THREAT
937271,11/10/2019,INCREASE OFFICER SAFETY DURING VEHICLE STOPS
937271,11/9/2019,CLT-OCCUPATIONAL-WORKPLACE SAFETY AND HEALTH
937271,11/4/2019,CLT-LEGAL ISSUES
937271,11/1/2019,CLT-LEGAL ISSUES
937271,10/28/2019,SUCCESSFULLY DISARMING AN EMOTIONALLY DISTURBED PERSON
937271,10/21/2019,EXECUTIVE HEALTH AND WELLNESS TRAINING - MODULE 7
937271,10/21/2019,EXECUTIVE HEALTH AND WELLNESS TRAINING - MODULE 8
937271,10/21/2019,EXECUTIVE HEALTH AND WELLNESS TRAINING - MODULE 9
937271,10/19/2019,EXECUTIVE HEALTH AND WELLNESS TRAINING - MODULE 10
937271,10/19/2019,EXECUTIVE HEALTH AND WELLNESS TRAINING - MODULE 3
937271,10/19/2019,EXECUTIVE HEALTH AND WELLNESS TRAINING - MODULE 4
937271,10/19/2019,EXECUTIVE HEALTH AND WELLNESS TRAINING - MODULE 5
937271,10/19/2019,EXECUTIVE HEALTH AND WELLNESS TRAINING - MODULE 6
937271,10/18/2019,CRIMINAL JUSTICE BUREAU - DNA TRAINING VIDEO
937271,10/18/2019,CRITICAL DECISION MAKING MODEL
937271,10/18/2019,EXECUTIVE HEALTH AND WELLNESS CONFERENCE - MODULE 1
937271,10/18/2019,EXECUTIVE HEALTH AND WELLNESS TRAINING - MODULE 2
937271,10/18/2019,FORCE POLICY UPDATE VIDEO
937271,10/18/2019,MARIJUANA POLICY UPDATE
937271,10/18/2019,PRISONER ESCAPE WARNING SIGNS
937271,9/6/2019,CLT-OCCUPATIONAL-WORKPLACE SAFETY AND HEALTH
937271,9/6/2019,DOMESTIC VIOLENCE EDUCATION AND COUNSELING
937271,9/6/2019,SHIELD OF RESILIENCE TRAINING COURSE
937271,8/10/2019,INFORMATION SECURITY AWERENESS TRAINING 2019
937271,8/6/2019,CRITICAL INCIDENT TACTICS - RESPONDING TO COMMERCIAL ROBBERIES (EXTENDED VERSION)
937271,8/6/2019,RESPONDING TO COMMERCIAL ROBBERIES
937271,7/6/2019,TRANSIT BUREAU - SAFETY CONSIDERATIONS FOR PATROLLING THE NYC SUBWAY SYSTEM - PART 2
937271,7/3/2019,TRANSIT BUREAU - SAFETY CONSIDERATIONS FOR PATROLLING THE NYC SUBWAY SYSTEM
937271,6/27/2019,CLT-OCCUPATIONAL-WORKPLACE SAFETY AND HEALTH
937271,6/25/2019,RESPONDING TO PEOPLE IN CRISIS – MODULE 4: USING DEPARTMENT MOBILE DIGITAL DEVICES
937271,6/24/2019,DISCUSSION - BASED LEARNING MODULE # 1-3
937271,6/23/2019,WORLDPRIDE NYC 2019
937271,5/26/2019,COLLABORATIVE POLICING - MEDIATION REFERRAL PROGRAM FOR NON-CRIMINAL COMPLAINTS
937271,4/28/2019,COUNTERTERRORISM BUREAU ACTIVE SHOOTER SCHOOL INCIDENTS AWARENESS
937271,4/28/2019,COUNTERTERRORISM BUREAU NH15 TRAINING
937271,4/28/2019,RESPONDING TO PEOPLE IN CRISIS - MODULES 2 AND 3: ACTIVE LISTENING PARTS 1 AND 2
937271,4/16/2019,COLLABORATIVE POLICING - THE DEAF AND HARD OF HEARING COMMUNITY
937271,4/3/2019,LEGAL BUREAU - PERJURY TRAINING MODULE
937271,3/24/2019,FACILITIES MANAGEMENT DIVISION - MUNICIPAL SEPERATE STORM SEWER SYSTEM (MS4)
937271,3/23/2019,SAFEGUARDING PRISONERS - OFFICER SAFETY GUIDELINES
937271,3/12/2019,CLT-TACTICAL AWARENESS AND OFFICER SAFETY
937271,3/6/2019,CLT-TACTICAL AWARENESS AND OFFICER SAFETY
937271,3/3/2019,COLLABORATIVE POLICING - ELDER ABUSE
937271,2/3/2019,"SUPPORT SERVICES DIVISION - CLASS ""C"" OPERATOR"
937271,1/31/2019,PATROL DOOR BAG - ROPE AND WEDGE INTRODUCTION
937271,1/19/2019,CPS BODY-WORN CAMERA TRAINING WITH SCENARIOS
937271,1/15/2019,"EXECUTIVE CONFERENCE VIDEO 10-17-18: DISCUSSION WITH INDRA NOOYI, CHAIRMAN OF PEPSI CO"
937271,1/15/2019,"EXECUTIVE CONFERENCE VIDEO 10-17-18: INTELLIGENT LEADERSHIP: GEORGE TENET, FORMER (DIRECTOR OF CENTR"
937271,1/15/2019,EXECUTIVE CONFERENCE VIDEO 10-17-18: LEADERSHIP ON AND OFF THE BATTLEFIELD: GENERAL JOHN R. ALLEN (P
937271,1/15/2019,EXECUTIVE CONFERENCE VIDEO 10-17-18: MAKING IT REAL-GETTING FROM HERE TO THERE TOGETHER - DR SCOTT L
937271,1/13/2019,RESPONDING TO PEOPLE IN CRISIS - MODULE 1: SENDING THE RIGHT SIGNALS
937271,1/8/2019,CLT-COUNTERTERRORISM AND INTELLIGENCE
937271,1/8/2019,TEXT TO 911 - INTRODUCTION
937271,1/3/2019,CPS FAIR AND IMPARTIAL POLICING - ALL POS AND DETS
937271,1/2/2019,2017-2019 IN-SERVICE CYCLE-INTEGRATED TACTICS
937271,12/30/2018,CITYTIME USER TRAINING FOR NON-MANAGERIAL CMOS
937271,12/23/2018,CITYTIME APPROVER TRAINING FOR SUPERVISORS APPROVING CMOS TIMESHEETS
937271,12/20/2018,EQUAL EMPLOYMENT OPPORTUNITYTRAINING - SEXUAL HARASSMENT AWARENESS AND PREVENTION
937271,12/17/2018,VERTEX 949 RADIO OPERATIONAL INSTRUCTIONS
937271,12/12/2018,CLT-OCCUPATIONAL-WORKPLACE SAFETY AND HEALTH
937271,12/10/2018,CITYTIME USER TRAINING FOR MANAGERIAL CIVIL SERVICE TITLES
937271,12/6/2018,2017-2019 IN-SERVICE CYCLE-INVESTIGATIVE ENCOUNTERS- BASIC TRAINING WITH SCENARIOS
937271,12/4/2018,CLT-COMMUNICATION STRATEGIES AND AIDS
937271,12/2/2018,MARIJUANA BURNING ENFORCEMENT POLICY
937271,11/4/2018,AMERICANS WITH DISABILITIES ACT (ADA)
937271,10/23/2018,TRANSIT BUREAU - TIMELY RESUMPTION OF SERVICE IN NYC TRANSIT
937271,10/18/2018,CLT-OCCUPATIONAL-WORKPLACE SAFETY AND HEALTH
937271,10/15/2018,RESPONDING TO PEOPLE IN CRISIS-INTRODUCTION TO CIT VIDEO SERIES
937271,10/4/2018,AIM COMPONENTS 2.0
937271,10/4/2018,AIM REGISTRATION AND SYNCHRONIZATION 2.0
937271,10/4/2018,CLT-LEGAL ISSUES
937271,9/26/2018,NYC RIGHT TO KNOW ACT LEGISLATION - PART 2
937271,9/25/2018,"CLT-INTEGRITY, ETHICS AND DISCIPLINE"
937271,9/23/2018,NYC RIGHT TO KNOW ACT LEGISLATION – PART 1
937271,9/20/2018,CLT-PROCEDURAL OPERATIONS
937271,9/10/2018,RAISE THE AGE
937271,8/23/2018,CLT-PROCEDURAL OPERATIONS
937271,8/22/2018,CLT-INFORMATION TECHNOLOGY
937271,8/21/2018,CLT-COUNTERTERRORISM AND INTELLIGENCE
937271,7/24/2018,DETECTIVE BUREAU RETRIEVING BODY WORN CAMERA DATA
937271,6/25/2018,CLT-LEGAL ISSUES
937271,6/21/2018,AIM COMPONENTS
937271,6/21/2018,REGISTRATION OF AIM
937271,6/15/2018,CLT-INVESTIGATIONS
937271,6/11/2018,CLT-PROCEDURAL OPERATIONS
937271,6/8/2018,CLT-TACTICAL AWARENESS AND OFFICER SAFETY
937271,6/5/2018,CLT-ENFORCEMENT ACTIONS
937271,5/17/2018,CLT-OCCUPATIONAL-WORKPLACE SAFETY AND HEALTH
937271,5/17/2018,CLT-SPECIAL POPULATIONS
937271,5/16/2018,CLT-INFORMATION TECHNOLOGY
937271,5/10/2018,CLT-ENFORCEMENT ACTIONS
937271,5/10/2018,CLT-PROCEDURAL OPERATIONS
937271,5/3/2018,CLT-LEGAL ISSUES
937271,5/2/2018,CLT-INFORMATION TECHNOLOGY
937271,5/2/2018,CLT-LEGAL ISSUES
937271,4/30/2018,COMMUNICATIONS- THE PROPER USAGE OF THE IDA RADIO CODES
937271,4/19/2018,CLT-COUNTERTERRORISM AND INTELLIGENCE
937271,4/18/2018,1PP IPHONE TRAINING AND DISTRIBUTION
937271,4/18/2018,CLT-TACTICAL AWARENESS AND OFFICER SAFETY
937271,4/2/2018,COLLABORATIVE POLICING- HUMAN TRAFFICKING
937271,3/29/2018,FORMS MEDICAL TREATMENT OF PRISONER TRAINING
937271,2/18/2018,LEGAL BUREAU PERFORMANCE METRICS - PROHIBITED CONDUCT
937271,2/14/2018,"COUNTERTERRORISM BUREAU FACILITY AWARENESS- THE INTREPID SEA, AIR AND SPACE MUSEUM"
937271,1/21/2018,COLLABORATIVE POLICING- FOREIGN LANGUAGE CERTIFICATION VIDEO
937271,1/21/2018,COUNTERTERRORISM BUREAU INITIAL PATROL RESPONSE FOR ACTIVE SHOOTER
937271,1/21/2018,IPHONE AND DAS MOBILE OPERATION
937271,1/21/2018,NEW YEAR'S EVE TACTICAL AWARENESS
937271,1/21/2018,POLICE COMMISSIONER MESSAGE- NYC GIVES
937271,11/10/2017,COUNTER TERRORISM INITIAL PATROL RESPONSE TO AN ACTIVE SHOOTER
937271,10/25/2017,COBALT
937271,10/25/2017,CRIME CONTROL STRATEGIES- COMMUNITY SUPERVISION
937271,10/25/2017,DAS MESSAGING
937271,10/25/2017,DAS OVERLAPPING LAYERS TUTORIAL
937271,10/25/2017,DAS PATTERN MODE
937271,10/25/2017,DOMAIN AWARENESS SYSTEM - SEARCH ACCURINT RESULTS
937271,10/25/2017,DOMAIN AWARNESS SYSTEM (DAS)
937271,10/25/2017,FAQ: HOW TO SYNC YOUR DEPARTMENT SMARTPHONE
937271,10/25/2017,FORMS - AIDED AND MV104 (POLICE ACCIDENT REPORT)
937271,10/25/2017,"FORMS - THREAT,RESISTANCE,INJURY (TRI)"
937271,10/25/2017,HOW TO ENTER DOMESTIC INCIDENT REPORTS IN TO FORMS
937271,10/25/2017,INFORMATION SECURITY AWARENESS TRAINING
937271,10/25/2017,INVESTIGATIVE ENCOUNTERS-VIDEO #1 REQUEST FOR INFO-UNIT TRAINING FEB 2016
937271,10/25/2017,LOCATING APPLE DEVICES USING YOUR DEPARTMENT SMARTPHONE
937271,10/25/2017,MOBILE IDENTIFICATION DEVICE (MORPHO)
937271,10/25/2017,NEW NYPD PORTAL
937271,10/25/2017,NYPD MOBILITY INITIATIVE - DEPARTMENT SMARTPHONE TRAINING
937271,10/25/2017,SEND TO DESKTOP
937271,10/25/2017,STOP REPORT
937271,10/25/2017,TACTICAL AWARENESS- BALLISTIC VEST
937271,10/25/2017,TRAINING MATERIALS- CLOSING THE GAP ON VEHICLE INTELLIGENCE
937271,10/25/2017,TRAINING MATERIALS- PAWNSHOP AND 2ND HAND DEALER DATABASE
937271,10/25/2017,TRAINING MATERIALS- THE RECIDIVIST TRACKING AND REPORTING DATABASE (RTRD)
937271,10/25/2017,TRAINING MATERIALS- VIRTUAL CRIME INFORMATION CENTER
937271,10/25/2017,WARRANT CHECK IN DOMAIN AWARENESS SYSTEM (DAS LITE)
937271,10/12/2017,BELT TRAUMA KIT VIDEO
937271,10/12/2017,COLLABORATIVE POLICING- POLICING IN TODAY’S MULTI-FAITH NY
937271,10/12/2017,FORMS SUMMONS
937271,10/12/2017,NARCAN NASAL SPRAY TRAINING
937271,10/12/2017,TACTICAL AWARENESS OF EXCITED DELIRIUM SYNDROME
937271,10/4/2017,INVESTIGATIVE ENCOUNTERS-VIDEO #2 COMMON LAW RIGHT OF INQUIRY-UNIT TRAINING MAY 2016
937271,10/4/2017,NEW PERFORMANCE EVALUATION PROCESS
937271,10/3/2017,COUNTERTERRORISM ACTIVE SHOOTER TRAINING
937271,10/3/2017,COUNTERTERRORISM U.A.S. (UNMANNED AIRCRAFT SYSTEMS) DRONE AWARENESS
937271,10/3/2017,INVESTIGATIVE ENCOUNTERS-VIDEO #3 TERRY STOPS AND REASONABLE SUSPICION-UNIT TRAINING JUNE 2016
937271,10/3/2017,TACTICAL AWARENESS-SMARTPHONE SAFETY
937271,9/26/2017,COLLABORATIVE POLICING- ACCESSING TELEPHONIC INTERPRETERS VIA LANGUAGE LINE
937271,9/25/2017,PATROL- POLYCARBONATE SHIELD
937271,8/10/2017,COUNTERTERRORISM BUREAU FACILITY AWARENESS VIDEO- TIME WARNER BUILDING
937271,8/10/2017,COUNTERTERRORISM BUREAU FACILITY AWARENESS VIDEO-EMPIRE STATE BUILDING
937271,8/10/2017,FORCE POLICY REVISION-VIDEO-PG 221-UNIT TRAINING MAY 2016
937271,8/10/2017,INVESTIGATIVE ENCOUNTERS-VIDEO #4 DOCUMENTATION AND SUPERVISION-UNIT TRAINING JULY 2016
937271,8/10/2017,PUBLIC CONTACT AND CONSENT TO SEARCH (RIGHT TO KNOW) - UNIT TRAINING AUGUST 2016
937271,7/27/2017,PERSONNEL BUREAU NYPD EMPLOYEE ASSISTANCE UNIT (EAU)
937271,7/27/2017,POLICE COMMISSIONERS MESSAGE - VICTIMS OF SEXUAL ASSAULT VIDEO
937271,6/18/2017,"CPS INTERIOR PATROL OF HOUSING AUTHORITY BUILDINGS, PG 212-60 ROLL CALL VIDEO 1"
937271,6/18/2017,"CPS INTERIOR PATROL OF HOUSING AUTHORITY BUILDINGS, PG 212-60 ROLL CALL VIDEO 2"
937271,6/18/2017,CPS INTERIOR PATROL TRESPASS AFFIDAVIT PROGRAM (TAP) VIDEO 2
937271,6/6/2017,CPS INTERIOR PATROL TRESPASS AFFIDAVIT PROGRAM (TAP) VIDEO 1
937271,5/21/2017,CRIMINAL JUSTICE REFORM ACT ROLL CALL TRAINING PART 1
937271,5/21/2017,CRIMINAL JUSTICE REFORM ACT ROLL CALL TRAINING PART 2
937271,5/12/2017,EQUAL EMPLOYMENT OPPORTUNITY TRANSGENDER DIVERSITY AND INCLUSION:EXECUTIVE ORDER 16
937271,2/3/2017,2016-17 INSERVICE CYCLE-PHYSICAL TACTICS
937271,12/8/2016,HATE CRIMES AND BIAS-RELATED INCIDENTS
937271,12/6/2016,HATE CRIMES AND BIAS-RELATED INCIDENTS
937271,9/22/2016,PUBLIC CONTACT AND CONSENT TO SEARCH (RIGHT TO KNOW) - UNIT TRAINING AUGUST 2016
937271,8/9/2016,EQUAL EMPLOYMENT OPPORTUNITY IN-SERVICE TRAINING
937271,8/9/2016,PERFORMANCE ENHANCEMENT TRAINING
937271,7/3/2016,INVESTIGATIVE ENCOUNTERS-VIDEO #4 DOCUMENTATION AND SUPERVISION-UNIT TRAINING JULY 2016
937271,6/30/2016,INVESTIGATIVE ENCOUNTERS-VIDEO #4 DOCUMENTATION AND SUPERVISION-UNIT TRAINING JULY 2016
937271,6/10/2016,INVESTIGATIVE ENCOUNTERS-VIDEO #3 TERRY STOPS AND REASONABLE SUSPICION-UNIT TRAINING JUNE 2016
937271,6/9/2016,FORCE POLICY REVISION-VIDEO-PG 221-UNIT TRAINING MAY 2016
937271,5/25/2016,INVESTIGATIVE ENCOUNTERS-VIDEO #2 COMMON LAW RIGHT OF INQUIRY-UNIT TRAINING MAY 2016
937271,5/11/2016,INVESTIGATIVE ENCOUNTERS-VIDEO #2 COMMON LAW RIGHT OF INQUIRY-UNIT TRAINING MAY 2016
937271,2/19/2016,WINDOWS PHONE TRAINING AND DISTRIBUTION
937271,2/17/2016,BTK (BELT TRAUMA KIT DISTRIBUTION AND FAMILIARIZATION)
937271,2/9/2016,INVESTIGATIVE ENCOUNTERS-VIDEO #1 REQUEST FOR INFO-UNIT TRAINING FEB 2016
937271,12/15/2015,FORCE POLICY REVISION-PAMPHLET - PG 221 - UNIT TRAINING DECEMBER 2015
937271,11/9/2015,EMERGENCY VEHICLE OPERATION JULY 03 - JUNE 07
937271,11/9/2015,FIELD TRAINING PROGRAM JULY 03 - JUNE 07
937271,11/9/2015,PHYSICAL EDUCATION PART 1: FOUNDATIONS OF PHYSICAL FITNESS
937271,11/9/2015,PHYSICAL EDUCATION PART 2: DEFENSIVE TACTICS
937271,11/9/2015,PHYSICAL EDUCATION PART 3: AMERICAN HEART ASSOCIATION BASIC LIFE SUPPORT
937271,11/9/2015,POLICE CRISIS INTERVENTION JULY 03 - JUNE 07
937271,11/9/2015,POLICE FIELD PROBLEMS JULY 03 - JUNE 07
937271,11/9/2015,POLICE INVESTIGATION AND REPORTING JULY 03 - JUNE 07
937271,11/9/2015,POLICING A DEMOCRACY JULY 03 - JUNE 07
937271,11/9/2015,POLICING SPECIAL POPULATIONS JULY 03 - JUNE 07
937271,11/9/2015,PROCEDURAL LAW JULY 03 - JUNE 07
937271,11/9/2015,SUBSTANTIVE LAW JULY 03 - JUNE 07
937271,11/9/2015,TERRORISM AWARENESS AND RESPONSE JULY 03 - JUNE 07
937271,5/4/2015,20K TRAINING INITIATIVE - PHYSICAL TACTICS
937271,4/23/2015,20K TRAINING INITIATIVE - SMART POLICING
937271,4/15/2015,20K TRAINING INITIATIVE - FOUNDATIONS OF POLICING
937271,12/6/2011,PROPERTY EVIDENCE TRACKING SYSTEM
937271,12/6/2010,BEHAVIORAL OBSERVATION AND SUSPICIOUS ACTIVITY RECOGNITION COURSE
937271,2/17/2010,HOSTILE SURVEILLANCE DETECTION
937271,5/13/2008,PLAIN CLOTHES TRAINING CERTIFIED BASIC PLAIN-CLOTHES COURSE
937271,7/19/2005,COBRA - COHORT TRAINING
937271,1/10/2005,12 PASSENGER VAN / UTILITY VEHICLE QUALIFICATION
937271,,RECRUIT 12 PASSENGER VAN / UTILITY VEHICLE QUALIFICATION
937271,,RECRUIT RMP QUALIFICATION / RMP OPERATOR QUALIFIED
963024,7/7/2025,SAFEGUARDING HOSPITALIZED PRISONERS
963024,7/6/2025,SPECIAL VICTIMS UNIT - BEST PRACTICES GUIDE TRAINING
963024,6/15/2025,2025 BWC PROFICIENCY TRAINING
963024,6/15/2025,EAU 2025 POLICE COMMISSIONER JESSICA S. TISCH
963024,5/25/2025,2025 EQUAL EMPLOYMENT OPPORTUNITY TRAINING - SEXUAL HARASSMENT AWARENESS AND PREVENTION
963024,5/25/2025,SQF REVIEW AND DOCUMENTATION: SQF MODULE 10
963024,5/2/2025,CLT-ENFORCEMENT ACTIONS
963024,4/24/2025,FTS - TASER 7 ANNUAL RECERTIFICATION
963024,4/3/2025,CLT-DOMESTIC VIOLENCE TRAINING
963024,1/23/2025,RIGHT TO KNOW ACT SQF MODULE 9
963024,1/23/2025,VEHICLE PURSUITS
963024,1/16/2025,2025 IDENTIFYING THE IMPAIRED DRIVER REFRESHER
963024,1/16/2025,ACTIVE SHOOTER - SCHOOL RESPONSE PROTOCOL
963024,1/15/2025,KEVIN AND AVONTE SAFE HOME PROGRAM
963024,12/22/2024,CELL BLOCK FIRESHIELD EV BLANKETS
963024,12/22/2024,MULTI-FACTOR AUTHENTICATION MFA TRAINING
963024,12/15/2024,INFORMATION SECURITY AWARENESS TRAINING 2024
963024,12/5/2024,NOTIFICATION OF ALLEGATIONS AND EMPLOYEE RIGHTS
963024,12/3/2024,CLT-DOMESTIC VIOLENCE TRAINING
963024,12/3/2024,CLT-EJUSTICE ORDER OF PROTECTION SEARCH
963024,11/25/2024,BEHAVIORAL HEALTH EMERGENCY ASSISTANCE RESPONSE DIVISION B-HEARD
963024,11/21/2024,DRIVING WHILE INTOXICATED AWARENESS VIDEO MODULE 1
963024,11/17/2024,LEAVING THE SCENE COLLISIONS INVESTIGATIVE BEST PRACTICES
963024,10/9/2024,CLT-PROCEDURAL OPERATIONS
963024,10/3/2024,CLT-PROCEDURAL OPERATIONS
963024,10/3/2024,FAMILY BUILDING
963024,10/3/2024,NORTHWELL DIRECT FINEST CARE PROGRAM FOR UMOS
963024,9/26/2024,CLT-PROCEDURAL OPERATIONS
963024,9/3/2024,CLT-DOMESTIC VIOLENCE TRAINING
963024,8/29/2024,SELF-DEFENSE AND GRAPPLING TACTICS TRAINING COURSE
963024,8/25/2024,RACIAL PROFILING AND BIASED BASED POLICING: SQF MODULE 8
963024,8/25/2024,RAPE IS RAPE
963024,8/13/2024,UNMANNED AIRCRAFT SYSTEMS VISUAL OBSERVER
963024,8/4/2024,CLT-DOMESTIC VIOLENCE TRAINING
963024,7/31/2024,APX NEXT PORTABLE AND RADIO DISCIPLINE TRAINING VIDEO
963024,7/11/2024,MENTAL HEALTH INVOLUNTARY REMOVALS MHL 9.41 AND MHL 9.58
963024,7/2/2024,CLT-DOMESTIC VIOLENCE TRAINING
963024,6/23/2024,LEVEL 1 AND LEVEL 2 INVESTIGATIVE ENCOUNTERS
963024,6/9/2024,TACTICS WHEN ENGAGING INDIVIDUALS IN A MENTAL HEALTH CRISIS
963024,5/22/2024,ACCURATE COMPLAINT REPORT CLASSIFICATION
963024,5/16/2024,FTS - CEW TASER 7 TRANSITION COURSE
