taxid,date,name
965167,7/26/2018,CLT-OCCUPATIONAL-WORKPLACE SAFETY AND HEALTH
965167,7/26/2018,CLT-SPECIAL POPULATIONS
965167,7/24/2018,CLT-TACTICAL AWARENESS AND OFFICER SAFETY
965167,7/21/2018,CLT-INFORMATION TECHNOLOGY
965167,7/20/2018,2017-2019 IN-SERVICE CYCLE-INTEGRATED TACTICS
965167,7/19/2018,CLT-INFORMATION TECHNOLOGY
965167,7/18/2018,CLT-INFORMATION TECHNOLOGY
965167,7/14/2018,COLLABORATIVE POLICING- ACCESSING TELEPHONIC INTERPRETERS VIA LANGUAGE LINE
965167,7/14/2018,"CPS INTERIOR PATROL OF HOUSING AUTHORITY BUILDINGS, PG 212-60 ROLL CALL VIDEO 2"
965167,7/14/2018,CPS INTERIOR PATROL TRESPASS AFFIDAVIT PROGRAM (TAP) VIDEO 1
965167,7/14/2018,CPS INTERIOR PATROL TRESPASS AFFIDAVIT PROGRAM (TAP) VIDEO 2
965167,7/14/2018,CRIMINAL JUSTICE REFORM ACT ROLL CALL TRAINING PART 2
965167,7/14/2018,NARCAN NASAL SPRAY TRAINING
965167,7/14/2018,POLICE COMMISSIONERS MESSAGE - VICTIMS OF SEXUAL ASSAULT VIDEO
965167,7/13/2018,COLLABORATIVE POLICING- FOREIGN LANGUAGE CERTIFICATION VIDEO
965167,7/13/2018,"CPS INTERIOR PATROL OF HOUSING AUTHORITY BUILDINGS, PG 212-60 ROLL CALL VIDEO 1"
965167,7/13/2018,CRIMINAL JUSTICE REFORM ACT ROLL CALL TRAINING PART 1
965167,7/13/2018,EQUAL EMPLOYMENT OPPORTUNITY TRANSGENDER DIVERSITY AND INCLUSION:EXECUTIVE ORDER 16
965167,7/13/2018,PATROL- POLYCARBONATE SHIELD
965167,7/13/2018,PERSONNEL BUREAU NYPD EMPLOYEE ASSISTANCE UNIT (EAU)
965167,7/13/2018,TACTICAL AWARENESS-SMARTPHONE SAFETY
965167,7/12/2018,"CLT-INTEGRITY, ETHICS AND DISCIPLINE"
965167,7/10/2018,CLT-ENFORCEMENT ACTIONS
965167,7/6/2018,CLT-OCCUPATIONAL-WORKPLACE SAFETY AND HEALTH
965167,7/2/2018,BTK (BELT TRAUMA KIT DISTRIBUTION AND FAMILIARIZATION)
965167,6/25/2018,POLICE ACADEMY RECRUIT 3RD TRIMESTER EXAM
965167,6/7/2018,HIGHWAY DRUG IMPAIRED DRIVING COURSE
965167,6/7/2018,HIGHWAY PRELIMINARY BREATH TEST INSTRUMENT TRAINING - PBT
965167,5/29/2018,PTTD WATER SAFETY
965167,5/25/2018,COMMUNICATIONS- THE PROPER USAGE OF THE IDA RADIO CODES
965167,5/7/2018,PTTD DEFENSIVE TACTICS PRACTICAL EXAM
965167,5/7/2018,VEHICLE STOP SOLUTIONS MODULE
965167,5/3/2018,GROUND TACTICS
965167,5/1/2018,RECRUIT RAPID DEPLOYMENT-ACTIVE SHOOTER
965167,4/30/2018,POLICE ACADEMY RECRUIT 2ND TRIMESTER EXAM
965167,4/27/2018,POLICE ACADEMY RECRUIT JUSTIFICATION WRITTEN EXAM
965167,4/24/2018,RECRUIT RAPID DEPLOYMENT-ACTIVE SHOOTER
965167,4/13/2018,PTTD WEAPONS DEFENSE
965167,4/6/2018,PTTD EXPANDABLE BATON
965167,4/5/2018,FIREARMS 5 DAY TACTICAL APPLICATION V2
965167,4/4/2018,(PQC OFF DUTY PISTOL) RECRUIT TACTICAL FIREARMS REQUALIFICATION
965167,3/28/2018,BATON
965167,3/27/2018,P.A. RECRUIT NCIC/III EXAM
965167,3/27/2018,P.A. RECRUIT NYPD COMPUTER USE POLICY AND MONITORING NOTICE
965167,3/27/2018,RECRUIT TRAINING COMPUTER COURSE
965167,3/19/2018,JOB STANDARDS TEST ATTEMPT #2
965167,3/14/2018,RECRUIT TACTICAL FIREARMS QUALIFICATION AND TRAINING OFF DUTY PISTOL CERTIFIED
965167,3/9/2018,FTS - CEW END USER CERTIFICATION
965167,3/8/2018,FRISKING AND HANDCUFFING
965167,3/5/2018,POLICE ACADEMY RECRUIT 1ST TRIMESTER EXAM
965167,3/2/2018,POLICE ACADEMY RECRUIT STOP QUESTION & FRISK WRITTEN EXAM
965167,3/1/2018,FIRST AID WRITEN EXAM
965167,2/27/2018,RECRUIT BASIC FIREARMS QUALIFICATION AND TRAINING
965167,2/26/2018,POLICE ACADEMY RECRUIT 1ST TRIMESTER PRACTICE WRITTEN EXAM
965167,2/20/2018,PTTD CPR PRACTICAL EXAM
965167,2/19/2018,LAW- SEARCH AND SEIZURE QUIZ
965167,2/19/2018,LEGAL BUREAU PERFORMANCE METRICS - PROHIBITED CONDUCT
965167,2/19/2018,SOCIAL SCIENCE- POLICING A MULTICULTURAL SOCIETY QUIZ
965167,2/16/2018,PTTD DEFENSIVE TACTICS PRACTICAL EXAM
965167,2/5/2018,POLICE SCIENCE- GENERAL REGULATIONS QUIZ
965167,1/22/2018,EQUAL EMPLOYMENT OPPORTUNITY FOR NEW HIRES
965167,1/16/2018,POLICE ACADEMY RECRUIT PREREADING EXAM
965167,11/9/2015,EMERGENCY VEHICLE OPERATION JULY 07 - PRESENT
965167,11/9/2015,FIELD TRAINING PROGRAM JULY 07 - PRESENT
965167,11/9/2015,PHYSICAL EDUCATION PART 1: FOUNDATIONS OF PHYSICAL FITNESS
965167,11/9/2015,PHYSICAL EDUCATION PART 2: DEFENSIVE TACTICS JULY 07 - PRESENT
965167,11/9/2015,PHYSICAL EDUCATION PART 3: AMERICAN HEART ASSOCIATION BASIC LIFE SUPPORT
965167,11/9/2015,POLICE CRISIS INTERVENTION JULY 07 - PRESENT
965167,11/9/2015,POLICE FIELD PROBLEMS JULY 07 - PRESENT
965167,11/9/2015,POLICE INVESTIGATION AND REPORTING JULY 07 - PRESENT
965167,11/9/2015,POLICING A DEMOCRACY JULY 07 - PRESENT
965167,11/9/2015,POLICING SPECIAL POPULATIONS JULY 07 - PRESENT
965167,11/9/2015,PROCEDURAL LAW JULY 07 - PRESENT
965167,11/9/2015,SUBSTANTIVE LAW JULY 07 - PRESENT
965167,11/9/2015,TERRORISM AWARENESS AND RESPONSE JULY 07 - PRESENT
950552,7/24/2025,2025 EQUAL EMPLOYMENT OPPORTUNITY TRAINING - SEXUAL HARASSMENT AWARENESS AND PREVENTION
950552,6/24/2025,EAU 2025 POLICE COMMISSIONER JESSICA S. TISCH
950552,6/17/2025,2025 BWC PROFICIENCY TRAINING
950552,4/16/2025,ACTIVE SHOOTER - SCHOOL RESPONSE PROTOCOL
950552,3/25/2025,RIGHT TO KNOW ACT SQF MODULE 9
950552,1/28/2025,VEHICLE PURSUITS
950552,12/16/2024,DRIVING WHILE INTOXICATED AWARENESS VIDEO MODULE 1
950552,9/27/2024,2024 EQUAL EMPLOYMENT OPPORTUNITY TRAINING - SEXUAL HARASSMENT AWARENESS AND PREVENTION
950552,9/27/2024,ACCURATE COMPLAINT REPORT CLASSIFICATION
950552,9/27/2024,APX NEXT PORTABLE AND RADIO DISCIPLINE TRAINING VIDEO
950552,9/27/2024,ASSISTING SURVIVORS OF SEXUAL BASED VIOLENCE WITH ACCESS TO RESOURCES
950552,9/27/2024,DRIVE SMART 2024
950552,9/27/2024,MENTAL HEALTH INVOLUNTARY REMOVALS MHL 9.41 AND MHL 9.58
950552,9/27/2024,NORTHWELL DIRECT FINEST CARE PROGRAM FOR UMOS
950552,9/27/2024,TACTICS WHEN ENGAGING INDIVIDUALS IN A MENTAL HEALTH CRISIS
950552,9/27/2024,UNMANNED AIRCRAFT SYSTEMS VISUAL OBSERVER
950552,9/20/2024,RACIAL PROFILING AND BIASED BASED POLICING: SQF MODULE 8
950552,9/20/2024,RAPE IS RAPE
950552,6/28/2024,LEVEL 1 AND LEVEL 2 INVESTIGATIVE ENCOUNTERS
950552,5/10/2024,FTS - CEW TASER 7 TRANSITION COURSE
950552,5/10/2024,FTS - TASER 7 HOLSTER DISTRIBUTION
950552,4/19/2024,FTS - ANNUAL CEW RECERTIFICATION
950552,2/28/2024,LGBTQIA PLUS - DIVERSITY AND INCLUSION
950552,11/22/2023,AUGMENTED REALITY FEATURE
950552,11/13/2023,EFFECTIVE COMMUNICATION SKILLS - DEAF OR HARD OF HEARING
950552,11/13/2023,ELDER ABUSE -2023 REFRESHER
950552,11/13/2023,INFORMATION SECURITY AWARENESS TRAINING - 2023
950552,11/13/2023,NYPD RECRUITMENT TRAINING VIDEO
950552,11/13/2023,VEHICLE MOUNTED VIDEO SYSTEM
950552,8/24/2023,2023 SUMMER ALL-OUT BODY WORN CAMERA TRAINING
950552,8/24/2023,NYPD JOUVERT AND WEST INDIAN DAY-2023
950552,8/24/2023,TRAFFIC COURT TESTIMONY VIDEO
950552,8/8/2023,UNMANNED AIRCRAFT PERMIT: DRONES FOR PUBLIC USE
950552,6/12/2023,2023 EQUAL EMPLOYMENT OPPORTUNITY TRAINING-SEXUAL HARASSMENT AWARENESS AND PREVENTION
950552,6/12/2023,2023 LANGUAGE MATTERS - FOSTERING A POSITIVE WORK ENVIRONMENT
950552,6/12/2023,ESPER POLICY LIBRARY
950552,4/19/2023,CLT-PROCEDURAL OPERATIONS
950552,3/23/2023,INFORMATION SECURITY CRIMINAL JUSTICE TRAINING 2023
950552,1/27/2023,CLT-PROCEDURAL OPERATIONS
950552,1/25/2023,NYPD-U VOLUNTARY - INVOLUNTARY TRANSPORTS
950552,1/25/2023,RAISING THE LOWER AGE OF JUVENILE DELINQUENCY
950552,1/11/2023,INVESTIGATIVE ENCOUNTERS 2023: MODULE 2 SQF LEVEL 1
950552,1/4/2023,CLT-VOLUNTARY - INVOLUNTARY TRANSPORTS
950552,12/30/2022,INVESTIGATIVE ENCOUNTERS 2023 - MODULE 1 INTRODUCTION TO SQF
950552,11/23/2022,LGBTQIA PLUS AWARENESS
950552,11/23/2022,PROCESSING CIVILIAN COMPLAINTS
950552,11/23/2022,VIDEO 1 - PATROLLING THE NYC SUBWAY SYSTEM 2022
950552,11/23/2022,VIDEO 2 -TACTICAL CONSIDERATIONS FOR TRANSIT PATROL 2022 (PART 1)
950552,11/23/2022,VIDEO 3 - TACTICAL CONSIDERATIONS FOR TRANSIT PATROL 2022 (PART 2)
950552,11/23/2022,VIDEO 4 - PLATFORM SAFETY 2022
950552,10/7/2022,BELT-WORN TRAUMA KIT REFRESHER TRAINING VIDEO-2022
950552,9/27/2022,CLT-NIBRS ROLL CALL TRAINING
950552,9/19/2022,THE EMPLOYEE ASSISTANCE UNIT (EAU) IS HERE FOR YOU
950552,8/29/2022,NYPD JOUVERT  WEST INDIAN DAY
950552,8/23/2022,CAR STOP TACTICS FOR PATROL OFFICERS - MODULE 1: CONTROLLING THE STOP
950552,8/23/2022,CAR STOP TACTICS FOR PATROL OFFICERS - MODULE 2: PROHIBITED MANEUVERS
950552,8/23/2022,CAR STOP TACTICS FOR PATROL OFFICERS - MODULE 3: THE UNKNOWN RISK STOP
950552,8/23/2022,CAR STOP TACTICS FOR PATROL OFFICERS - MODULE 4: THE HIGH-RISK STOP
950552,8/18/2022,2022 EQUAL EMPLOYMENT OPPORTUNITY TRAINING-SEXUAL HARASSMENT AWARENESS AND PREVENTION
950552,8/18/2022,BEST PRACTICES IN STRUCTURED INTERVIEWING
950552,8/18/2022,CONVICTED OFFENDER DNA DATABANK SPECIMEN COLLECTION KIT
950552,8/18/2022,VEHICLE SEIZURE FORM
950552,8/17/2022,"INTEGRATING COMMUNICATION, ASSESSMENT, AND TACTICS (ICAT) MODULE 7"
950552,8/15/2022,CLT-EPERMIT SYSTEM
950552,6/29/2022,NATIONAL INCIDENT-BASED REPORTING SYSTEM (NIBRS) UPDATES TO THE OMNIFORM COMPLAINT SYSTEMV
950552,6/20/2022,"INTEGRATING COMMUNICATION, ASSESSMENT AND TACTICS (ICAT) MODULE 6"
950552,5/25/2022,PROHIBITED METHODS OF RESTRAINT
950552,4/20/2022,ILERSBA - INITIAL LAW ENFORCMENT RESPONSE TO SUICIDE BOMBING ATTACKS
950552,4/15/2022,"INTEGRATING COMMUNICATION, ASSESSMENT AND TACTICS (ICAT) MODULE 4"
950552,4/15/2022,"INTEGRATING COMMUNICATION, ASSESSMENT AND TACTICS (ICAT) MODULE 5"
950552,4/13/2022,FTS - ANNUAL CEW RECERTIFICATION
950552,3/17/2022,ILLEGAL EVICTIONS
950552,3/1/2022,COUNTERTERRORISM PERSONAL RADIATION DETECTION COURSE
950552,2/4/2022,DOCUMENT INSPECTION FOR LAW ENFORCEMENT (PER-383)
950552,1/25/2022,DRONE ASSESSMENT AND RESPONSE TACTICS (AWR-404)
950552,1/25/2022,LOCAL LAW 45 OF 2021-TRAFFIC ENCOUNTERS
950552,11/30/2021,IDENTIFYING THE IMPAIRED DRIVER
950552,11/19/2021,"INTEGRATING COMMUNICATION, ASSESSMENT AND TACTICS (ICAT) MODULE 2"
950552,11/17/2021,ARRESTS - RELIGIOUS HEAD COVERING GUIDELINES (PG 208-83)
950552,10/14/2021,CONTERTERRORISM BUREAU SITE PROTECTION THROUGH OBSERVATIONAL TECHNIQUES
950552,10/14/2021,"INTEGRATING COMMUNICATION, ASSESSMENT AND TACTICS (ICAT) MODULE 1"
950552,10/12/2021,BODY-WORN CAMERA REVIEW PART TWO
950552,10/6/2021,BODY-WORN CAMERA REVIEW PART ONE
950552,10/6/2021,OPIOID OVERDOSE RECOGNITION AND NARCAN ADMINISTRATION -2021
950552,9/30/2021,ACTIVE BYSTANDERSHIP FOR LAW ENFORCEMENT (ABLE): ONE DAY COURSE
950552,9/23/2021,AWARENESS AND RESPONSE TO BIOLOGICAL INCIDENTS
950552,9/16/2021,"HME - HOMEMADE EXPLOSIVES: AWARENESS, RECOGNITION, AND RESPONSE"
950552,9/15/2021,INFORMATION SECURITY AWARENESS TRAINING 2021
950552,9/10/2021,MAYOR EXECUTIVE ORDER 78 VACCINATION - TESTING COMPLIANCE POLICY
950552,7/27/2021,DOMAIN AWARNESS SYSTEM (DAS)
950552,7/27/2021,EQUAL EMPLOYMENT OPPORTUNITY TRAINING - SEXUAL HARASSMENT AWARENESS AND PREVENTION 2021
950552,7/27/2021,LOCATING APPLE DEVICES USING YOUR DEPARTMENT SMARTPHONE
950552,5/21/2021,OVERVIEW OF THE NEW DISCOVERY LAWS 2021 REFRESHER
950552,5/20/2021,PATROL GUIDE 215-17 POLICE ACTIONS RELATED QUESTIONING ARRESTS AND INVESTIGATIONS AT A NYC DEPARTMEN
950552,4/28/2021,EMPLOYEE ASSISTANCE UNIT-2021
950552,4/26/2021,FTS - ANNUAL CEW RECERTIFICATION
950552,4/1/2021,EQUAL EMPLOYMENT OPPORTUNITY TRAINING - LGBTQIA+ DIVERSITY AND INCLUSION / EXECUTIVE ORDER 16 OF 201
950552,3/4/2021,DESK APPEARANCE TICKETS: THE NEW LAW AND THE NEW GUIDELINES FOR PROCESSING DAT'S - 2021 REFRESHER
950552,2/23/2021,"CUSTOMER SERVICE PROGRAM:  ROLL CALL MODULE 1, INTRODUCTION TO PRECINCT GREETER PROGRAM"
950552,2/23/2021,"CUSTOMER SERVICE PROGRAM:  ROLL CALL MODULE 2, COMMUNICATION SKILLS"
950552,2/23/2021,EQUAL EMPLOYMENT OPPORTUNITY ANNUAL LIAISON TRAINING CONFERENCE
950552,2/22/2021,CUSTOMER SERVICE PROGRAM: HOW DID WE DO
950552,1/25/2021,COVID VACCINE DISTRIBUTION AND EDUCATION
950552,11/30/2020,EQUAL EMPLOYMENT OPPORTUNITY TRAINING - LEAVE TO EXPRESS BREAST MILK
950552,9/30/2020,2017-2019 IN-SERVICE CYCLE-INVESTIGATIVE ENCOUNTERS- BASIC TRAINING WITH SCENARIOS
950552,9/16/2020,BTK (BELT TRAUMA KIT DISTRIBUTION AND FAMILIARIZATION)
950552,7/21/2020,VICTIM BLAMING AND RELEASE OF INFORMATION TO THE MEDIA
950552,7/3/2020,"EQUAL EMPLOYMENT OPPORTUNITY TRAINING - SEXUAL HARASSMENT, AWARENESS AND PREVENTION"
950552,7/3/2020,NEW LAWS AFFECTING POLICE OFFICERS’ CRIMINAL AND CIVIL LIABILITY
950552,6/18/2020,COVID-19: PREPAREDNESS YOUR FAMILY AND HOME
950552,6/18/2020,HEALTH AND WELLNESS SECTION - MODULE 1 - PSYCHOLOGICAL HEALTH AND WELLNESS
950552,6/18/2020,HEALTH AND WELLNESS SECTION - MODULE 10 - SEEKING AND RECEIVING MENTAL HEALTH SUPPORT
950552,6/18/2020,HEALTH AND WELLNESS SECTION - MODULE 11 - HEALTH AND RESILIENCY
950552,6/18/2020,HEALTH AND WELLNESS SECTION - MODULE 12 - IN THAT DARK PLACE - AN OFFICER'S JOURNEY
950552,6/18/2020,HEALTH AND WELLNESS SECTION - MODULE 2 - JOB COUNSELING AND STRESS
950552,6/18/2020,HEALTH AND WELLNESS SECTION - MODULE 3 - WARNING SIGNS
950552,6/18/2020,HEALTH AND WELLNESS SECTION - MODULE 4 - CUMULATIVE TRAUMA
950552,6/18/2020,HEALTH AND WELLNESS SECTION - MODULE 5 - GAINING PERSPECTIVE
950552,6/18/2020,HEALTH AND WELLNESS SECTION - MODULE 6 - COPING WITH SIGNS OF ANXIETY DEPRESSION
950552,6/18/2020,HEALTH AND WELLNESS SECTION - MODULE 7 - LEADING WITH COMPASSION
950552,6/18/2020,"HEALTH AND WELLNESS SECTION - MODULE 8 - WARNING SIGNS, SUPPORT AND OUTREACH"
950552,6/18/2020,HEALTH AND WELLNESS SECTION - MODULE 9 - MANAGING STRESS ON THE JOB
950552,5/11/2020,COVID-19: PREPAREDENESS
950552,5/11/2020,COVID-19: PROTECTIVE MASKS
950552,4/29/2020,SAFETY CONSIDERATIONS FOR PATROLLING THE NYC SUBWAY SYSTEM -DANGERS OF THE PLATFORM EDGE
950552,3/19/2020,"AXON BODY-WORN CAMERA TRAINING - CAMERA OPERATION, AXON VIEW AND EVIDENCE.COM (REQUIRED FOR LE4 COMM"
950552,2/26/2020,FTS - TACTICAL TRAINING CENTER 069 PCT - SESSION 1
950552,2/20/2020,UTILIZING BALLISTIC PROTECTION IN DEPARTMENT VEHICLES (4:09)
950552,2/12/2020,CRIMINAL JUSTICE BUREAU - GIGLIO MATERIAL DISCLOSURES UNDER THE NEW DISCOVERY LAWS
950552,2/12/2020,PROCESSING DISCOVERY MATERIAL IN THE FORMS ARREST FOLDER
950552,1/10/2020,CROSSFIRE MITIGATION DURING CLOSE COMBAT INCIDENTS - PART 2
950552,12/12/2019,ACTIVITY LOG FOR IPHONE
950552,12/11/2019,FTS - ANNUAL CEW RECERTIFICATION
950552,12/10/2019,CROSSFIRE MITIGATION DURING CLOSE COMBAT INCIDENTS
950552,12/2/2019,CJB - DESK APPEARANCE TICKETS: THE NEW LAWS AND GUIDELINES FOR PROCESSING DATS
950552,12/2/2019,CJB - OVERVIEW OF THE NEW DISCOVERY LAWS
950552,12/2/2019,RESPONDING TO COMMERCIAL ROBBERIES PART LL - MODULE 1 AND MODULE 2
950552,11/25/2019,DISCHARGING YOUR FIREARM AT A MOVING THREAT
950552,11/25/2019,TACTICAL AWARENESS- BALLISTIC VEST
950552,11/14/2019,EQUAL EMPLOYMENT OPPORTUNITY NEW LIAISON TRAINING
950552,10/30/2019,PRISONER ESCAPE WARNING SIGNS
950552,10/30/2019,SUCCESSFULLY DISARMING AN EMOTIONALLY DISTURBED PERSON
950552,10/18/2019,CRIMINAL JUSTICE BUREAU - DNA TRAINING VIDEO
950552,10/9/2019,DOMESTIC VIOLENCE EDUCATION AND COUNSELING
950552,10/9/2019,FORCE POLICY UPDATE VIDEO
950552,10/9/2019,MARIJUANA POLICY UPDATE
950552,9/26/2019,CRITICAL DECISION MAKING MODEL
950552,8/20/2019,SHIELD OF RESILIENCE TRAINING COURSE
950552,8/12/2019,RESPONDING TO COMMERCIAL ROBBERIES
950552,7/19/2019,TRANSIT BUREAU - SAFETY CONSIDERATIONS FOR PATROLLING THE NYC SUBWAY SYSTEM
950552,7/19/2019,TRANSIT BUREAU - SAFETY CONSIDERATIONS FOR PATROLLING THE NYC SUBWAY SYSTEM - PART 2
950552,7/12/2019,TRANSIT BUREAU - TIMELY RESUMPTION OF SERVICE IN NYC TRANSIT
950552,6/24/2019,DISCUSSION - BASED LEARNING MODULE # 1-3
950552,6/24/2019,RESPONDING TO PEOPLE IN CRISIS – MODULE 4: USING DEPARTMENT MOBILE DIGITAL DEVICES
950552,6/17/2019,COLLABORATIVE POLICING - MEDIATION REFERRAL PROGRAM FOR NON-CRIMINAL COMPLAINTS
950552,6/17/2019,INVESTIGATIVE ENCOUNTERS-VIDEO #1 REQUEST FOR INFO-UNIT TRAINING FEB 2016
950552,6/17/2019,WORLDPRIDE NYC 2019
950552,5/30/2019,PROFESSIONAL DEVELOPMENT - EXCEL 2016 - PART 1
950552,5/15/2019,2017-2019 IN-SERVICE CYCLE-INTEGRATED TACTICS
950552,5/15/2019,COLLABORATIVE POLICING - THE DEAF AND HARD OF HEARING COMMUNITY
950552,4/29/2019,INVESTIGATIVE ENCOUNTERS-VIDEO #2 COMMON LAW RIGHT OF INQUIRY-UNIT TRAINING MAY 2016
950552,4/29/2019,INVESTIGATIVE ENCOUNTERS-VIDEO #3 TERRY STOPS AND REASONABLE SUSPICION-UNIT TRAINING JUNE 2016
950552,4/29/2019,INVESTIGATIVE ENCOUNTERS-VIDEO #4 DOCUMENTATION AND SUPERVISION-UNIT TRAINING JULY 2016
950552,4/29/2019,RESPONDING TO PEOPLE IN CRISIS - MODULES 2 AND 3: ACTIVE LISTENING PARTS 1 AND 2
950552,4/25/2019,FACILITIES MANAGEMENT DIVISION - MUNICIPAL SEPERATE STORM SEWER SYSTEM (MS4)
950552,4/5/2019,CPS INTERIOR PATROL TRESPASS AFFIDAVIT PROGRAM (TAP) VIDEO 2
950552,4/5/2019,PUBLIC CONTACT AND CONSENT TO SEARCH (RIGHT TO KNOW) - UNIT TRAINING AUGUST 2016
950552,4/1/2019,LEGAL BUREAU - PERJURY TRAINING MODULE
950552,4/1/2019,NEW PERFORMANCE EVALUATION PROCESS
950552,3/26/2019,COMMUNICATIONS- THE PROPER USAGE OF THE IDA RADIO CODES
950552,3/26/2019,"CPS INTERIOR PATROL OF HOUSING AUTHORITY BUILDINGS, PG 212-60 ROLL CALL VIDEO 1"
950552,3/26/2019,CPS INTERIOR PATROL TRESPASS AFFIDAVIT PROGRAM (TAP) VIDEO 1
950552,3/26/2019,CRIMINAL JUSTICE REFORM ACT ROLL CALL TRAINING PART 1
950552,3/26/2019,CRIMINAL JUSTICE REFORM ACT ROLL CALL TRAINING PART 2
950552,3/26/2019,PATROL- POLYCARBONATE SHIELD
950552,3/26/2019,POLICE COMMISSIONERS MESSAGE - VICTIMS OF SEXUAL ASSAULT VIDEO
950552,3/26/2019,SAFEGUARDING PRISONERS - OFFICER SAFETY GUIDELINES
950552,3/5/2019,NARCAN NASAL SPRAY TRAINING
950552,2/19/2019,COLLABORATIVE POLICING - ELDER ABUSE
950552,2/19/2019,COLLABORATIVE POLICING- ACCESSING TELEPHONIC INTERPRETERS VIA LANGUAGE LINE
950552,2/7/2019,TEXT TO 911 - INTRODUCTION
950552,2/5/2019,"SUPPORT SERVICES DIVISION - CLASS ""C"" OPERATOR"
950552,2/1/2019,CPS FAIR AND IMPARTIAL POLICING - ALL POS AND DETS
950552,1/22/2019,PATROL DOOR BAG - ROPE AND WEDGE INTRODUCTION
950552,1/18/2019,EQUAL EMPLOYMENT OPPORTUNITY ANNUAL LIAISON TRAINING CONFERENCE
950552,1/18/2019,EQUAL EMPLOYMENT OPPORTUNITYTRAINING - SEXUAL HARASSMENT AWARENESS AND PREVENTION
950552,1/15/2019,MARIJUANA BURNING ENFORCEMENT POLICY
950552,1/15/2019,RESPONDING TO PEOPLE IN CRISIS - MODULE 1: SENDING THE RIGHT SIGNALS
950552,12/21/2018,EQUAL EMPLOYMENT OPPORTUNITYTRAINING - SEXUAL HARASSMENT AWARENESS AND PREVENTION
950552,11/27/2018,FTS - ANNUAL CEW RECERTIFICATION
950552,10/31/2018,AMERICANS WITH DISABILITIES ACT (ADA)
950552,10/17/2018,RESPONDING TO PEOPLE IN CRISIS-INTRODUCTION TO CIT VIDEO SERIES
950552,10/17/2018,TACTICAL AWARENESS-SMARTPHONE SAFETY
950552,9/26/2018,NYC RIGHT TO KNOW ACT LEGISLATION - PART 2
950552,9/26/2018,NYC RIGHT TO KNOW ACT LEGISLATION – PART 1
950552,9/17/2018,CLT-ENFORCEMENT ACTIONS
950552,9/4/2018,RAISE THE AGE
950552,8/9/2018,AWARENESS AND RESPONSE TO BIOLOGICAL INCIDENTS
950552,7/4/2018,FTS - CEW X26P HOLSTER TRAINING AND DISTRIBUTION
950552,6/6/2018,CPS BODY-WORN CAMERA TRAINING WITH SCENARIOS
950552,4/20/2018,CLT-INVESTIGATIONS
950552,4/12/2018,CLT-PROCEDURAL OPERATIONS
950552,3/16/2018,CLT-LEGAL ISSUES
950552,2/16/2018,LEGAL BUREAU PERFORMANCE METRICS - PROHIBITED CONDUCT
950552,1/12/2018,"CPS INTERIOR PATROL OF HOUSING AUTHORITY BUILDINGS, PG 212-60 ROLL CALL VIDEO 2"
950552,1/10/2018,COLLABORATIVE POLICING- FOREIGN LANGUAGE CERTIFICATION VIDEO
950552,1/10/2018,EQUAL EMPLOYMENT OPPORTUNITY TRANSGENDER DIVERSITY AND INCLUSION:EXECUTIVE ORDER 16
950552,12/31/2017,NEW YEAR'S EVE TACTICAL AWARENESS
950552,12/22/2017,"CPS INTERIOR PATROL OF HOUSING AUTHORITY BUILDINGS, PG 212-60 ROLL CALL VIDEO 2"
950552,12/20/2017,CPS INTERIOR PATROL TRESPASS AFFIDAVIT PROGRAM (TAP) VIDEO 2
950552,12/12/2017,CPS INTERIOR PATROL TRESPASS AFFIDAVIT PROGRAM (TAP) VIDEO 1
950552,12/6/2017,"CPS INTERIOR PATROL OF HOUSING AUTHORITY BUILDINGS, PG 212-60 ROLL CALL VIDEO 1"
950552,11/21/2017,PERSONNEL BUREAU NYPD EMPLOYEE ASSISTANCE UNIT (EAU)
950552,11/20/2017,NARCAN NASAL SPRAY TRAINING
950552,11/7/2017,HIGHWAY 3-DAY STATIONARY STEP-OUT LIDAR COURSE
950552,10/30/2017,COLLABORATIVE POLICING- ACCESSING TELEPHONIC INTERPRETERS VIA LANGUAGE LINE
950552,10/27/2017,FUNDAMENTALS OF AUTO THEFT INVESTIGATION
950552,10/12/2017,TINT-METER OPERATION TINTED WINDOW VIOLATIONS
950552,10/5/2017,BARRIER TRUCK CERTIFIED
950552,9/28/2017,2017-2019 IN-SERVICE CYCLE-INVESTIGATIVE ENCOUNTERS-SUPERVISOR TRAINING WITHOUT SCENARIOS
950552,9/26/2017,PATROL- POLYCARBONATE SHIELD
950552,7/22/2017,COUNTERTERRORISM U.A.S. (UNMANNED AIRCRAFT SYSTEMS) DRONE AWARENESS
950552,6/8/2017,CRIMINAL JUSTICE REFORM ACT ROLL CALL TRAINING PART 2
950552,6/2/2017,FUNDAMENTALS OF INSTRUCTION
950552,5/16/2017,CRIMINAL JUSTICE REFORM ACT ROLL CALL TRAINING PART 1
950552,5/9/2017,2016-17 INSERVICE CYCLE-PHYSICAL TACTICS
950552,5/8/2017,COUNTER TERRORISM INITIAL PATROL RESPONSE TO AN ACTIVE SHOOTER
950552,2/16/2017,PSB MARIJUANA FIELD TESTING
950552,11/18/2016,X26P TRANSITION COURSE FOR CURRENT X26 END-USER TRAINING
950552,10/12/2016,PUBLIC CONTACT AND CONSENT TO SEARCH (RIGHT TO KNOW) - UNIT TRAINING AUGUST 2016
950552,9/28/2016,FIELD TRAINING OFFICER PROGRAM
950552,9/12/2016,LPR TRAINING
950552,8/25/2016,INVESTIGATIVE ENCOUNTERS-VIDEO #4 DOCUMENTATION AND SUPERVISION-UNIT TRAINING JULY 2016
950552,7/28/2016,INVESTIGATIVE ENCOUNTERS-VIDEO #3 TERRY STOPS AND REASONABLE SUSPICION-UNIT TRAINING JUNE 2016
950552,7/4/2016,FORCE POLICY REVISION-VIDEO-PG 221-UNIT TRAINING MAY 2016
950552,5/22/2016,INVESTIGATIVE ENCOUNTERS-VIDEO #2 COMMON LAW RIGHT OF INQUIRY-UNIT TRAINING MAY 2016
950552,2/16/2016,FTS - CEW END USER CERT
950552,2/14/2016,INVESTIGATIVE ENCOUNTERS-VIDEO #1 REQUEST FOR INFO-UNIT TRAINING FEB 2016
950552,2/4/2016,INVESTIGATIVE ENCOUNTERS-VIDEO #1 REQUEST FOR INFO-UNIT TRAINING FEB 2016
950552,12/23/2015,FORCE POLICY REVISION-PAMPHLET - PG 221 - UNIT TRAINING DECEMBER 2015
950552,11/9/2015,EMERGENCY VEHICLE OPERATION JULY 07 - PRESENT
950552,11/9/2015,FIELD TRAINING PROGRAM JULY 07 - PRESENT
950552,11/9/2015,PHYSICAL EDUCATION PART 1: FOUNDATIONS OF PHYSICAL FITNESS
950552,11/9/2015,PHYSICAL EDUCATION PART 2: DEFENSIVE TACTICS JULY 07 - PRESENT
950552,11/9/2015,PHYSICAL EDUCATION PART 3: AMERICAN HEART ASSOCIATION BASIC LIFE SUPPORT
950552,11/9/2015,POLICE CRISIS INTERVENTION JULY 07 - PRESENT
950552,11/9/2015,POLICE FIELD PROBLEMS JULY 07 - PRESENT
950552,11/9/2015,POLICE INVESTIGATION AND REPORTING JULY 07 - PRESENT
950552,11/9/2015,POLICING A DEMOCRACY JULY 07 - PRESENT
950552,11/9/2015,POLICING SPECIAL POPULATIONS JULY 07 - PRESENT
950552,11/9/2015,PROCEDURAL LAW JULY 07 - PRESENT
950552,11/9/2015,SUBSTANTIVE LAW JULY 07 - PRESENT
950552,11/9/2015,TERRORISM AWARENESS AND RESPONSE JULY 07 - PRESENT
950552,1/8/2015,ATOMIZER DISTRIBUTION
950552,1/8/2015,OPIOID OVERDOSE AND INTRANASAL NALOXONE TRAINING: COMMAND LEVEL TRAINING BASIC COURSE
950552,12/11/2014,20K TRAINING INITIATIVE - SMART POLICING
950552,12/4/2014,20K TRAINING INITIATIVE - PHYSICAL TACTICS
950552,11/21/2014,20K TRAINING INITIATIVE - FOUNDATIONS OF POLICING
950552,12/18/2013,UF 250 - OPERATION IMPACT REFRESHER CERTIFIED
950552,7/8/2013,IN-TAC TRAINING PROGRAM
950552,6/6/2013,TRAFFIC VIOLATIONS BUREAU WORKSHOP
950552,5/28/2013,UF 250 - OPERATION IMPACT REFRESHER CERTIFIED
950552,5/21/2012,UF 250 - OPERATION IMPACT REFRESHER CERTIFIED
950552,11/2/2011,PROPERTY EVIDENCE TRACKING SYSTEM
950552,10/31/2011,COBRA - COHORT TRAINING
950552,7/6/2011,12 PASSENGER VAN / UTILITY VEHICLE QUALIFICATION
950552,7/6/2011,FOUR WHEEL DRIVE TRAINING
950552,,FOUR WHEEL DRIVE TRAINING
950552,,RECRUIT 12 PASSENGER VAN / UTILITY VEHICLE QUALIFICATION
954908,8/6/2025,DIGNITARY PROTECTION COURSE
954908,5/16/2025,FTS - TASER 7 ANNUAL RECERTIFICATION
954908,12/24/2024,DRIVING WHILE INTOXICATED AWARENESS VIDEO MODULE 1
954908,12/24/2024,INFORMATION SECURITY AWARENESS TRAINING 2024
954908,11/29/2024,DETECTIVE BUREAU SEARCH WARRANT TRAINING
954908,11/16/2024,CLT-DOMESTIC VIOLENCE TRAINING
954908,10/17/2024,FAMILY BUILDING
954908,10/17/2024,NORTHWELL DIRECT FINEST CARE PROGRAM FOR UMOS
954908,10/13/2024,CLT-DOMESTIC VIOLENCE TRAINING
954908,9/16/2024,CLT-PROCEDURAL OPERATIONS
954908,9/4/2024,APX NEXT PORTABLE AND RADIO DISCIPLINE TRAINING VIDEO
954908,9/4/2024,DRIVE SMART 2024
954908,8/21/2024,MENTAL HEALTH INVOLUNTARY REMOVALS MHL 9.41 AND MHL 9.58
954908,8/21/2024,RACIAL PROFILING AND BIASED BASED POLICING: SQF MODULE 8
954908,8/21/2024,RAPE IS RAPE
954908,8/21/2024,UNMANNED AIRCRAFT SYSTEMS VISUAL OBSERVER
954908,8/7/2024,CLT-DOCUMENTATION AND FORMS
954908,8/7/2024,CLT-DOMESTIC VIOLENCE TRAINING
954908,8/2/2024,CLT-DOCUMENTATION AND FORMS
954908,8/2/2024,CLT-DOMESTIC VIOLENCE TRAINING
954908,8/2/2024,FTS - CEW TASER 7 TRANSITION COURSE
954908,8/2/2024,FTS - TASER 7 HOLSTER DISTRIBUTION
954908,7/26/2024,CLT-DOCUMENTATION AND FORMS
954908,7/26/2024,CLT-DOMESTIC VIOLENCE TRAINING
954908,7/23/2024,CLT-DOMESTIC VIOLENCE TRAINING
954908,6/24/2024,LEVEL 1 AND LEVEL 2 INVESTIGATIVE ENCOUNTERS
954908,6/24/2024,TACTICS WHEN ENGAGING INDIVIDUALS IN A MENTAL HEALTH CRISIS
954908,6/10/2024,ACCURATE COMPLAINT REPORT CLASSIFICATION
954908,5/23/2024,2024 EQUAL EMPLOYMENT OPPORTUNITY TRAINING - SEXUAL HARASSMENT AWARENESS AND PREVENTION
954908,5/23/2024,ASSISTING SURVIVORS OF SEXUAL BASED VIOLENCE WITH ACCESS TO RESOURCES
954908,5/23/2024,CLT-DOMESTIC VIOLENCE TRAINING
954908,5/23/2024,CLT-PROCEDURAL OPERATIONS
954908,5/22/2024,HOUSING BUREAU INTERIOR PATROL TACTICS
954908,5/3/2024,CLT-DOMESTIC VIOLENCE TRAINING
954908,5/3/2024,CLT-SPECIAL POPULATIONS
954908,5/2/2024,CLT-PROCEDURAL OPERATIONS
954908,4/24/2024,CLT-PROCEDURAL OPERATIONS
954908,4/23/2024,CLT-DOMESTIC VIOLENCE TRAINING
954908,4/23/2024,CLT-SPECIAL POPULATIONS
954908,4/10/2024,2024 VEHICLE SEIZURE FORM REFRESHER
954908,4/10/2024,EMPLOYEE ASSISTANCE UNIT (E.A.U.) IS HERE FOR YOU- 2024
954908,4/10/2024,NYCHA INTERIOR PATROL: SQF MODULE 7
954908,4/10/2024,POLICING THE SUBWAY 2024
