taxid,date,name
938397,5/9/2016,BTK (BELT TRAUMA KIT DISTRIBUTION AND FAMILIARIZATION)
938397,2/1/2016,INVESTIGATIVE ENCOUNTERS-VIDEO #1 REQUEST FOR INFO-UNIT TRAINING FEB 2016
938397,12/30/2015,FORCE POLICY REVISION-PAMPHLET - PG 221 - UNIT TRAINING DECEMBER 2015
938397,11/9/2015,EMERGENCY VEHICLE OPERATION JULY 03 - JUNE 07
938397,11/9/2015,FIELD TRAINING PROGRAM JULY 03 - JUNE 07
938397,11/9/2015,PHYSICAL EDUCATION PART 1: FOUNDATIONS OF PHYSICAL FITNESS
938397,11/9/2015,PHYSICAL EDUCATION PART 2: DEFENSIVE TACTICS
938397,11/9/2015,PHYSICAL EDUCATION PART 3: AMERICAN HEART ASSOCIATION BASIC LIFE SUPPORT
938397,11/9/2015,POLICE CRISIS INTERVENTION JULY 03 - JUNE 07
938397,11/9/2015,POLICE FIELD PROBLEMS JULY 03 - JUNE 07
938397,11/9/2015,POLICE INVESTIGATION AND REPORTING JULY 03 - JUNE 07
938397,11/9/2015,POLICING A DEMOCRACY JULY 03 - JUNE 07
938397,11/9/2015,POLICING SPECIAL POPULATIONS JULY 03 - JUNE 07
938397,11/9/2015,PROCEDURAL LAW JULY 03 - JUNE 07
938397,11/9/2015,SUBSTANTIVE LAW JULY 03 - JUNE 07
938397,11/9/2015,TERRORISM AWARENESS AND RESPONSE JULY 03 - JUNE 07
938397,8/19/2013,SPRINTER VAN QUALIFICATION
938397,6/28/2012,BARRIER TRUCK CERTIFIED
938397,9/23/2010,PROPERTY EVIDENCE TRACKING SYSTEM
938397,11/21/2005,COBRA - COHORT TRAINING
938397,7/11/2005,12 PASSENGER VAN / UTILITY VEHICLE QUALIFICATION
938397,7/11/2005,FOUR WHEEL DRIVE TRAINING
938397,,BOX TRUCK QUALIFICATION
938397,,FOUR WHEEL DRIVE TRAINING
938397,,RECRUIT 12 PASSENGER VAN / UTILITY VEHICLE QUALIFICATION
938397,,RECRUIT RMP QUALIFICATION / RMP OPERATOR QUALIFIED
956949,6/17/2025,2025 EQUAL EMPLOYMENT OPPORTUNITY TRAINING - SEXUAL HARASSMENT AWARENESS AND PREVENTION
956949,6/5/2025,FTS - TASER 7 HOLSTER DISTRIBUTION
956949,5/7/2025,DETECTIVE BUREAU FUSUS
956949,4/22/2025,FTS - CEW TASER 7 TRANSITION COURSE
956949,2/4/2025,VEHICLE PURSUITS
956949,11/20/2024,DRIVING WHILE INTOXICATED AWARENESS VIDEO MODULE 1
956949,10/15/2024,NORTHWELL DIRECT FINEST CARE PROGRAM FOR UMOS
956949,10/4/2024,FAMILY BUILDING
956949,10/4/2024,UNMANNED AIRCRAFT SYSTEMS VISUAL OBSERVER
956949,8/20/2024,RAPE IS RAPE
956949,7/10/2024,2021 EXECUTIVE CONFERENCE - VIDEOS
956949,7/10/2024,2024 VEHICLE SEIZURE FORM REFRESHER
956949,7/10/2024,ACCURATE COMPLAINT REPORT CLASSIFICATION
956949,7/10/2024,AIM COMPONENTS
956949,7/10/2024,ASSISTING SURVIVORS OF SEXUAL BASED VIOLENCE WITH ACCESS TO RESOURCES
956949,7/10/2024,AUGMENTED REALITY FEATURE
956949,7/10/2024,AUTISM SPECTRUM DISORDER
956949,7/10/2024,AXON TRAINING - MODULE 1 AXON BODY 2 BASIC OPERATION
956949,7/10/2024,CITYTIME USER TRAINING FOR NON-MANAGERIAL CMOS
956949,7/10/2024,COVID-19 SELF-COLLECTION KIT INSTRUCTIONS
956949,7/10/2024,DRIVE SMART 2024
956949,7/10/2024,ELDER ABUSE -2023 REFRESHER
956949,7/10/2024,EMPLOYEE ASSISTANCE UNIT (E.A.U.) IS HERE FOR YOU- 2024
956949,7/10/2024,HOUSING BUREAU INTERIOR PATROL TACTICS
956949,7/10/2024,INTRODUCTION TO COGNOS 11
956949,7/10/2024,INVESTIGATIVE ENCOUNTERS SUMMARY: SQF MODULE 6
956949,7/10/2024,MENTAL HEALTH INVOLUNTARY REMOVALS MHL 9.41 AND MHL 9.58
956949,7/10/2024,NEIGHBORHOOD POLICING APPLICATION TRAINING VIDEO
956949,7/10/2024,NYCHA INTERIOR PATROL: SQF MODULE 7
956949,7/10/2024,OPIOID DANGERS- FENTANYL AND CARFENTANIL
956949,7/10/2024,POLICING THE SUBWAY 2024
956949,7/10/2024,TACTICS WHEN ENGAGING INDIVIDUALS IN A MENTAL HEALTH CRISIS
956949,7/10/2024,VIPER CCTV TRAINING COURSE
956949,7/5/2024,2024 EQUAL EMPLOYMENT OPPORTUNITY TRAINING - SEXUAL HARASSMENT AWARENESS AND PREVENTION
956949,6/25/2024,LEVEL 1 AND LEVEL 2 INVESTIGATIVE ENCOUNTERS
956949,6/13/2024,DETECTIVE BUREAU BODY WORN CAMERAS
956949,3/12/2024,LGBTQIA PLUS - DIVERSITY AND INCLUSION
956949,10/25/2023,INVESTIGATIVE ENCOUNTERS 2023 - MODULE 1 INTRODUCTION TO SQF
956949,10/25/2023,INVESTIGATIVE ENCOUNTERS 2023: MODULE 2 SQF LEVEL 1
956949,10/25/2023,INVESTIGATIVE ENCOUNTERS 2023: MODULE 3 SQF LEVEL 2
956949,10/25/2023,PROCESSING CIVILIAN COMPLAINTS
956949,10/25/2023,RAISING THE LOWER AGE OF JUVENILE DELINQUENCY
956949,10/24/2023,2023 SUMMER ALL-OUT BODY WORN CAMERA TRAINING
956949,10/24/2023,ARRESTS - RELIGIOUS HEAD COVERING GUIDELINES (PG 208-83)
956949,10/24/2023,BELT-WORN TRAUMA KIT REFRESHER TRAINING VIDEO-2022
956949,10/24/2023,BEST PRACTICES IN STRUCTURED INTERVIEWING
956949,10/24/2023,BODY-WORN CAMERA REVIEW PART TWO
956949,10/24/2023,CAR STOP TACTICS FOR PATROL OFFICERS - MODULE 1: CONTROLLING THE STOP
956949,10/24/2023,CAR STOP TACTICS FOR PATROL OFFICERS - MODULE 2: PROHIBITED MANEUVERS
956949,10/24/2023,CAR STOP TACTICS FOR PATROL OFFICERS - MODULE 3: THE UNKNOWN RISK STOP
956949,10/24/2023,CAR STOP TACTICS FOR PATROL OFFICERS - MODULE 4: THE HIGH-RISK STOP
956949,10/24/2023,CONVICTED OFFENDER DNA DATABANK SPECIMEN COLLECTION KIT
956949,10/24/2023,EFFECTIVE COMMUNICATION SKILLS - DEAF OR HARD OF HEARING
956949,10/24/2023,ESPER POLICY LIBRARY
956949,10/24/2023,IDENTIFYING THE IMPAIRED DRIVER
956949,10/24/2023,ILLEGAL EVICTIONS
956949,10/24/2023,INFORMATION SECURITY AWARENESS TRAINING - 2023
956949,10/24/2023,"INVESTIGATIVE ENCOUNTERS 2023: MODULE 4 SQF LEVELS 2, 3 AND 4"
956949,10/24/2023,INVESTIGATIVE ENCOUNTERS 2023: MODULE 5 SQF LEVELS 3 AND 4
956949,10/24/2023,LGBTQIA PLUS AWARENESS
956949,10/24/2023,LOCAL LAW 45 OF 2021-TRAFFIC ENCOUNTERS
956949,10/24/2023,NYPD JOUVERT AND WEST INDIAN DAY-2023
956949,10/24/2023,NYPD RECRUITMENT TRAINING VIDEO
956949,10/24/2023,OPIOID OVERDOSE RECOGNITION AND NARCAN ADMINISTRATION -2021
956949,10/24/2023,PROHIBITED METHODS OF RESTRAINT
956949,10/24/2023,THE EMPLOYEE ASSISTANCE UNIT (EAU) IS HERE FOR YOU
956949,10/24/2023,UNMANNED AIRCRAFT PERMIT: DRONES FOR PUBLIC USE
956949,10/24/2023,VEHICLE MOUNTED VIDEO SYSTEM
956949,10/24/2023,VEHICLE SEIZURE FORM
956949,10/24/2023,VIDEO 1 - PATROLLING THE NYC SUBWAY SYSTEM 2022
956949,10/24/2023,VIDEO 2 -TACTICAL CONSIDERATIONS FOR TRANSIT PATROL 2022 (PART 1)
956949,10/24/2023,VIDEO 3 - TACTICAL CONSIDERATIONS FOR TRANSIT PATROL 2022 (PART 2)
956949,10/24/2023,VIDEO 4 - PLATFORM SAFETY 2022
956949,8/16/2023,TRAFFIC COURT TESTIMONY VIDEO
956949,6/28/2023,2023 EQUAL EMPLOYMENT OPPORTUNITY TRAINING-SEXUAL HARASSMENT AWARENESS AND PREVENTION
956949,6/28/2023,2023 LANGUAGE MATTERS - FOSTERING A POSITIVE WORK ENVIRONMENT
956949,6/28/2023,NYPD-U VOLUNTARY - INVOLUNTARY TRANSPORTS
956949,5/18/2023,INFORMATION SECURITY CRIMINAL JUSTICE TRAINING 2023
956949,10/15/2022,NATIONAL INCIDENT-BASED REPORTING SYSTEM (NIBRS) UPDATES TO THE OMNIFORM COMPLAINT SYSTEMV
956949,8/30/2022,NYPD JOUVERT  WEST INDIAN DAY
956949,8/16/2022,2022 EQUAL EMPLOYMENT OPPORTUNITY TRAINING-SEXUAL HARASSMENT AWARENESS AND PREVENTION
956949,4/6/2022,BODY-WORN CAMERA REVIEW PART ONE
956949,9/15/2021,MAYOR EXECUTIVE ORDER 78 VACCINATION - TESTING COMPLIANCE POLICY
956949,8/4/2021,EQUAL EMPLOYMENT OPPORTUNITY TRAINING - SEXUAL HARASSMENT AWARENESS AND PREVENTION 2021
956949,5/20/2021,CITYTIME TRAINING FOR SUPERVISORS
956949,5/20/2021,OVERVIEW OF THE NEW DISCOVERY LAWS 2021 REFRESHER
956949,5/20/2021,PATROL GUIDE 215-17 POLICE ACTIONS RELATED QUESTIONING ARRESTS AND INVESTIGATIONS AT A NYC DEPARTMEN
956949,4/24/2021,EMPLOYEE ASSISTANCE UNIT-2021
956949,4/24/2021,EQUAL EMPLOYMENT OPPORTUNITY TRAINING - LGBTQIA+ DIVERSITY AND INCLUSION / EXECUTIVE ORDER 16 OF 201
956949,3/10/2021,DESK APPEARANCE TICKETS: THE NEW LAW AND THE NEW GUIDELINES FOR PROCESSING DAT'S - 2021 REFRESHER
956949,1/21/2021,COVID VACCINE DISTRIBUTION AND EDUCATION
956949,12/23/2020,HEALTH AND WELLNESS SECTION - FINANCIAL LITERACY SERIES - MODULE 1 - YOUR MONEY VALUES AND INFLUENCE
956949,12/23/2020,HEALTH AND WELLNESS SECTION - FINANCIAL LITERACY SERIES - MODULE 2 - YOUR INCOME AND EXPENSES
956949,12/23/2020,HEALTH AND WELLNESS SECTION - FINANCIAL LITERACY SERIES - MODULE 3 - YOUR SPENDING AND SAVINGS PLAN
956949,12/23/2020,HEALTH AND WELLNESS SECTION - FINANCIAL LITERACY SERIES - MODULE 4 - MANAGING DEBT
956949,12/23/2020,HEALTH AND WELLNESS SECTION - MODULE 13 - MINDFULNESS
956949,12/13/2020,EQUAL EMPLOYMENT OPPORTUNITY TRAINING - LEAVE TO EXPRESS BREAST MILK
956949,11/14/2020,HEALTH AND WELLNESS SECTION - MODULE 10 - SEEKING AND RECEIVING MENTAL HEALTH SUPPORT
956949,11/14/2020,HEALTH AND WELLNESS SECTION - MODULE 11 - HEALTH AND RESILIENCY
956949,11/14/2020,HEALTH AND WELLNESS SECTION - MODULE 12 - IN THAT DARK PLACE - AN OFFICER'S JOURNEY
956949,11/14/2020,HEALTH AND WELLNESS SECTION - MODULE 6 - COPING WITH SIGNS OF ANXIETY DEPRESSION
956949,11/14/2020,HEALTH AND WELLNESS SECTION - MODULE 7 - LEADING WITH COMPASSION
956949,11/14/2020,"HEALTH AND WELLNESS SECTION - MODULE 8 - WARNING SIGNS, SUPPORT AND OUTREACH"
956949,11/14/2020,HEALTH AND WELLNESS SECTION - MODULE 9 - MANAGING STRESS ON THE JOB
956949,10/15/2020,BALLISTIC VEST DISTRIBUTION PROGRAM
956949,10/8/2020,HEALTH AND WELLNESS SECTION - MODULE 1 - PSYCHOLOGICAL HEALTH AND WELLNESS
956949,10/8/2020,HEALTH AND WELLNESS SECTION - MODULE 2 - JOB COUNSELING AND STRESS
956949,10/8/2020,HEALTH AND WELLNESS SECTION - MODULE 3 - WARNING SIGNS
956949,10/8/2020,HEALTH AND WELLNESS SECTION - MODULE 4 - CUMULATIVE TRAUMA
956949,10/8/2020,HEALTH AND WELLNESS SECTION - MODULE 5 - GAINING PERSPECTIVE
956949,10/6/2020,COVID-19: PREPAREDNESS YOUR FAMILY AND HOME
956949,10/6/2020,NEW LAWS AFFECTING POLICE OFFICERS’ CRIMINAL AND CIVIL LIABILITY
956949,10/6/2020,VICTIM BLAMING AND RELEASE OF INFORMATION TO THE MEDIA
956949,10/1/2020,"EQUAL EMPLOYMENT OPPORTUNITY TRAINING - SEXUAL HARASSMENT, AWARENESS AND PREVENTION"
956949,9/30/2020,CLT-ENFORCEMENT ACTIONS
956949,5/20/2020,COVID-19: PREPAREDENESS
956949,5/20/2020,COVID-19: PROTECTIVE MASKS
956949,5/20/2020,SAFETY CONSIDERATIONS FOR PATROLLING THE NYC SUBWAY SYSTEM -DANGERS OF THE PLATFORM EDGE
956949,2/18/2020,2017-2019 IN-SERVICE CYCLE-INVESTIGATIVE ENCOUNTERS- BASIC TRAINING WITH SCENARIOS
956949,2/17/2020,UTILIZING BALLISTIC PROTECTION IN DEPARTMENT VEHICLES (4:09)
956949,2/8/2020,CRIMINAL JUSTICE BUREAU - GIGLIO MATERIAL DISCLOSURES UNDER THE NEW DISCOVERY LAWS
956949,1/3/2020,CROSSFIRE MITIGATION DURING CLOSE COMBAT INCIDENTS - PART 2
956949,1/1/2020,PROCESSING DISCOVERY MATERIAL IN THE FORMS ARREST FOLDER
956949,12/28/2019,FACILITIES MANAGEMENT DIVISION - MUNICIPAL SEPERATE STORM SEWER SYSTEM (MS4)
956949,12/27/2019,EXECUTIVE HEALTH AND WELLNESS TRAINING - MODULE 10
956949,12/27/2019,EXECUTIVE HEALTH AND WELLNESS TRAINING - MODULE 3
956949,12/27/2019,EXECUTIVE HEALTH AND WELLNESS TRAINING - MODULE 4
956949,12/27/2019,EXECUTIVE HEALTH AND WELLNESS TRAINING - MODULE 5
956949,12/27/2019,EXECUTIVE HEALTH AND WELLNESS TRAINING - MODULE 6
956949,12/27/2019,EXECUTIVE HEALTH AND WELLNESS TRAINING - MODULE 7
956949,12/27/2019,EXECUTIVE HEALTH AND WELLNESS TRAINING - MODULE 8
956949,12/27/2019,EXECUTIVE HEALTH AND WELLNESS TRAINING - MODULE 9
956949,12/27/2019,INCREASE OFFICER SAFETY DURING VEHICLE STOPS
956949,12/27/2019,INFORMATION SECURITY AWERENESS TRAINING 2019
956949,12/27/2019,SAFEGUARDING HOSPITALIZED PRISONERS
956949,12/27/2019,SUCCESSFULLY DISARMING AN EMOTIONALLY DISTURBED PERSON
956949,12/20/2019,ACTIVITY LOG FOR IPHONE
956949,12/20/2019,CJB - DESK APPEARANCE TICKETS: THE NEW LAWS AND GUIDELINES FOR PROCESSING DATS
956949,12/20/2019,CJB - OVERVIEW OF THE NEW DISCOVERY LAWS
956949,12/20/2019,CROSSFIRE MITIGATION DURING CLOSE COMBAT INCIDENTS
956949,12/20/2019,RESPONDING TO COMMERCIAL ROBBERIES PART LL - MODULE 1 AND MODULE 2
956949,11/12/2019,DISCHARGING YOUR FIREARM AT A MOVING THREAT
956949,11/6/2019,FLYING WHILE ARMED
956949,11/5/2019,DETECTIVE BUREAU PROFESSIONAL DEVELOPMENT SEMINAR
956949,10/25/2019,PRISONER ESCAPE WARNING SIGNS
956949,10/16/2019,EXECUTIVE HEALTH AND WELLNESS CONFERENCE - MODULE 1
956949,10/16/2019,EXECUTIVE HEALTH AND WELLNESS TRAINING - MODULE 2
956949,10/16/2019,FORCE POLICY UPDATE VIDEO
956949,10/15/2019,CRIMINAL JUSTICE BUREAU - DNA TRAINING VIDEO
956949,9/27/2019,COUNTERTERRORISM BUREAU ACTIVE SHOOTER SCHOOL INCIDENTS AWARENESS
956949,9/27/2019,COUNTERTERRORISM BUREAU NH15 TRAINING
956949,9/27/2019,CRITICAL DECISION MAKING MODEL
956949,9/27/2019,MARIJUANA POLICY UPDATE
956949,9/14/2019,CRITICAL INCIDENT TACTICS - RESPONDING TO COMMERCIAL ROBBERIES (EXTENDED VERSION)
956949,9/14/2019,DISCUSSION - BASED LEARNING MODULE # 1-3
956949,9/11/2019,FTS - BALLISTIC VEST REPLACEMENT - MEASUREMENT - PRE AUG 2020
956949,9/4/2019,DOMESTIC VIOLENCE EDUCATION AND COUNSELING
956949,9/4/2019,TRANSIT BUREAU - SAFETY CONSIDERATIONS FOR PATROLLING THE NYC SUBWAY SYSTEM
956949,9/4/2019,TRANSIT BUREAU - SAFETY CONSIDERATIONS FOR PATROLLING THE NYC SUBWAY SYSTEM - PART 2
956949,9/3/2019,SHIELD OF RESILIENCE TRAINING COURSE
956949,8/17/2019,COLLABORATIVE POLICING - MEDIATION REFERRAL PROGRAM FOR NON-CRIMINAL COMPLAINTS
956949,8/17/2019,COLLABORATIVE POLICING - THE DEAF AND HARD OF HEARING COMMUNITY
956949,8/17/2019,RESPONDING TO COMMERCIAL ROBBERIES
956949,8/17/2019,RESPONDING TO PEOPLE IN CRISIS - MODULES 2 AND 3: ACTIVE LISTENING PARTS 1 AND 2
956949,8/17/2019,RESPONDING TO PEOPLE IN CRISIS – MODULE 4: USING DEPARTMENT MOBILE DIGITAL DEVICES
956949,8/17/2019,WORLDPRIDE NYC 2019
956949,6/25/2019,2019 DETECTIVE BUREAU INTAC
956949,5/31/2019,CRIMINAL INVESTIGATORS COURSE
956949,4/26/2019,DETECTIVE BUREAU SPECIAL VICTIMS INVESTIGATORS COURSE
956949,4/23/2019,CPS FAIR AND IMPARTIAL POLICING - ALL POS AND DETS
956949,4/2/2019,LEGAL BUREAU - PERJURY TRAINING MODULE
956949,3/22/2019,SAFEGUARDING PRISONERS - OFFICER SAFETY GUIDELINES
956949,2/20/2019,COLLABORATIVE POLICING - ELDER ABUSE
956949,2/4/2019,"SUPPORT SERVICES DIVISION - CLASS ""C"" OPERATOR"
956949,1/24/2019,CLT-COUNTERTERRORISM AND INTELLIGENCE
956949,1/24/2019,CLT-EQUAL EMPLOYMENT OPPORTUNITY
956949,1/24/2019,"CLT-INTEGRITY, ETHICS AND DISCIPLINE"
956949,1/17/2019,"EXECUTIVE CONFERENCE VIDEO 10-17-18: DISCUSSION WITH INDRA NOOYI, CHAIRMAN OF PEPSI CO"
956949,1/17/2019,"EXECUTIVE CONFERENCE VIDEO 10-17-18: INTELLIGENT LEADERSHIP: GEORGE TENET, FORMER (DIRECTOR OF CENTR"
956949,1/17/2019,EXECUTIVE CONFERENCE VIDEO 10-17-18: LEADERSHIP ON AND OFF THE BATTLEFIELD: GENERAL JOHN R. ALLEN (P
956949,1/17/2019,EXECUTIVE CONFERENCE VIDEO 10-17-18: MAKING IT REAL-GETTING FROM HERE TO THERE TOGETHER - DR SCOTT L
956949,1/17/2019,RESPONDING TO PEOPLE IN CRISIS - MODULE 1: SENDING THE RIGHT SIGNALS
956949,12/20/2018,EQUAL EMPLOYMENT OPPORTUNITYTRAINING - SEXUAL HARASSMENT AWARENESS AND PREVENTION
956949,12/20/2018,VERTEX 949 RADIO OPERATIONAL INSTRUCTIONS
956949,12/10/2018,MARIJUANA BURNING ENFORCEMENT POLICY
956949,10/31/2018,AMERICANS WITH DISABILITIES ACT (ADA)
956949,10/31/2018,TRANSIT BUREAU - TIMELY RESUMPTION OF SERVICE IN NYC TRANSIT
956949,10/11/2018,RESPONDING TO PEOPLE IN CRISIS-INTRODUCTION TO CIT VIDEO SERIES
956949,9/26/2018,NYC RIGHT TO KNOW ACT LEGISLATION - PART 2
956949,9/26/2018,NYC RIGHT TO KNOW ACT LEGISLATION – PART 1
956949,9/25/2018,COUNTERTERRORISM ACTIVE SHOOTER TRAINING
956949,9/25/2018,CRIME CONTROL STRATEGIES- COMMUNITY SUPERVISION
956949,9/25/2018,DAS OVERLAPPING LAYERS TUTORIAL
956949,9/25/2018,LOCATING APPLE DEVICES USING YOUR DEPARTMENT SMARTPHONE
956949,9/25/2018,NEW YEAR'S EVE TACTICAL AWARENESS
956949,9/25/2018,TRAINING MATERIALS- CLOSING THE GAP ON VEHICLE INTELLIGENCE
956949,9/25/2018,TRAINING MATERIALS- PAWNSHOP AND 2ND HAND DEALER DATABASE
956949,9/25/2018,TRAINING MATERIALS- THE RECIDIVIST TRACKING AND REPORTING DATABASE (RTRD)
956949,9/25/2018,TRAINING MATERIALS- VIRTUAL CRIME INFORMATION CENTER
956949,9/20/2018,AIM COMPONENTS
956949,9/20/2018,BELT TRAUMA KIT VIDEO
956949,9/20/2018,COBALT
956949,9/20/2018,COLLABORATIVE POLICING- POLICING IN TODAY’S MULTI-FAITH NY
956949,9/20/2018,COUNTERTERRORISM BUREAU FACILITY AWARENESS VIDEO- TIME WARNER BUILDING
956949,9/20/2018,COUNTERTERRORISM BUREAU FACILITY AWARENESS VIDEO-EMPIRE STATE BUILDING
956949,9/20/2018,"COUNTERTERRORISM BUREAU FACILITY AWARENESS- THE INTREPID SEA, AIR AND SPACE MUSEUM"
956949,9/20/2018,COUNTERTERRORISM U.A.S. (UNMANNED AIRCRAFT SYSTEMS) DRONE AWARENESS
956949,9/20/2018,DAS PATTERN MODE
956949,9/20/2018,DEATH BY POWERPOINT
956949,9/20/2018,DETECTIVE BUREAU RETRIEVING BODY WORN CAMERA DATA
956949,9/20/2018,DOMAIN AWARENESS SYSTEM - SEARCH ACCURINT RESULTS
956949,9/20/2018,DOMAIN AWARNESS SYSTEM (DAS)
956949,9/20/2018,"FORMS - THREAT,RESISTANCE,INJURY (TRI)"
956949,9/20/2018,IPHONE AND DAS MOBILE OPERATION
956949,9/20/2018,MOBILE IDENTIFICATION DEVICE (MORPHO)
956949,9/20/2018,NEW NYPD PORTAL
956949,9/20/2018,NEW PERFORMANCE EVALUATION PROCESS
956949,9/20/2018,NYPD MOBILITY INITIATIVE - DEPARTMENT SMARTPHONE TRAINING
956949,9/20/2018,POLICE COMMISSIONER MESSAGE- NYC GIVES
956949,9/20/2018,RAISE THE AGE
956949,9/20/2018,REGISTRATION OF AIM
956949,9/20/2018,STOP REPORT
956949,9/20/2018,TACTICAL AWARENESS OF EXCITED DELIRIUM SYNDROME
956949,9/20/2018,TACTICAL AWARENESS- BALLISTIC VEST
956949,9/20/2018,TACTICAL AWARENESS-SMARTPHONE SAFETY
956949,9/20/2018,WARRANT CHECK IN DOMAIN AWARENESS SYSTEM (DAS LITE)
956949,5/22/2018,COMMUNICATIONS- THE PROPER USAGE OF THE IDA RADIO CODES
956949,4/9/2018,COLLABORATIVE POLICING- HUMAN TRAFFICKING
956949,4/9/2018,FORMS MEDICAL TREATMENT OF PRISONER TRAINING
956949,3/21/2018,COLLABORATIVE POLICING- FOREIGN LANGUAGE CERTIFICATION VIDEO
956949,3/21/2018,LEGAL BUREAU PERFORMANCE METRICS - PROHIBITED CONDUCT
956949,12/7/2017,INFORMATION SECURITY AWARENESS TRAINING
956949,12/6/2017,FORCE POLICY REVISION-VIDEO-PG 221-UNIT TRAINING MAY 2016
956949,12/6/2017,INVESTIGATIVE ENCOUNTERS-VIDEO #2 COMMON LAW RIGHT OF INQUIRY-UNIT TRAINING MAY 2016
956949,12/6/2017,INVESTIGATIVE ENCOUNTERS-VIDEO #3 TERRY STOPS AND REASONABLE SUSPICION-UNIT TRAINING JUNE 2016
956949,12/6/2017,INVESTIGATIVE ENCOUNTERS-VIDEO #4 DOCUMENTATION AND SUPERVISION-UNIT TRAINING JULY 2016
956949,12/6/2017,PUBLIC CONTACT AND CONSENT TO SEARCH (RIGHT TO KNOW) - UNIT TRAINING AUGUST 2016
956949,12/1/2017,INVESTIGATIVE ENCOUNTERS-VIDEO #1 REQUEST FOR INFO-UNIT TRAINING FEB 2016
956949,11/13/2017,COLLABORATIVE POLICING- ACCESSING TELEPHONIC INTERPRETERS VIA LANGUAGE LINE
956949,11/13/2017,"CPS INTERIOR PATROL OF HOUSING AUTHORITY BUILDINGS, PG 212-60 ROLL CALL VIDEO 1"
956949,11/13/2017,"CPS INTERIOR PATROL OF HOUSING AUTHORITY BUILDINGS, PG 212-60 ROLL CALL VIDEO 2"
956949,11/13/2017,CPS INTERIOR PATROL TRESPASS AFFIDAVIT PROGRAM (TAP) VIDEO 1
956949,11/13/2017,CPS INTERIOR PATROL TRESPASS AFFIDAVIT PROGRAM (TAP) VIDEO 2
956949,11/13/2017,NARCAN NASAL SPRAY TRAINING
956949,11/1/2017,CRIMINAL JUSTICE REFORM ACT ROLL CALL TRAINING PART 1
956949,11/1/2017,CRIMINAL JUSTICE REFORM ACT ROLL CALL TRAINING PART 2
956949,11/1/2017,POLICE COMMISSIONERS MESSAGE - VICTIMS OF SEXUAL ASSAULT VIDEO
956949,10/24/2017,BTK (BELT TRAUMA KIT DISTRIBUTION AND FAMILIARIZATION)
956949,10/6/2017,COLLABORATIVE POLICING- ACCESSING TELEPHONIC INTERPRETERS VIA LANGUAGE LINE
956949,9/21/2017,PATROL- POLYCARBONATE SHIELD
956949,8/15/2017,PERSONNEL BUREAU NYPD EMPLOYEE ASSISTANCE UNIT (EAU)
956949,7/27/2017,"CPS INTERIOR PATROL OF HOUSING AUTHORITY BUILDINGS, PG 212-60 ROLL CALL VIDEO 1"
956949,7/27/2017,"CPS INTERIOR PATROL OF HOUSING AUTHORITY BUILDINGS, PG 212-60 ROLL CALL VIDEO 2"
956949,7/27/2017,CPS INTERIOR PATROL TRESPASS AFFIDAVIT PROGRAM (TAP) VIDEO 1
956949,6/2/2017,TRAFFIC VIOLATIONS BUREAU WORKSHOP
956949,5/25/2017,EQUAL EMPLOYMENT OPPORTUNITY TRANSGENDER DIVERSITY AND INCLUSION:EXECUTIVE ORDER 16
956949,5/22/2017,CRIMINAL JUSTICE REFORM ACT ROLL CALL TRAINING PART 1
956949,5/22/2017,CRIMINAL JUSTICE REFORM ACT ROLL CALL TRAINING PART 2
956949,3/31/2017,2016-17 INSERVICE CYCLE-PHYSICAL TACTICS
956949,2/10/2017,HATE CRIMES AND BIAS-RELATED INCIDENTS
956949,7/27/2016,FORCE POLICY REVISION-VIDEO-PG 221-UNIT TRAINING MAY 2016
956949,7/7/2016,"HME - HOMEMADE EXPLOSIVES: AWARENESS, RECOGNITION, AND RESPONSE"
956949,7/1/2016,INVESTIGATIVE ENCOUNTERS-VIDEO #4 DOCUMENTATION AND SUPERVISION-UNIT TRAINING JULY 2016
956949,6/22/2016,INVESTIGATIVE ENCOUNTERS-VIDEO #3 TERRY STOPS AND REASONABLE SUSPICION-UNIT TRAINING JUNE 2016
956949,6/17/2016,PSB MARIJUANA FIELD TESTING
956949,5/18/2016,INVESTIGATIVE ENCOUNTERS-VIDEO #2 COMMON LAW RIGHT OF INQUIRY-UNIT TRAINING MAY 2016
956949,2/2/2016,INVESTIGATIVE ENCOUNTERS-VIDEO #1 REQUEST FOR INFO-UNIT TRAINING FEB 2016
956949,1/14/2016,CRISIS INTERVENTION TEAM TRAINING
956949,12/7/2015,FORCE POLICY REVISION-PAMPHLET - PG 221 - UNIT TRAINING DECEMBER 2015
956949,11/23/2015,FORCE POLICY REVISION-PAMPHLET - PG 221 - UNIT TRAINING DECEMBER 2015
956949,11/11/2015,WINDOWS PHONE TRAINING AND DISTRIBUTION
956949,11/9/2015,EMERGENCY VEHICLE OPERATION JULY 07 - PRESENT
956949,11/9/2015,FIELD TRAINING PROGRAM JULY 07 - PRESENT
956949,11/9/2015,PHYSICAL EDUCATION PART 1: FOUNDATIONS OF PHYSICAL FITNESS
956949,11/9/2015,PHYSICAL EDUCATION PART 2: DEFENSIVE TACTICS JULY 07 - PRESENT
956949,11/9/2015,PHYSICAL EDUCATION PART 3: AMERICAN HEART ASSOCIATION BASIC LIFE SUPPORT
956949,11/9/2015,POLICE CRISIS INTERVENTION JULY 07 - PRESENT
956949,11/9/2015,POLICE FIELD PROBLEMS JULY 07 - PRESENT
956949,11/9/2015,POLICE INVESTIGATION AND REPORTING JULY 07 - PRESENT
956949,11/9/2015,POLICING A DEMOCRACY JULY 07 - PRESENT
956949,11/9/2015,POLICING SPECIAL POPULATIONS JULY 07 - PRESENT
956949,11/9/2015,PROCEDURAL LAW JULY 07 - PRESENT
956949,11/9/2015,SUBSTANTIVE LAW JULY 07 - PRESENT
956949,11/9/2015,TERRORISM AWARENESS AND RESPONSE JULY 07 - PRESENT
956949,4/22/2015,PTTD DEFENSIVE TACTICS PRACTICAL EXAM
956949,1/26/2015,20K TRAINING INITIATIVE - PHYSICAL TACTICS
956949,1/16/2015,20K TRAINING INITIATIVE - SMART POLICING
956949,1/8/2015,20K TRAINING INITIATIVE - FOUNDATIONS OF POLICING
956949,1/6/2015,POLICE ACADEMY RECRUIT JUSTIFICATION WRITTEN EXAM
956949,1/6/2015,POLICE ACADEMY RECRUIT NCIC WRITTEN EXAM
956949,1/6/2015,POLICE ACADEMY RECRUIT NIMS 700 WRITTEN EXAM
956949,1/6/2015,POLICE ACADEMY RECRUIT STOP QUESTION & FRISK WRITTEN EXAM
956949,12/26/2014,RECRUIT RAPID DEPLOYMENT-ACTIVE SHOOTER
956949,12/11/2014,POLICE ACADEMY RECRUIT CIMS WRITTEN EXAM
956949,12/10/2014,FIREARMS 5 DAY TACTICAL APPLICATION V1
956949,12/8/2014,POLICE ACADEMY RECRUIT 3RD TRIMESTER EXAM
956949,12/1/2014,RECRUIT RMP QUALIFICATION / RMP OPERATOR QUALIFIED
956949,11/17/2014,PTTD WATER SAFETY
956949,11/15/2014,PORT AWARENESS COURSE
956949,11/7/2014,FIREARMS 5 DAY TACTICAL SKILLS V1
956949,11/4/2014,OFF DUTY PISTOL CERTIFIED
956949,11/4/2014,RECRUIT TACTICAL FIREARMS QUALIFICATION AND TRAINING OFF DUTY PISTOL CERTIFIED
956949,10/28/2014,RECRUIT TRAINING COMPUTER COURSE
956949,10/24/2014,RECRUIT BASIC FIREARMS QUALIFICATION AND TRAINING
956949,10/16/2014,COBRA - COHORT TRAINING
956949,10/13/2014,FRISKING AND HANDCUFFING
956949,10/13/2014,GROUND TACTICS
956949,10/13/2014,PTTD EXPANDABLE BATON
956949,10/6/2014,POLICE ACADEMY RECRUIT 2ND TRIMESTER EXAM
956949,9/29/2014,PTTD WEAPONS DEFENSE
956949,9/17/2014,BATON
956949,9/4/2014,"PTTD CARDIO ENDURANCE TEST, 1ST ATTEMPT"
956949,8/25/2014,POLICE ACADEMY RECRUIT 1ST TRIMESTER EXAM
956949,8/22/2014,JOB STANDARDS TEST ATTEMPT #1
956949,8/22/2014,POLICE ACADEMY RECRUIT 1ST TRIMESTER PRACTICE WRITTEN EXAM
945678,6/23/2025,EAU 2025 POLICE COMMISSIONER JESSICA S. TISCH
945678,6/2/2025,FTS - CEW TASER 7 TRANSITION COURSE
945678,3/13/2025,LEAVING THE SCENE COLLISIONS INVESTIGATIVE BEST PRACTICES
945678,2/6/2025,ACTIVE SHOOTER - SCHOOL RESPONSE PROTOCOL
945678,1/30/2025,VEHICLE PURSUITS
945678,12/9/2024,DRIVING WHILE INTOXICATED AWARENESS VIDEO MODULE 1
945678,10/15/2024,NORTHWELL DIRECT FINEST CARE PROGRAM FOR UMOS
945678,8/22/2024,EMPLOYEE ASSISTANCE UNIT (E.A.U.) IS HERE FOR YOU- 2024
945678,8/22/2024,RAPE IS RAPE
945678,7/16/2024,2024 EQUAL EMPLOYMENT OPPORTUNITY TRAINING - SEXUAL HARASSMENT AWARENESS AND PREVENTION
945678,7/1/2024,LEVEL 1 AND LEVEL 2 INVESTIGATIVE ENCOUNTERS
945678,6/24/2024,DETECTIVE BUREAU BODY WORN CAMERAS
945678,4/12/2024,POLICING THE SUBWAY 2024
945678,3/18/2024,LGBTQIA PLUS - DIVERSITY AND INCLUSION
945678,10/4/2023,2023 SUMMER ALL-OUT BODY WORN CAMERA TRAINING
945678,9/26/2023,EFFECTIVE COMMUNICATION SKILLS - DEAF OR HARD OF HEARING
945678,7/11/2023,2023 EQUAL EMPLOYMENT OPPORTUNITY TRAINING-SEXUAL HARASSMENT AWARENESS AND PREVENTION
945678,7/11/2023,TRAFFIC COURT TESTIMONY VIDEO
945678,5/18/2023,NYPD-U VOLUNTARY - INVOLUNTARY TRANSPORTS
945678,8/14/2022,2022 EQUAL EMPLOYMENT OPPORTUNITY TRAINING-SEXUAL HARASSMENT AWARENESS AND PREVENTION
945678,7/6/2022,"INTEGRATING COMMUNICATION, ASSESSMENT, AND TACTICS (ICAT) MODULE 7"
945678,3/29/2022,"INTEGRATING COMMUNICATION, ASSESSMENT AND TACTICS (ICAT) MODULE 4"
945678,2/10/2022,"INTEGRATING COMMUNICATION, ASSESSMENT AND TACTICS (ICAT) MODULE 3"
945678,2/9/2022,ACTIVE BYSTANDERSHIP FOR LAW ENFORCEMENT (ABLE): ONE DAY COURSE
945678,12/17/2021,"INTEGRATING COMMUNICATION, ASSESSMENT AND TACTICS (ICAT) MODULE 1"
945678,12/17/2021,"INTEGRATING COMMUNICATION, ASSESSMENT AND TACTICS (ICAT) MODULE 2"
945678,12/8/2021,BODY-WORN CAMERA REVIEW PART ONE
945678,12/8/2021,BODY-WORN CAMERA REVIEW PART TWO
945678,10/26/2021,ARRESTS - RELIGIOUS HEAD COVERING GUIDELINES (PG 208-83)
945678,9/18/2021,INFORMATION SECURITY AWARENESS TRAINING 2021
945678,9/14/2021,MAYOR EXECUTIVE ORDER 78 VACCINATION - TESTING COMPLIANCE POLICY
945678,8/4/2021,EQUAL EMPLOYMENT OPPORTUNITY TRAINING - SEXUAL HARASSMENT AWARENESS AND PREVENTION 2021
945678,7/26/2021,EQUAL EMPLOYMENT OPPORTUNITY TRAINING - LGBTQIA+ DIVERSITY AND INCLUSION / EXECUTIVE ORDER 16 OF 201
945678,4/15/2021,BALLISTIC VEST MEASUREMENT PROGRAM
945678,3/18/2021,DESK APPEARANCE TICKETS: THE NEW LAW AND THE NEW GUIDELINES FOR PROCESSING DAT'S - 2021 REFRESHER
