taxid,date,name
944514,5/3/2022,HIGHWAY STATIONARY STEP-OUT LIDAR COURSE
944514,4/19/2022,ADVANCED ROADSIDE IMPAIRED DRIVING ENFORCEMENT
944514,4/19/2022,HIGHWAY DRUG IMPAIRED DRIVING COURSE
944514,4/8/2022,CLT-PROCEDURAL OPERATIONS
944514,4/5/2022,"INTEGRATING COMMUNICATION, ASSESSMENT AND TACTICS (ICAT) MODULE 5"
944514,4/4/2022,HIGHWAY 3-DAY STATIONARY STEP-OUT LIDAR COURSE
944514,4/4/2022,TINT-METER OPERATION TINTED WINDOW VIOLATIONS
944514,3/1/2022,"INTEGRATING COMMUNICATION, ASSESSMENT AND TACTICS (ICAT) MODULE 4"
944514,2/28/2022,CHEST SEAL DISTRIBUTION AND FAMILIARIZATION
944514,1/27/2022,ILLEGAL EVICTIONS
944514,1/3/2022,LOCAL LAW 45 OF 2021-TRAFFIC ENCOUNTERS
944514,12/22/2021,"INTEGRATING COMMUNICATION, ASSESSMENT AND TACTICS (ICAT) MODULE 3"
944514,12/14/2021,CLT-LEGAL ISSUES
944514,12/5/2021,IDENTIFYING THE IMPAIRED DRIVER
944514,11/17/2021,"INTEGRATING COMMUNICATION, ASSESSMENT AND TACTICS (ICAT) MODULE 1"
944514,11/17/2021,"INTEGRATING COMMUNICATION, ASSESSMENT AND TACTICS (ICAT) MODULE 2"
944514,10/30/2021,CLT-OCCUPATIONAL-WORKPLACE SAFETY AND HEALTH
944514,10/24/2021,ARRESTS - RELIGIOUS HEAD COVERING GUIDELINES (PG 208-83)
944514,10/13/2021,BODY-WORN CAMERA REVIEW PART TWO
944514,10/11/2021,ACTIVE BYSTANDERSHIP FOR LAW ENFORCEMENT (ABLE): ONE DAY COURSE
944514,9/19/2021,BODY-WORN CAMERA REVIEW PART ONE
944514,9/17/2021,CLT-PROCEDURAL OPERATIONS
944514,9/14/2021,INFORMATION SECURITY AWARENESS TRAINING 2021
944514,9/14/2021,OPIOID OVERDOSE RECOGNITION AND NARCAN ADMINISTRATION -2021
944514,9/13/2021,MAYOR EXECUTIVE ORDER 78 VACCINATION - TESTING COMPLIANCE POLICY
944514,9/8/2021,CLT-OCCUPATIONAL-WORKPLACE SAFETY AND HEALTH
944514,8/16/2021,BALLISTIC VEST DISTRIBUTION PROGRAM
944514,8/11/2021,CLT-OCCUPATIONAL-WORKPLACE SAFETY AND HEALTH
944514,7/23/2021,CLT-OCCUPATIONAL-WORKPLACE SAFETY AND HEALTH
944514,7/4/2021,EQUAL EMPLOYMENT OPPORTUNITY TRAINING - SEXUAL HARASSMENT AWARENESS AND PREVENTION 2021
944514,6/24/2021,CLT-OCCUPATIONAL-WORKPLACE SAFETY AND HEALTH
944514,5/20/2021,CLT-OCCUPATIONAL-WORKPLACE SAFETY AND HEALTH
944514,5/20/2021,CLT-PROCEDURAL OPERATIONS
944514,5/19/2021,OVERVIEW OF THE NEW DISCOVERY LAWS 2021 REFRESHER
944514,5/12/2021,PATROL GUIDE 215-17 POLICE ACTIONS RELATED QUESTIONING ARRESTS AND INVESTIGATIONS AT A NYC DEPARTMEN
944514,4/20/2021,EMPLOYEE ASSISTANCE UNIT-2021
944514,4/7/2021,CLT-OCCUPATIONAL-WORKPLACE SAFETY AND HEALTH
944514,4/7/2021,HIGHWAY PATROL AUTHORIZED TOW TRAINING
944514,4/5/2021,EQUAL EMPLOYMENT OPPORTUNITY TRAINING - LGBTQIA+ DIVERSITY AND INCLUSION / EXECUTIVE ORDER 16 OF 201
944514,3/3/2021,CLT-OCCUPATIONAL-WORKPLACE SAFETY AND HEALTH
944514,3/3/2021,DESK APPEARANCE TICKETS: THE NEW LAW AND THE NEW GUIDELINES FOR PROCESSING DAT'S - 2021 REFRESHER
944514,2/25/2021,EXECUTIVE HEALTH AND WELLNESS TRAINING - MODULE 9
944514,2/9/2021,CLT-OCCUPATIONAL-WORKPLACE SAFETY AND HEALTH
944514,2/9/2021,CLT-PROCEDURAL OPERATIONS
944514,1/24/2021,COVID VACCINE DISTRIBUTION AND EDUCATION
944514,1/16/2021,CLT-OCCUPATIONAL-WORKPLACE SAFETY AND HEALTH
944514,12/29/2020,HEALTH AND WELLNESS SECTION - NUTRITIONAL SERIES: DIETING FOR WEIGHT LOSS - MODULE 1 - INTRODUCTION
944514,12/10/2020,HEALTH AND WELLNESS SECTION - MYPLATE APP TUTORIAL
944514,12/6/2020,EQUAL EMPLOYMENT OPPORTUNITY TRAINING - LEAVE TO EXPRESS BREAST MILK
944514,10/25/2020,AXON FLEET TRAINING FOR HIGHWAY
944514,10/9/2020,CLT-OCCUPATIONAL-WORKPLACE SAFETY AND HEALTH
944514,9/24/2020,CLT-OCCUPATIONAL-WORKPLACE SAFETY AND HEALTH
944514,9/21/2020,HEALTH AND WELLNESS SECTION - FINANCIAL LITERACY SERIES - MODULE 2 - YOUR INCOME AND EXPENSES
944514,9/9/2020,HEALTH AND WELLNESS SECTION - MODULE 19 - STOP SMOKING - NYC ESCAPE PROGRAM
944514,9/1/2020,HEALTH AND WELLNESS SECTION - FINANCIAL LITERACY SERIES - MODULE 1 - YOUR MONEY VALUES AND INFLUENCE
944514,9/1/2020,HEALTH AND WELLNESS SECTION - MODULE 18 - YOGA MYTH BUSTING
944514,7/27/2020,HEALTH AND WELLNESS SECTION - MODULE 17 - FINANCIAL WILLS AND TRUSTS
944514,7/1/2020,NEW LAWS AFFECTING POLICE OFFICERS’ CRIMINAL AND CIVIL LIABILITY
944514,6/30/2020,"EQUAL EMPLOYMENT OPPORTUNITY TRAINING - SEXUAL HARASSMENT, AWARENESS AND PREVENTION"
944514,6/26/2020,HEALTH AND WELLNESS SECTION - MODULE 16 - GRIEF AND COPING
944514,6/26/2020,VICTIM BLAMING AND RELEASE OF INFORMATION TO THE MEDIA
944514,6/24/2020,HEALTH AND WELLNESS SECTION - MODULE 13 - MINDFULNESS
944514,6/24/2020,HEALTH AND WELLNESS SECTION - MODULE 15 - FINANCIAL WELLNESS PART 2
944514,6/23/2020,HEALTH AND WELLNESS SECTION - MODULE 14 - FINANCIAL WELLNESS PART 1
944514,6/22/2020,HEALTH AND WELLNESS SECTION - MODULE 12 - IN THAT DARK PLACE - AN OFFICER'S JOURNEY
944514,5/26/2020,COVID-19: PREPAREDNESS YOUR FAMILY AND HOME
944514,5/22/2020,HEALTH AND WELLNESS SECTION - MODULE 1 - PSYCHOLOGICAL HEALTH AND WELLNESS
944514,5/22/2020,HEALTH AND WELLNESS SECTION - MODULE 10 - SEEKING AND RECEIVING MENTAL HEALTH SUPPORT
944514,5/22/2020,HEALTH AND WELLNESS SECTION - MODULE 11 - HEALTH AND RESILIENCY
944514,5/22/2020,HEALTH AND WELLNESS SECTION - MODULE 2 - JOB COUNSELING AND STRESS
944514,5/22/2020,HEALTH AND WELLNESS SECTION - MODULE 3 - WARNING SIGNS
944514,5/22/2020,HEALTH AND WELLNESS SECTION - MODULE 4 - CUMULATIVE TRAUMA
944514,5/22/2020,HEALTH AND WELLNESS SECTION - MODULE 5 - GAINING PERSPECTIVE
944514,5/22/2020,HEALTH AND WELLNESS SECTION - MODULE 6 - COPING WITH SIGNS OF ANXIETY DEPRESSION
944514,5/22/2020,HEALTH AND WELLNESS SECTION - MODULE 7 - LEADING WITH COMPASSION
944514,5/22/2020,"HEALTH AND WELLNESS SECTION - MODULE 8 - WARNING SIGNS, SUPPORT AND OUTREACH"
944514,5/22/2020,HEALTH AND WELLNESS SECTION - MODULE 9 - MANAGING STRESS ON THE JOB
944514,5/12/2020,COVID-19: PREPAREDENESS
944514,5/12/2020,COVID-19: PROTECTIVE MASKS
944514,4/30/2020,SAFETY CONSIDERATIONS FOR PATROLLING THE NYC SUBWAY SYSTEM -DANGERS OF THE PLATFORM EDGE
944514,2/17/2020,UTILIZING BALLISTIC PROTECTION IN DEPARTMENT VEHICLES (4:09)
944514,2/10/2020,CRIMINAL JUSTICE BUREAU - GIGLIO MATERIAL DISCLOSURES UNDER THE NEW DISCOVERY LAWS
944514,1/23/2020,PRISONER ESCAPE WARNING SIGNS
944514,1/23/2020,SAFEGUARDING HOSPITALIZED PRISONERS
944514,1/23/2020,SUCCESSFULLY DISARMING AN EMOTIONALLY DISTURBED PERSON
944514,1/21/2020,PROCESSING DISCOVERY MATERIAL IN THE FORMS ARREST FOLDER
944514,1/3/2020,CROSSFIRE MITIGATION DURING CLOSE COMBAT INCIDENTS - PART 2
944514,12/24/2019,CLT-OCCUPATIONAL-WORKPLACE SAFETY AND HEALTH
944514,12/12/2019,INCREASE OFFICER SAFETY DURING VEHICLE STOPS
944514,12/10/2019,ACTIVITY LOG FOR IPHONE
944514,12/9/2019,CJB - DESK APPEARANCE TICKETS: THE NEW LAWS AND GUIDELINES FOR PROCESSING DATS
944514,12/9/2019,CJB - OVERVIEW OF THE NEW DISCOVERY LAWS
944514,12/9/2019,CROSSFIRE MITIGATION DURING CLOSE COMBAT INCIDENTS
944514,12/9/2019,SHIELD OF RESILIENCE TRAINING COURSE
944514,11/27/2019,RESPONDING TO COMMERCIAL ROBBERIES PART LL - MODULE 1 AND MODULE 2
944514,11/20/2019,CLT-OCCUPATIONAL-WORKPLACE SAFETY AND HEALTH
944514,11/15/2019,DISCHARGING YOUR FIREARM AT A MOVING THREAT
944514,11/7/2019,2017-2019 IN-SERVICE CYCLE-INVESTIGATIVE ENCOUNTERS- BASIC TRAINING WITH SCENARIOS
944514,11/6/2019,CLT-OCCUPATIONAL-WORKPLACE SAFETY AND HEALTH
944514,10/11/2019,CRIMINAL JUSTICE BUREAU - DNA TRAINING VIDEO
944514,10/11/2019,FORCE POLICY UPDATE VIDEO
944514,9/27/2019,CRITICAL DECISION MAKING MODEL
944514,9/25/2019,MARIJUANA POLICY UPDATE
944514,9/24/2019,CPS FAIR AND IMPARTIAL POLICING - ALL POS AND DETS
944514,9/18/2019,CLT-OCCUPATIONAL-WORKPLACE SAFETY AND HEALTH
944514,9/16/2019,CLT-OCCUPATIONAL-WORKPLACE SAFETY AND HEALTH
944514,9/16/2019,DOMESTIC VIOLENCE EDUCATION AND COUNSELING
944514,9/2/2019,SHIELD OF RESILIENCE TRAINING COURSE
944514,8/7/2019,CLT-OCCUPATIONAL-WORKPLACE SAFETY AND HEALTH
944514,8/7/2019,CRITICAL INCIDENT TACTICS - RESPONDING TO COMMERCIAL ROBBERIES (EXTENDED VERSION)
944514,8/7/2019,RESPONDING TO COMMERCIAL ROBBERIES
944514,8/1/2019,TRANSIT BUREAU - TIMELY RESUMPTION OF SERVICE IN NYC TRANSIT
944514,7/18/2019,CLT-OCCUPATIONAL-WORKPLACE SAFETY AND HEALTH
944514,7/15/2019,TRANSIT BUREAU - SAFETY CONSIDERATIONS FOR PATROLLING THE NYC SUBWAY SYSTEM
944514,7/15/2019,TRANSIT BUREAU - SAFETY CONSIDERATIONS FOR PATROLLING THE NYC SUBWAY SYSTEM - PART 2
944514,7/11/2019,CPS BODY-WORN CAMERA TRAINING WITH SCENARIOS
944514,6/24/2019,DISCUSSION - BASED LEARNING MODULE # 1-3
944514,6/24/2019,RESPONDING TO PEOPLE IN CRISIS – MODULE 4: USING DEPARTMENT MOBILE DIGITAL DEVICES
944514,6/17/2019,WORLDPRIDE NYC 2019
944514,5/28/2019,NEW PERFORMANCE EVALUATION PROCESS
944514,5/27/2019,COLLABORATIVE POLICING - MEDIATION REFERRAL PROGRAM FOR NON-CRIMINAL COMPLAINTS
944514,5/7/2019,COUNTERTERRORISM BUREAU ACTIVE SHOOTER SCHOOL INCIDENTS AWARENESS
944514,5/7/2019,RESPONDING TO PEOPLE IN CRISIS - MODULES 2 AND 3: ACTIVE LISTENING PARTS 1 AND 2
944514,4/30/2019,COUNTERTERRORISM BUREAU NH15 TRAINING
944514,4/15/2019,COLLABORATIVE POLICING - THE DEAF AND HARD OF HEARING COMMUNITY
944514,4/5/2019,SAFEGUARDING PRISONERS - OFFICER SAFETY GUIDELINES
944514,4/1/2019,LEGAL BUREAU - PERJURY TRAINING MODULE
944514,3/28/2019,"SUPPORT SERVICES DIVISION - CLASS ""C"" OPERATOR"
944514,3/27/2019,CLT-OCCUPATIONAL-WORKPLACE SAFETY AND HEALTH
944514,3/14/2019,COLLABORATIVE POLICING - ELDER ABUSE
944514,1/23/2019,CLT-PROCEDURAL OPERATIONS
944514,1/18/2019,CLT-OCCUPATIONAL-WORKPLACE SAFETY AND HEALTH
944514,1/15/2019,RESPONDING TO PEOPLE IN CRISIS - MODULE 1: SENDING THE RIGHT SIGNALS
944514,1/4/2019,EQUAL EMPLOYMENT OPPORTUNITYTRAINING - SEXUAL HARASSMENT AWARENESS AND PREVENTION
944514,1/2/2019,CLT-INFORMATION TECHNOLOGY
944514,12/20/2018,CLT-SPECIAL POPULATIONS
944514,12/18/2018,MARIJUANA BURNING ENFORCEMENT POLICY
944514,12/13/2018,CLT-OCCUPATIONAL-WORKPLACE SAFETY AND HEALTH
944514,11/16/2018,CLT-OCCUPATIONAL-WORKPLACE SAFETY AND HEALTH
944514,11/14/2018,PSB MARIJUANA FIELD TESTING
944514,11/6/2018,AMERICANS WITH DISABILITIES ACT (ADA)
944514,10/16/2018,RESPONDING TO PEOPLE IN CRISIS-INTRODUCTION TO CIT VIDEO SERIES
944514,10/5/2018,NYC RIGHT TO KNOW ACT LEGISLATION - PART 2
944514,10/5/2018,NYC RIGHT TO KNOW ACT LEGISLATION – PART 1
944514,10/3/2018,CLT-OCCUPATIONAL-WORKPLACE SAFETY AND HEALTH
944514,9/5/2018,RAISE THE AGE
944514,9/4/2018,CLT-OCCUPATIONAL-WORKPLACE SAFETY AND HEALTH
944514,8/6/2018,CLT-ENFORCEMENT ACTIONS
944514,8/2/2018,CLT-OCCUPATIONAL-WORKPLACE SAFETY AND HEALTH
944514,6/6/2018,CLT-COMMUNITY ENGAGEMENT
944514,6/6/2018,CLT-COUNTERTERRORISM AND INTELLIGENCE
944514,6/6/2018,CLT-ENFORCEMENT ACTIONS
944514,6/6/2018,CLT-HUMAN RESOURCES AND PERSONNEL MATTERS
944514,6/6/2018,CLT-LEGAL ISSUES
944514,6/6/2018,CLT-OCCUPATIONAL-WORKPLACE SAFETY AND HEALTH
944514,6/6/2018,CLT-PROCEDURAL OPERATIONS
944514,6/6/2018,COMMUNICATIONS- THE PROPER USAGE OF THE IDA RADIO CODES
944514,5/9/2018,CLT-COUNTERTERRORISM AND INTELLIGENCE
944514,5/9/2018,CLT-INFORMATION TECHNOLOGY
944514,5/9/2018,CLT-OCCUPATIONAL-WORKPLACE SAFETY AND HEALTH
944514,5/9/2018,CLT-PROCEDURAL OPERATIONS
944514,5/9/2018,CLT-PROFESSIONAL DEVELOPMENT
944514,5/9/2018,CLT-SPECIAL POPULATIONS
944514,5/9/2018,"CLT-UNIFORMS, PERSONAL APPEARANCE AND EQUIPMENT"
944514,4/11/2018,CLT-COUNTERTERRORISM AND INTELLIGENCE
944514,4/11/2018,CLT-DOCUMENTATION AND FORMS
944514,4/11/2018,"CLT-INTEGRITY, ETHICS AND DISCIPLINE"
944514,4/11/2018,CLT-LEGAL ISSUES
944514,4/11/2018,CLT-MEMBER-EMPLOYEE WELLNESS
944514,4/11/2018,CLT-OCCUPATIONAL-WORKPLACE SAFETY AND HEALTH
944514,4/11/2018,CLT-PROCEDURAL OPERATIONS
944514,4/11/2018,CLT-TACTICAL AWARENESS AND OFFICER SAFETY
944514,4/10/2018,HIGHWAY ANNUAL TRAINING PRESENTATION - 2018
944514,4/9/2018,COLLABORATIVE POLICING- HUMAN TRAFFICKING
944514,3/29/2018,DRAGER DRUGTEST 5000 - OPERATOR
944514,3/29/2018,DWI DETECTION AND STANDARDIZED FIELD SOBRIETY TESTING
944514,3/8/2018,"COUNTERTERRORISM BUREAU FACILITY AWARENESS- THE INTREPID SEA, AIR AND SPACE MUSEUM"
944514,2/20/2018,LEGAL BUREAU PERFORMANCE METRICS - PROHIBITED CONDUCT
944514,1/26/2018,COUNTERTERRORISM PERSONAL RADIATION DETECTION COURSE
944514,1/23/2018,POLICE COMMISSIONER MESSAGE- NYC GIVES
944514,1/15/2018,NEW YEAR'S EVE TACTICAL AWARENESS
944514,1/3/2018,CLT-EQUAL EMPLOYMENT OPPORTUNITY
944514,12/11/2017,COLLABORATIVE POLICING- FOREIGN LANGUAGE CERTIFICATION VIDEO
944514,12/11/2017,COUNTERTERRORISM BUREAU INITIAL PATROL RESPONSE FOR ACTIVE SHOOTER
944514,12/11/2017,"HIGHWAY DISTRICT ""JUST DON'T DO IT"""
944514,10/13/2017,NARCAN NASAL SPRAY TRAINING
944514,10/6/2017,COLLABORATIVE POLICING- ACCESSING TELEPHONIC INTERPRETERS VIA LANGUAGE LINE
944514,8/28/2017,PATROL- POLYCARBONATE SHIELD
944514,8/21/2017,ADVANCED NARCOTICS INVESTIGATION COURSE (HIDTA)
944514,8/10/2017,INFORMATION SECURITY AWARENESS TRAINING
944514,8/2/2017,COUNTERTERRORISM BUREAU FACILITY AWARENESS VIDEO- TIME WARNER BUILDING
944514,8/2/2017,COUNTERTERRORISM BUREAU FACILITY AWARENESS VIDEO-EMPIRE STATE BUILDING
944514,7/18/2017,POLICE COMMISSIONERS MESSAGE - VICTIMS OF SEXUAL ASSAULT VIDEO
944514,7/17/2017,PERSONNEL BUREAU NYPD EMPLOYEE ASSISTANCE UNIT (EAU)
944514,6/23/2017,BTK (BELT TRAUMA KIT DISTRIBUTION AND FAMILIARIZATION)
944514,6/16/2017,"CPS INTERIOR PATROL OF HOUSING AUTHORITY BUILDINGS, PG 212-60 ROLL CALL VIDEO 1"
944514,6/16/2017,"CPS INTERIOR PATROL OF HOUSING AUTHORITY BUILDINGS, PG 212-60 ROLL CALL VIDEO 2"
944514,6/5/2017,CPS INTERIOR PATROL TRESPASS AFFIDAVIT PROGRAM (TAP) VIDEO 1
944514,6/5/2017,CPS INTERIOR PATROL TRESPASS AFFIDAVIT PROGRAM (TAP) VIDEO 2
944514,5/23/2017,CRIME CONTROL STRATEGIES- COMMUNITY SUPERVISION
944514,5/23/2017,DAS OVERLAPPING LAYERS TUTORIAL
944514,5/23/2017,LOCATING APPLE DEVICES USING YOUR DEPARTMENT SMARTPHONE
944514,5/23/2017,TRAINING MATERIALS- CLOSING THE GAP ON VEHICLE INTELLIGENCE
944514,5/23/2017,TRAINING MATERIALS- VIRTUAL CRIME INFORMATION CENTER
944514,5/12/2017,CRIMINAL JUSTICE REFORM ACT ROLL CALL TRAINING PART 1
944514,5/12/2017,CRIMINAL JUSTICE REFORM ACT ROLL CALL TRAINING PART 2
944514,5/12/2017,EQUAL EMPLOYMENT OPPORTUNITY TRANSGENDER DIVERSITY AND INCLUSION:EXECUTIVE ORDER 16
944514,5/12/2017,TACTICAL AWARENESS OF EXCITED DELIRIUM SYNDROME
944514,5/12/2017,TACTICAL AWARENESS- BALLISTIC VEST
944514,3/20/2017,DETECTIVE BUREAU 2017-01 INVESTIGATIVE INTAC UTV
944514,2/1/2017,COUNTERTERRORISM ACTIVE SHOOTER TRAINING
944514,2/1/2017,TACTICAL AWARENESS-SMARTPHONE SAFETY
944514,1/30/2017,BELT TRAUMA KIT VIDEO
944514,1/30/2017,COUNTERTERRORISM U.A.S. (UNMANNED AIRCRAFT SYSTEMS) DRONE AWARENESS
944514,1/9/2017,HATE CRIMES AND BIAS-RELATED INCIDENTS
944514,12/7/2016,DETECTIVE BUREAU PROFESSIONAL DEVELOPMENT SEMINAR
944514,12/7/2016,FLYING WHILE ARMED
944514,9/2/2016,PUBLIC CONTACT AND CONSENT TO SEARCH (RIGHT TO KNOW) - UNIT TRAINING AUGUST 2016
944514,8/25/2016,FORCE POLICY REVISION-VIDEO-PG 221-UNIT TRAINING MAY 2016
944514,8/25/2016,INVESTIGATIVE ENCOUNTERS-VIDEO #1 REQUEST FOR INFO-UNIT TRAINING FEB 2016
944514,8/25/2016,INVESTIGATIVE ENCOUNTERS-VIDEO #2 COMMON LAW RIGHT OF INQUIRY-UNIT TRAINING MAY 2016
944514,8/25/2016,INVESTIGATIVE ENCOUNTERS-VIDEO #3 TERRY STOPS AND REASONABLE SUSPICION-UNIT TRAINING JUNE 2016
944514,8/25/2016,INVESTIGATIVE ENCOUNTERS-VIDEO #4 DOCUMENTATION AND SUPERVISION-UNIT TRAINING JULY 2016
944514,8/3/2016,INVESTIGATIVE ENCOUNTERS-VIDEO #1 REQUEST FOR INFO-UNIT TRAINING FEB 2016
944514,8/3/2016,INVESTIGATIVE ENCOUNTERS-VIDEO #2 COMMON LAW RIGHT OF INQUIRY-UNIT TRAINING MAY 2016
944514,8/3/2016,INVESTIGATIVE ENCOUNTERS-VIDEO #3 TERRY STOPS AND REASONABLE SUSPICION-UNIT TRAINING JUNE 2016
944514,8/3/2016,INVESTIGATIVE ENCOUNTERS-VIDEO #4 DOCUMENTATION AND SUPERVISION-UNIT TRAINING JULY 2016
944514,6/21/2016,ALERRT-ACTIVE SHOOTER LEVEL I (CTD)
944514,4/8/2016,20K TRAINING INITIATIVE - PHYSICAL TACTICS
944514,4/6/2016,WINDOWS PHONE TRAINING AND DISTRIBUTION
944514,3/11/2016,DETECTIVE BUREAU PROFESSIONAL DEVELOPMENT SEMINAR
944514,3/11/2016,FORCE POLICY REVISION-PAMPHLET - PG 221 - UNIT TRAINING DECEMBER 2015
944514,2/10/2016,INVESTIGATIVE ENCOUNTERS-VIDEO #1 REQUEST FOR INFO-UNIT TRAINING FEB 2016
944514,11/30/2015,FORCE POLICY REVISION-PAMPHLET - PG 221 - UNIT TRAINING DECEMBER 2015
944514,11/9/2015,EMERGENCY VEHICLE OPERATION JULY 07 - PRESENT
944514,11/9/2015,FIELD TRAINING PROGRAM JULY 07 - PRESENT
944514,11/9/2015,PHYSICAL EDUCATION PART 1: FOUNDATIONS OF PHYSICAL FITNESS
944514,11/9/2015,PHYSICAL EDUCATION PART 2: DEFENSIVE TACTICS JULY 07 - PRESENT
944514,11/9/2015,PHYSICAL EDUCATION PART 3: AMERICAN HEART ASSOCIATION BASIC LIFE SUPPORT
944514,11/9/2015,POLICE CRISIS INTERVENTION JULY 07 - PRESENT
944514,11/9/2015,POLICE FIELD PROBLEMS JULY 07 - PRESENT
944514,11/9/2015,POLICE INVESTIGATION AND REPORTING JULY 07 - PRESENT
944514,11/9/2015,POLICING A DEMOCRACY JULY 07 - PRESENT
944514,11/9/2015,POLICING SPECIAL POPULATIONS JULY 07 - PRESENT
944514,11/9/2015,PROCEDURAL LAW JULY 07 - PRESENT
944514,11/9/2015,SUBSTANTIVE LAW JULY 07 - PRESENT
944514,11/9/2015,TERRORISM AWARENESS AND RESPONSE JULY 07 - PRESENT
944514,2/6/2015,INTRODUCTION TO MICROSOFT POWERPOINT
944514,1/11/2013,METHODS OF INSTRUCTION
944514,6/20/2011,DIGNITARY PROTECTION COURSE
944514,3/3/2011,HIGHWAY PRELIMINARY BREATH TEST INSTRUMENT TRAINING - PBT
944514,2/23/2011,PROPERTY EVIDENCE TRACKING SYSTEM
944514,11/3/2007,COBRA - COHORT TRAINING
944514,7/9/2007,12 PASSENGER VAN / UTILITY VEHICLE QUALIFICATION
944514,7/9/2007,FOUR WHEEL DRIVE TRAINING
944514,,FOUR WHEEL DRIVE TRAINING
944514,,RECRUIT 12 PASSENGER VAN / UTILITY VEHICLE QUALIFICATION
944514,,RECRUIT RMP QUALIFICATION / RMP OPERATOR QUALIFIED
926777,8/27/2025,2025 BWC PROFICIENCY TRAINING
926777,8/27/2025,NYPD JOUVERT AND WEST INDIAN DAY-2025
926777,8/27/2025,PATROL TACTICS
926777,8/27/2025,SPECIAL VICTIMS UNIT - BEST PRACTICES GUIDE TRAINING
926777,6/10/2025,EAU 2025 POLICE COMMISSIONER JESSICA S. TISCH
926777,6/3/2025,2025 EQUAL EMPLOYMENT OPPORTUNITY TRAINING - SEXUAL HARASSMENT AWARENESS AND PREVENTION
926777,6/3/2025,SQF REVIEW AND DOCUMENTATION: SQF MODULE 10
926777,2/28/2025,2025 IDENTIFYING THE IMPAIRED DRIVER REFRESHER
926777,2/28/2025,FTS - CEW TASER 7 TRANSITION COURSE
926777,2/28/2025,FTS - TASER 7 HOLSTER DISTRIBUTION
926777,2/26/2025,LEAVING THE SCENE COLLISIONS INVESTIGATIVE BEST PRACTICES
926777,2/7/2025,INFORMATION SECURITY AWARENESS TRAINING 2024
926777,1/29/2025,ACTIVE SHOOTER - SCHOOL RESPONSE PROTOCOL
926777,1/29/2025,CELL BLOCK FIRESHIELD EV BLANKETS
926777,1/29/2025,KEVIN AND AVONTE SAFE HOME PROGRAM
926777,1/29/2025,MULTI-FACTOR AUTHENTICATION MFA TRAINING
926777,1/29/2025,RIGHT TO KNOW ACT SQF MODULE 9
926777,1/29/2025,VEHICLE PURSUITS
926777,12/11/2024,DRIVING WHILE INTOXICATED AWARENESS VIDEO MODULE 1
926777,12/11/2024,NOTIFICATION OF ALLEGATIONS AND EMPLOYEE RIGHTS
926777,12/4/2024,BEHAVIORAL HEALTH EMERGENCY ASSISTANCE RESPONSE DIVISION B-HEARD
926777,10/3/2024,FAMILY BUILDING
926777,9/30/2024,NORTHWELL DIRECT FINEST CARE PROGRAM FOR UMOS
926777,9/26/2024,CRISIS INTERVENTION TEAM TRAINING
926777,9/23/2024,APX NEXT PORTABLE AND RADIO DISCIPLINE TRAINING VIDEO
926777,9/23/2024,MENTAL HEALTH INVOLUNTARY REMOVALS MHL 9.41 AND MHL 9.58
926777,9/23/2024,UNMANNED AIRCRAFT SYSTEMS VISUAL OBSERVER
926777,9/10/2024,CLT-DOMESTIC VIOLENCE TRAINING
926777,8/27/2024,RACIAL PROFILING AND BIASED BASED POLICING: SQF MODULE 8
926777,8/27/2024,RAPE IS RAPE
926777,7/1/2024,2024 EQUAL EMPLOYMENT OPPORTUNITY TRAINING - SEXUAL HARASSMENT AWARENESS AND PREVENTION
926777,7/1/2024,ACCURATE COMPLAINT REPORT CLASSIFICATION
926777,7/1/2024,ASSISTING SURVIVORS OF SEXUAL BASED VIOLENCE WITH ACCESS TO RESOURCES
926777,7/1/2024,DRIVE SMART 2024
926777,7/1/2024,HOUSING BUREAU INTERIOR PATROL TACTICS
926777,7/1/2024,LEVEL 1 AND LEVEL 2 INVESTIGATIVE ENCOUNTERS
926777,7/1/2024,TACTICS WHEN ENGAGING INDIVIDUALS IN A MENTAL HEALTH CRISIS
926777,4/11/2024,CLT-SPECIAL POPULATIONS
926777,4/11/2024,"CLT-UNIFORMS, PERSONAL APPEARANCE AND EQUIPMENT"
926777,4/10/2024,POLICING THE SUBWAY 2024
926777,4/2/2024,CLT - OATH VS. CRIMINAL COURT SUMMONS ROLL CALL TRAINING
926777,3/13/2024,2024 VEHICLE SEIZURE FORM REFRESHER
926777,3/13/2024,AUTISM SPECTRUM DISORDER
926777,3/13/2024,ELDER ABUSE -2023 REFRESHER
926777,3/13/2024,EMPLOYEE ASSISTANCE UNIT (E.A.U.) IS HERE FOR YOU- 2024
926777,3/13/2024,INVESTIGATIVE ENCOUNTERS 2023: MODULE 5 SQF LEVELS 3 AND 4
926777,3/13/2024,INVESTIGATIVE ENCOUNTERS SUMMARY: SQF MODULE 6
926777,3/13/2024,LGBTQIA PLUS - DIVERSITY AND INCLUSION
926777,3/13/2024,NYCHA INTERIOR PATROL: SQF MODULE 7
926777,3/13/2024,OPIOID DANGERS- FENTANYL AND CARFENTANIL
926777,2/19/2024,"CLT-UNIFORMS, PERSONAL APPEARANCE AND EQUIPMENT"
926777,11/20/2023,AUGMENTED REALITY FEATURE
926777,10/27/2023,2023 SUMMER ALL-OUT BODY WORN CAMERA TRAINING
926777,10/27/2023,EFFECTIVE COMMUNICATION SKILLS - DEAF OR HARD OF HEARING
926777,10/27/2023,INFORMATION SECURITY AWARENESS TRAINING - 2023
926777,10/27/2023,NYPD RECRUITMENT TRAINING VIDEO
926777,10/27/2023,UNMANNED AIRCRAFT PERMIT: DRONES FOR PUBLIC USE
926777,10/27/2023,VEHICLE MOUNTED VIDEO SYSTEM
926777,8/31/2023,TRAFFIC COURT TESTIMONY VIDEO
926777,8/30/2023,NYPD JOUVERT AND WEST INDIAN DAY-2023
926777,6/11/2023,VIDEO 3 - TACTICAL CONSIDERATIONS FOR TRANSIT PATROL 2022 (PART 2)
926777,6/9/2023,2023 LANGUAGE MATTERS - FOSTERING A POSITIVE WORK ENVIRONMENT
926777,6/9/2023,"INVESTIGATIVE ENCOUNTERS 2023: MODULE 4 SQF LEVELS 2, 3 AND 4"
926777,5/19/2023,2023 EQUAL EMPLOYMENT OPPORTUNITY TRAINING-SEXUAL HARASSMENT AWARENESS AND PREVENTION
926777,5/7/2023,SRG - RAPID MOBILIZATION (PATROL) LEVEL 4
926777,4/10/2023,INVESTIGATIVE ENCOUNTERS 2023: MODULE 3 SQF LEVEL 2
926777,4/3/2023,ESPER POLICY LIBRARY
926777,4/3/2023,RAISING THE LOWER AGE OF JUVENILE DELINQUENCY
926777,3/21/2023,DOCUMENT INSPECTION FOR LAW ENFORCEMENT (PER-383)
926777,2/22/2023,INFORMATION SECURITY CRIMINAL JUSTICE TRAINING 2023
926777,2/15/2023,DRONE ASSESSMENT AND RESPONSE TACTICS (AWR-404)
926777,2/1/2023,AWARENESS AND RESPONSE TO BIOLOGICAL INCIDENTS
926777,1/31/2023,INVESTIGATIVE ENCOUNTERS 2023: MODULE 2 SQF LEVEL 1
926777,1/31/2023,NYPD-U VOLUNTARY - INVOLUNTARY TRANSPORTS
926777,1/31/2023,VIDEO 2 -TACTICAL CONSIDERATIONS FOR TRANSIT PATROL 2022 (PART 1)
926777,12/14/2022,INVESTIGATIVE ENCOUNTERS 2023 - MODULE 1 INTRODUCTION TO SQF
926777,12/14/2022,VIDEO 1 - PATROLLING THE NYC SUBWAY SYSTEM 2022
926777,12/14/2022,VIDEO 4 - PLATFORM SAFETY 2022
926777,12/13/2022,"HME - HOMEMADE EXPLOSIVES: AWARENESS, RECOGNITION, AND RESPONSE"
926777,11/2/2022,LGBTQIA PLUS AWARENESS
926777,10/7/2022,BELT-WORN TRAUMA KIT REFRESHER TRAINING VIDEO-2022
926777,10/7/2022,"INTEGRATING COMMUNICATION, ASSESSMENT, AND TACTICS (ICAT) MODULE 7"
926777,10/7/2022,PROCESSING CIVILIAN COMPLAINTS
926777,9/19/2022,CLT-CRIME CONTROL STRATEGIES AND PROBLEM SOLVING
926777,9/8/2022,THE EMPLOYEE ASSISTANCE UNIT (EAU) IS HERE FOR YOU
926777,8/29/2022,NYPD JOUVERT  WEST INDIAN DAY
926777,8/20/2022,CLT-PROPERTY
926777,8/3/2022,CLT-PROCEDURAL OPERATIONS
926777,7/29/2022,CAR STOP TACTICS FOR PATROL OFFICERS - MODULE 4: THE HIGH-RISK STOP
926777,7/8/2022,2022 EQUAL EMPLOYMENT OPPORTUNITY TRAINING-SEXUAL HARASSMENT AWARENESS AND PREVENTION
926777,7/8/2022,CONVICTED OFFENDER DNA DATABANK SPECIMEN COLLECTION KIT
926777,7/8/2022,"INTEGRATING COMMUNICATION, ASSESSMENT AND TACTICS (ICAT) MODULE 6"
926777,7/8/2022,VEHICLE SEIZURE FORM
926777,6/30/2022,"AXON BODY-WORN CAMERA TRAINING - CAMERA OPERATION, AXON VIEW AND EVIDENCE.COM (REQUIRED FOR LE4 COMM"
926777,6/25/2022,CLT-PROFESSIONAL DEVELOPMENT
926777,6/18/2022,CLT-COMMUNITY ENGAGEMENT
926777,6/18/2022,CLT-ENFORCEMENT ACTIONS
926777,6/18/2022,CLT-INFORMATION TECHNOLOGY
926777,6/18/2022,CLT-NIBRS ROLL CALL TRAINING
926777,6/18/2022,CLT-OCCUPATIONAL-WORKPLACE SAFETY AND HEALTH
926777,6/17/2022,CAR STOP TACTICS FOR PATROL OFFICERS - MODULE 2: PROHIBITED MANEUVERS
926777,6/17/2022,CAR STOP TACTICS FOR PATROL OFFICERS - MODULE 3: THE UNKNOWN RISK STOP
926777,6/17/2022,CLT-TACTICAL AWARENESS AND OFFICER SAFETY
926777,6/16/2022,CAR STOP TACTICS FOR PATROL OFFICERS - MODULE 1: CONTROLLING THE STOP
926777,6/2/2022,BEST PRACTICES IN STRUCTURED INTERVIEWING
926777,6/2/2022,NATIONAL INCIDENT-BASED REPORTING SYSTEM (NIBRS) UPDATES TO THE OMNIFORM COMPLAINT SYSTEMV
926777,5/26/2022,NYC 311 DYNAMICS SYSTEM
926777,5/26/2022,PROHIBITED METHODS OF RESTRAINT
926777,5/5/2022,CLT-PROPERTY
926777,4/27/2022,CLT-SEARCHING PRISONERS MODULE 1
926777,4/27/2022,"INTEGRATING COMMUNICATION, ASSESSMENT AND TACTICS (ICAT) MODULE 5"
926777,4/19/2022,CLT-DOCUMENTATION AND FORMS
926777,4/19/2022,CLT-LEGAL ISSUES
926777,4/19/2022,CLT-PROCEDURAL OPERATIONS
926777,4/7/2022,CLT-BWC POLICY UPDATES
926777,4/7/2022,CLT-DOCUMENTATION AND FORMS
926777,4/7/2022,CLT-PROCEDURAL OPERATIONS
926777,4/7/2022,CLT-TACTICAL AWARENESS AND OFFICER SAFETY
926777,4/7/2022,"CLT-UNIFORMS, PERSONAL APPEARANCE AND EQUIPMENT"
926777,3/31/2022,CLT-DOCUMENTATION AND FORMS
926777,3/31/2022,CLT-OCCUPATIONAL-WORKPLACE SAFETY AND HEALTH
926777,3/31/2022,CLT-SEARCHING PRISONERS MODULE 1
926777,3/30/2022,CLT-DOCUMENTATION AND FORMS
926777,3/30/2022,CLT-ENFORCEMENT ACTIONS
926777,3/30/2022,CLT-OCCUPATIONAL-WORKPLACE SAFETY AND HEALTH
926777,3/30/2022,CLT-PROCEDURAL OPERATIONS
926777,3/30/2022,CLT-TACTICAL AWARENESS AND OFFICER SAFETY
926777,3/30/2022,"CLT-UNIFORMS, PERSONAL APPEARANCE AND EQUIPMENT"
926777,3/24/2022,CLT-BWC POLICY UPDATES
926777,3/24/2022,CLT-EJUSTICE ORDER OF PROTECTION SEARCH
926777,3/24/2022,CLT-EPERMIT SYSTEM
926777,3/23/2022,CLT-DOCUMENTATION AND FORMS
926777,3/23/2022,CLT-ENFORCEMENT ACTIONS
926777,3/23/2022,CLT-PROCEDURAL OPERATIONS
926777,3/23/2022,CLT-TACTICAL AWARENESS AND OFFICER SAFETY
